review,date
den sonra türkiye ye ithal edilen araçlarda çarpışma önleme zorunlu hatırlıyorum,26.08.2023
ayar menüsünde ona ait bi ayar yok büyük ihtimalle boş,26.08.2023
sonrasında problem giredildi hatta sonrası problem yok psa grubu motoru corsadan e astradan e aircross tan grandland e son e koydu kronik arızalı motoru modele koysunlar,26.08.2023
kiralama şirketi teslim ediyor,26.08.2023
bagaj hacmi multimedia ekranı büyük fark multimedia ekranı büyük nem içeriği zengin donanım isimleri aynı fakat içerik konusunda zengin bunların dışında fark yok,26.08.2023
size teslim edilen araçta kamera olur kesin,26.08.2023
umarım vardır aksi takdirde geniş görünüyor hele i̇stanbul park biraz sorun olacak,26.08.2023
keşke bayilerde olsa beklemeden pazarlık ederek alabilme şansımız olsa eskisi,26.08.2023
araç yok bildiğim bayiyi aradım araç yok bulan varsa bana özelden yazsın lütfen,26.08.2023
lerde kablosuz play yok,26.08.2023
shine bold donanımlı versiyon lakin dizel yerine benzinli tavsiye ederim aradaki tl farka değmezayrıca faizsiz kredi var veriliyor lakin araç yok yarın maalesef eliniz boş döneceksiniz şerbet bile vermezler,26.08.2023
hocam mesela krediyi versinler araç ay sonra gelsin bi durum olur,26.08.2023
kredi ön onayı alınır şekilde beklenir kredi çıkar psa finans garanti bankası teb çalışıyor krediyi problem etmeyin asıl problem aracı bulmak,26.08.2023
şimdi tekrar baktım lerde kablosuz var yazıyor katalogta lerde yoktu lerde var yazmaya başlamıştır hocam sizi yanıltmıyım gelişmeden haberim yoktu bi araştırıyım,26.08.2023
resime gitmek tıklayın estağfurullah sürekli değişkenlik gösteriyor haklısınız shine shine bold var gösteriyor bayide öyle söylemişti ancak bir türlü bağlayamadım oysa kabloyu takar takmaz geliyor bluetooth direk bağlanıyor uygulamaya bile hızla bağlanıyor sorun yaşatmadı ancak kablosuz carplay bir türlü olmuyor,26.08.2023
bende shine kullanıyorum kablosuz carplay yok internet sitesinde var yazıyor dediğimde müşteri hizmetleri mart den itibaren üretilenlerde olacak dedi,26.08.2023
aynı yıl üretilen araçlarda böyle bir fark olur saçma geldi ben aradım servisle görüşün diyorlar şimdi onlar aktif ediyor anlamadım,26.08.2023
konuda yenisiniz çip krizi bahanesiyle bir donanım farkları oluyor firma belirtilen özellikleri değiştirme hakkını kullanarak neredeyse partide farklı özellikte araç getiriyor,26.08.2023
shine bold özel bir durum değil hepsinde var d iken stop edince kendi p alır el frenini çeker,19.08.2023
zarar değil ancak bir kaç yerde farklı araçlar muayeneden geçememeye sebep olduğunu okudum teyit etmek istedim neye göre hesaplandığını,19.08.2023
citroen mail i aktiv ediyoruz,19.08.2023
allah başka dert vermesin,19.08.2023
amin kimseye vermesin hayırlı ramazanlar,19.08.2023
ayarlarkişiselleştirmeekran kişiselleştirme i̇stediğiniz kadar hız göstergesi paneline ekran ekleyebiliriz boş ekran bile olabiliyortelefon misali resime gitmek tıklayın resime gitmek tıklayın resime gitmek tıklayın resime gitmek tıklayın,19.08.2023
harikasınız teşekkür ediyorum,19.08.2023
bende ayarlar menüsü yok,19.08.2023
sanırım sizinki,19.08.2023
diğer arkadaş sormuştu modeli ona anlattım,19.08.2023
merhaba lerde feel bold dizel olanlarda kamera standart geliyor gördüğüm kadarı sahibinden hepsinde kamera var sitesinde üst palette yazmakta,26.08.2023
sitesinde öyle yazıyor ilk gelen lerde feel bold lar kameralı shine lar inç li lastik jantlar geldi i̇lanlarda ekstra inç lastiğe kadar ödedim kamera ekstra felan yazdığına bakmayın öyle geldi ilk seriler şansa bayiler ekstra para vs istemedi bunlar,26.08.2023
cuma kadar teslim edecekler ben umarım vardır bekliyorum model olarak belirttiler,26.08.2023
teşekkür ederim yanıt ilginiz ancak ayarlarda bulamadım ben bir cahile anlatır anlatabilir misiniz adım adım müsait olunca,19.08.2023
ben aircross kullandım aynı motor motor sesi rahatsız etti sınıf farkı var bir kaput altına keçe bile koymamışlar ac bunlar yeterli yalıtım sağlar bilemiyorum,19.08.2023
aircross kullanmış olarak arasında sessizlik anlamında baya fark var diyebilirim hocam konforda zaten ayrı bir fark var izolasyon başarılı konuyu dağıtmak istemem motor konusunda aynı motor olmasına rağmen sessizi mokka bence konfor konusunda aircross mokka corsa ların motorlarını tecrübe etmiş olarak söylüyorum,19.08.2023
maalesef fan sesi motor sesi biraz fazla baş mesafesi iç ferahlığı öne çıkıyor dediğim ün iç yaşam alandaki sessizliği güzel kaderi süspansiyonu konforda ekstrası var kıyas edilmemeli tabiki sınıf farkı var ben b süvari alacak olsam önce mokka bakar param yetmez alırdım b suv arasında bence fiyat performans aracı,19.08.2023
aynen öyle güzel açıkladınız valla,19.08.2023
estağfurullah hocam müsait olunca aracın yanına inince görsel olarak foto felan çeker izah etmeye çalışırım elimden geldiğince,19.08.2023
ben önceki otomatik aracımda sizin dediğiniz yapıyordum şimdi shine bold paket söylüyorum d iken stop ettiğinizde p konumuna kendisi alıyor el frenini kendisi aktif yapıyor hareket edeceğiniz zaman gaza dokunduğunuzda el frenini kendisi pasif yapıyor,19.08.2023
model net ağırlık kg,19.08.2023
sensörlerle ilgili bir sorun yaşamadım aydır kullanıyorum sadece sağ arka kelebek camın olduğu bölüm disa doğru çıktı servise götürdüm üretim hatası dediler yerine yerleştirdiler başka bir sorun yaşamadım,19.08.2023
citroen model dizel ağırlık,19.08.2023
dokunmatik ekrana yeni yazılım gelmiş yüklerken hata aldım ancak hata usb bellekten kaynaklıymış kaliteli bir usb bellek güncelleme yapmakta fayda var ayrıca update başlamadan önce muhakkak start stop u kapatmayı unutmayınselamlar,19.08.2023
sitesinde kg olduğu yazıyor aksesuar vs oraya çıkıyor olabilir ancak bizim araçlarda kg yazıyorken yazılması ilginç geldi,19.08.2023
hayır x lerde değil ufak bir güncelleme,19.08.2023
harita versiyonu güncellenmiş mi,19.08.2023
hayır harita olsaydı ayrı çıkardı onun linki,19.08.2023
teşekkür ederim uğraşmayalım zaman,19.08.2023
güncellemeyi yaptınız citroen update yok resime gitmek tıklayın,19.08.2023
ben baktım şimdi güncelleme görünmüyor resime gitmek tıklayın,19.08.2023
aracın hp mi olup olmadığını ayırt edebiliriz,19.08.2023
cevap teşekkürler servise gittim parça siparişi verildi basit sorun çözülecek bir ön park sensörü arka olsa sorunum kalmıyor araç ilgili,19.08.2023
sensörleriyle ilgili fazla hata okumaya başladım henüz teslim almadık baya düşündürüyor beni,19.08.2023
selam herkese aracım var ekranda manuel bir ayar vb var devir saatini falan görebileceğimiz,19.08.2023
evet var gösterge ekranına istediğiniz kadar seçenek ekleyebiliyorsunuz istediğiniz ekranı istediğiniz sıraya koyabilirsiniz mesela ilk alındığında seçenekli geliyor oraya istediğiniz kadar ekleyebiliyorsunuz sırasını belirleme şansınız var resime gitmek tıklayın arabanın yanına gidince foto çeker atarım buraya,19.08.2023
kablosuz car play yok lerde var lerde yok sessizdir silindire rağmen gaza yüklendikçe ses gelmeye başlar sakin kullanımda sessizdir,19.08.2023
bende bir aşamaya kadar gelip hata veriyor ekran öylece kaldı geri dönmüyor diski gördü güncelleme başladı hata verince ekran kaldı eskiye dönmüyor,19.08.2023
aynen şekilde yaptım anlamadım hata verdi usb çıkar dedi çıkardım geri yükleme yapacağını söyledi eski versiyona kaldı öyle ekran açık,19.08.2023
resimleri ekledim plastigin altindada sarj aletinin cip kismi filan mevcut bos degil sarj gosterge lambasida varnasil kablolamasi yok anlamadimbu arada cakmakligin ordaki kapak bile cikmadi benim aracimd tl verip sonradan satin aldim resime gitmek tıklayın resime gitmek tıklayın,19.08.2023
merhaba arkadaşlar ben bugün bir inceleme fırsatı buldum beğendim su anda aircross kullanıyorum onu satıp bunu alacağım kaporayı yatırdım bayinin söylediği iki ay sonra siparişlerde bi rahatlama olacağı,19.08.2023
hangi bayi hocam otosay arkadaşımın sını yaklaşık hafta gümrükte olarak söyledi dün geldi ankaraya,19.08.2023
araçlar türkiyeye geldikten sonra gümrük işlemlerinden sonra stellantis türkiye deposuna gidiyor orda artes kaydı denen işlem yapılıyor işlemi cep telefonu kayıt işlemi düşünebilirsiniz noterler kayır olmadan tescil plaka işlemlerini yapamıyor genelde artes kaydı işlemi yüzünden bekliyor araçlar,19.08.2023
merhaba hayırlı olsun aracınız benimde sıfır aldığım araçta teslimde hatayı verdi doğrusu araç çarpma riski algılama sistem hatası uyarısı hemde asist tuşuna basınca otomatik hız sabitleyici hatası verdi servisde yazılım sonuç alınamayınca camdaki radarın değişimi gerekli dediler ay sonra parça geldi değişti düzeldi sizde servise gidin radarın değişimini isteyin sorununuz aynı bence garantiden değişiyor arada asist tuşuna basarsanız hatayı görmezsiniz kısım kapalı iken kullandığınız denediğinizde hata vermemiştir şuan sürekli açık konumda olduğu biner binmez hata veriyor olabilir deneyin,19.08.2023
yok,19.08.2023
bir işe yaramıyor gelmese olur,19.08.2023
ülkeyi ingiltere yada fransa yapın ozaman mail gelir zaten çokta gerekli bir uygulama değil,19.08.2023
hemen herkes dertli sanırım uygulamadan,19.08.2023
hocam bende ekim kapora tarihinde hafta sonra teslim edilecek bayi ata citroën ankara konu hakkında bankaya kredi teminat shine bold aldım ocak tarihine kadar yazılım güncellemesi nedeniyle teslim edilemedi ocakta teslim almaya gittim duruma anlam verememem hemde teslim alırken gözlemlediğim bir kaç husus nedeniyle aynı gün expere soktum sağ ön kapı boyalı sağ ön çamurluk değişmiş motor kaputu boyalı sök tak var sağ podye boyalı sağ ön far sök tak bulguları raporlayip araç değişimini talep ettim geçen hafta arayıp değişimi onayladilar araç geldiğinde kontrol ettirin bakmayın yeni araç demeyin saygılarımla,19.08.2023
evet fransa yapınca geliyor mail ancak sanırım pek kimse memnun değil uygulamadan,19.08.2023
mail gelmesinin faydası,19.08.2023
ankarada cumartesi gidip bayiye bakacağım kısmetse yazılacağım anladığım kadarıyla araç yok azından bi şansımı denemek istiyorum,19.08.2023
güncelleme geldi resime gitmek tıklayın,19.08.2023
umarım x modellerdeki yapmışlardır,19.08.2023
ön park sensörü ün durunca çalışmama sorununu çözebildiniz mi,12.08.2023
yok malesef kere servise gittim sayisiz musteri hizmetlerine sikayette bulundum soyledikleri calisma prensibinin sekilde oldugu zaten servislerin konuyla alakasi yok anlatinca suratima bos bos bakiyolar hizli hizli devreden cikmadan yanasip park etmen lazim,19.08.2023
serviste mi aynı araçtan yok showroom filan test aracı normal dedikleri şeyi arabada bir denesinlereger doğru anladiysamon sensör ileri hızın altında olması aktif oluyor olması lazım kitapçığa bakmak gerekir ayrica duruyor ilkende önünden geçerse devreye giriyor hatırlıyorum,19.08.2023
motor seçeneğinde bin km bakımda buji değişimi yapıldığı söylendi bana biraz tuhaf geldi binde buji mi değişir,19.08.2023
ocakta model aracım bakımına girdi buji değişmedi,19.08.2023
normalde bin km zamanında yapılır sanırım para kazanalım dediler,19.08.2023
versiyonunda bakımda buji değişiyor bakımda bir değişiyor,19.08.2023
bayilerde x var yazilim olarak farklilar aracin park sensorleri fiziksel olarak kusursuz calisiyor one dogru yanasirken eger tamamen durursan devreden cikiyor sonra vursanda otmuyor artik tamamen yazilimsal bir sorun citroen bunu kabul etmiyor cok olayida anladiklari yok zaten,19.08.2023
benim anlamadığım sorun ben yok diyenler var sorun herkeste yoksa servisin sorunu çözmesi lazım sorun herkeste varsa çözmesi lazım dar alanda park yaparken gerçekten bir faydası olmuyor ön sensörün,19.08.2023
hp benzinli aracımın yakıt konusundaki son verilerini paylaşıyorum km gidiş geliş inişli çıkışlı yolda sakin kullanımda kışlık lastik iyi bir veri elde ettim fakat km kısa bir yol yaptığım zaman ortalama e çıktı önce metre km kısa mesafelerde ortalamanın lt olduğunu gördüm burada bir çelişki var kısa mesafeyi sağlıklı hesaplıyamıyor gerçekten şehir içinde anormal yakıyor bir ortalama km hız olduğunda tahmini yolun yarısı km hız geri dörtte km hız km hız yakıyor tahminimce kısa mesafede yanlış hesaplıyor üstü yakıyor sakin altı kullanımda gerçekten iyi yakıyor eko mod bence gereksiz sakin kullanırsan zaten ekonomi davranıp yakıyor,19.08.2023
uc saniye filan beklemeye gerek kalmiyo duvara dogru duz gidiyorsun hizin km nin altinda ayagin hafif frende otmeye basliyo bir sari cizgi iki sari cizgi ara tedirgin oluyorsun frene basiyorsun bire kadar saydamadan ayagini frenden akldiriyorsun hokus pokus park sensoru devre disi araclarda kimse bana yazilimsal bir sorun olmadigini anlatamaz kaldiki demek uc saniye duvara yanasirken durdum dondum arka koltuktan bisey aldim baktim mesafe var gideyim dersen duvara vurursun otmuyo cunku gecmis olsun aracta zaman zaman bluetooth kopmalari oluyo benim aracta kablosuz sarj var calismiyo neymis icindeki kablo tertibati yokmus haydaaa arkadaslar benim ikinci aracim im var birde oncesinde bmw skoda opel psa olmadan once kullandim boyle sacma problemler sacma yanitlarla hic karsilasmadim arada problemlerin bir yazilimla duzeltilebilecek sorunlar muhtemelen duzeltilmis hatta araca guncelleme gelecegini sanmiyorum aracida seviyorum aksilik tipi hosuma gidiyo kucucuk kadrana ragmen basinizi agirttiysam kusura bakmayin,19.08.2023
benim aracta kablosuz sarj var calismiyo neymis icindeki kablo tertibati yokmus mümkün değil benim arkadaşın kablosuz sarj çalııyor başka olmasın,19.08.2023
araçlarda kablosuz şarj yok haziranda teslim alınan shine bold varken temmuz sonrasında yok opsiyon olarak var araç içinde bazılarında gelmiyor bazılarında geliyor,19.08.2023
valla servis sokup bakti donanim mevcut donanimi baglamak icin gerekli kablolama mevcut degilmis araci satin alirken kablosuz sarj gelmiyo dediler arac gelince sanslisiniz sizin aracta kablosuz sarj var dediler donanim icin ucret aldilar calismayinca iki kere servise gittim aoktuler baktilar i̇cinde kablolamasi yok dediler merkezde sase numarasindan bakinca aracta kanlosuz sarj gorunmuyo diyo donanim var kor degilsem kablosuz sarj var aracta yarin resimde atarim aractan,19.08.2023
dostum adamın yazdığını okumadın heralde adam kablosuz sarj var çalışmıyor yazmış senin yazdığınla alakası yok,19.08.2023
donanım eksiltmişlerdir vardır çalışmaması söz konusu değil kablosuz sarj mevcut olanlarda çalışıyor,19.08.2023
aracin yanina inmeye usendim valla yarin resim atacagim,19.08.2023
astradaki arayüzü koymuşlar güzel olmuş,12.08.2023
aralıktan beri shinebold sıradayım gelen var giden,12.08.2023
ben dün gittim inceledim aracı eşimde bende beğendik grandland x imi satıp almaya karar verdik hafta sonra net cevap verebileceklerini söylediler fiyatta dahil kapora dahi almıyorlar,12.08.2023
geçen hafta aracımı teslim aldim bir haftalık bur tecrübem var memnunum dizel shine paket özellik olarak dolu bir araç,12.08.2023
hp kullanan arkadaşlar tüketim değerlerini aza indirmek eko yoksa normalde mi kullanıyorsunuz aracı,12.08.2023
sinde güncel fiyatlar açıklanacakmış arayıp sorun kendinizi hatırlatın,12.08.2023
bende benzinli dize arasında kaldım dizel ağır basıyor gm il psa nın benzinlileri sorun çıkarabiliyor dizeller genel olarak sorunsuz,12.08.2023
yoo var bluehdi var shell den dolduruyorum yıllık araç sorun çıkarmadı bir sürü motor indiren puretech biliyorum buji kıran vti motor bitiren thp,12.08.2023
tamam,12.08.2023
merhaba aracım shine paket nisan beri kullanıyorum bin km oldubu binin uzun yollarda i̇stanbuli̇zmir kalan bin kmsi şehiriçi mesafelerde kullanıldımycitroen uygulamasına göre bin kmdeki yakıt ortalamam lt,12.08.2023
ben normal modda kullanıyorum izmir şehiriçi yokuşlu ancak açık trafikte ortalamam aşağıdaki puretech resime gitmek tıklayın,12.08.2023
platformunda astra x gelirse ortam şenlenir şuan piyasada alınabilecek fp aracı,12.08.2023
aracım km ortalama hız km yaptım hızım otoyolda genelde idi yaktı normal değil geliyor bana shüne prutech,12.08.2023
aracı ekonomiye getirmek avantaj sağlamıyor normal mod iyi uzun yolda ekonomiyr geçmek faydalı olabilir km uzun yol yaptım km ortalama ortalama var,12.08.2023
km hız yüksek hızla normal hp tork motorlar zaten uzun yol diyor fabrika verisi veri araç boş km hızla gidersen elde edersin sonuç olarak l yakalamak prensipte mümkün değil araca yakıt kendi ağırlığını eklediğin anda başka hiçbir ağırlık olmasa bile arasında yol şartlarına göre yakarsın eğimler çıkışlar araç ortalama trafik kullanımında arasındaki tüketimler uygundur,12.08.2023
ben fabrika verisi olarak şehir içi şehir dışı biliyorum benim dediğim gibiyse olan verinin olmadı bence normal değil şehir içi fabrika verisi olan aracım lt uzun yol yapıyordum citroen şehir içi olan araç uzun yolda falan görürüm diyordum veriler sizin dediğiniz gibiyse normal,12.08.2023
ios car play kullanıyorum cihazın ayarlarında otomatik bağlanma vardı aktif etmediyseniz bir bakın,12.08.2023
gitgide azalan donanım var mesela shine head up display varken artık lerde olmayacak diğer psa araçlarında olduğu donanımlar eksiliyor ay gelirse son ler gelir tek tük kaldıysa artık ler yolda,12.08.2023
bayideki arkadaşlar pek bilemez onlara gelecek araçlar hakkında aracın donanımı artık yok vs bilgi verilmediği sürece bilemezler ay başında shine teslim almaya gittiğimizde arkadaşım bayi müdürü söyledi bilgiyi,12.08.2023
diğer hyundai honda üzerine tl istemiyor elbette illaki renk fiyat farkı seramik cam filmi vs tl fazlası verilebiliyoristenebiliniyor sıfır alırken i̇stenmediği durumlar oluyordu lakin girdiğimiz son virajda araç bulmak zorlaştığı liste fiyatı üzerinden bşraz eklenebiliyor fiyat teklifine,12.08.2023
almayı düşünenler bayide bir görsün derim bende air var tavan basık on cam yatık küçük kisaca içi air kadar ferah değil araba güzel ona lafım yok kişilere dar gelebilir arada boyum benim başımın tavana değmesine parmak falan kalmıştı aracın aküsü yoktu koltuk ayarı yapamadım durum buydu,12.08.2023
boyum kullandım şismi e geçiyorum test sürüşü vs ilk yapanlardanım böyle bir problem yaşamadım aircross kullandım senesinde lıtasşanacak araç değil maalesef dediğiniz tavan yüksekliği ine bakarsak evet aircross yüksek fiat l misali sürüş konfor kalite başka kıyaslanmaz deidğim boyum ben olumsuz birley yaşamadım,12.08.2023
hocam araç kötü bir yazmadım air b sınıfı c sınıfı birde aralarında sene yıl farki var konfor kalite tabiki iyi olacak araçlar arasında kıyasta yapmadım sadece basık dedim ben bindiğimde basık geldi almayı düşünen deneyerek alsın belirttim yoksa para sizlerin isteyen alsın isteyen almasın bana yarar zarar yok son paragrafta belirttim arabanın aküsü yoktu koltuk ayarı yuksekteydi ayar yapamadım bana göre ilk gördüğüm eksikleri yazdım tavan basık ön cam küçük geldi görüş dar birde bagaj kapağı peugeot cam birlikte acilsaymis güzel olacakmış bunlar benim fikrim başkası farklı düşünür beğenir normal zevkler renkler,12.08.2023
yazlık lastikler gelen hangi kış lastiğini önerirsiniz kışın dar taban iyi diyorlar almak mantıklı artıları eksileri olur,12.08.2023
bugün teslim aldığım te mirror screen seçeneği var denedim kablosuz app android cihazlar bağlanıyor bilginize ekran içeriği farklı tablet pc arayüz olmuş resime gitmek tıklayın resime gitmek tıklayın resime gitmek tıklayın resime gitmek tıklayın,12.08.2023
hayırlı olsun umarım bir güncelleme içinde güncelleme gelir fakat pekte zannetmiyorum yeni multimedya şık görünüyor,12.08.2023
aynı multimedya donanımını kullanıyor sadece yazılım güncellemesi yeterli,12.08.2023
sistem sürümü ahw olarak görünüyor resime gitmek tıklayın,12.08.2023
aynı yazılım varsa mümkün yazılım farklı mümkün olmayabilir,12.08.2023
dün itibari sine paket aracmı ikinci el olarak almış bulunmaktayım aracı almadan önce satıcı aracın adaktif cruze kontrol açıldığında arıza yandığını bunun serviste güncelleme düzeltildiğini söyledi servis kayıtlarını almaya gittiğimde servis çalışanları güncelleme düzeltildiğini söyledi aracı aldıktan sonra bir kaç adaktif devreye sokmaya çalışmama rağmen çalışmadı ekspertiz noter servis arası defelarca aracı kullanmamıza rağmen araç hata vermemişti ben bir kaç deneme çalıştırmaya çalışırken hata verdi aracın çalıştırılmasında artık adaktif hatası veriyor başına böyle gelen var,12.08.2023
detailing,12.08.2023
dby detailing berkay iyidir fp açısından iyidir,12.08.2023
verdiginiz bilgiler icin tesekkur ederim citroen servis genel merkezle gorustugumdede bunun normal calisma prensibi oldugu soyleniyor benim anlamadigim diger tum araclarda arka park sensoru nasil calisirsa onde oyle calisiri engele belli bi mesafede kesintisiz otmeye baslar yuzden yadirgadim muhtemelen umarim alisacagim tekrar tesekkurler,12.08.2023
herkese merhaba satın aldım teslimatı bekliyorum sıfır alıp yıl binip memnun şekilde satmıştım umarım kasasıda sorunsuzdur herkes kazasız belasız sürüşler,12.08.2023
evet bende onlinedan aldım ödemeyi yaptım teslimatı bekliyorum martı bulur teslim edilmesi,12.08.2023
yok hocam hafta içinde teslimat yaparlar düşünüyorumaraçlar türkiyede teslime hazırplakalar çıkacak sadece,12.08.2023
hocam ben aldım online satıştan bayi görüştüm araçlara şasi no atanmış gümrükten geçtiği anlamına geliyor büyük ihtimalle i̇zmit depoda tutuyorlar amide aynısı olmuş günde teslim etmişler umarım bizde böyledir arada shine aracımı gün önce teslim almıştım hızlı bir geçiş olacak,12.08.2023
güzel haber umarım erkenden teslim edilir online işi iyi oldu azından gerçekten alınabildi araçlar umarım memnun kalırız araçlardan,12.08.2023
x bilgi paylaşımı amacıyla telegram grubu kurdum arkadaşlar dileyen arkadaşları bekleriz,12.08.2023
deki ekranın veveya yazılımın büyük artısı kablosuz car play olması kablo derdine son vermişler,12.08.2023
android auto kablosuz,12.08.2023
evet hocam kablosuz yazdım lerde yine sordunuz,12.08.2023
car play apple ordan karıştırmışım teşekkür ederim,12.08.2023
hocam ikisi kablosuz,12.08.2023
kablosuz carplay android auto büyük kolaylıkumarım stabil çalışırlar ayrıca my citroen app aracın şarj başlatma saatleri belirlenebiliyormuş uzaktan araca binmeden soğurma ısıtma komutu verilebiliyormuş okudum kadar doğruy artık araçlar gelince göreceğiz,12.08.2023
carlink kit kullanan var mıdır,12.08.2023
ben kullanıyorum memnunum,12.08.2023
telefonunuz android mi,12.08.2023
ben herseferinde android bağlantısını tıklamak zorunda kalıyorum otomatik bağlanmıyor,12.08.2023
üstat sistemdeki bir hata nedeniyle özel cevap dönemiyorum satın aldığım bayi ankara kaput filmi seramik kaplama boya kontrolüne engel mi bilmiyorum bilenler cevap verebilir,05.08.2023
windows güncelleme programının linki neydi,05.08.2023
dostum hangi araç konusuna girersen gir araçla ilgili sorun yaşayan yada sorun yazan insanlar doludur zaten bunu kişiden kişi yazması bunu doğru yapmaz ben vag grubu kullandım şirket nedeni dediğiniz tamamen asılsız adam clio yazmış zaten saçma sapan bir yorum yapmışsınız kusura bakmayın son senede farklı clio kullandım şuanki aracımda şirket aracı clio clioda ses la giderken geliyor den sonra aynı yazmışsınız ben ona istinaden yazdım yoksa leon aşırı ses alır bellir bir km diğerleride ben kullanıcısıyım kayınpederde tiguan fabia skoda var araca binince motor çalışmıyor dedi direk şuan psikolojik olarak zaten etkilenmişsiniz artık dünyada gelen ses makul abartı yok desede kabul etmezsiniz benim aracıma binen herkes kadar sessiz yorum yaptı sizin araçta sıkıntı var sanırım ben ses bir iddam yok araç ses alıyor zaten clio vs kıyas kabul etmez belli km gelmeden tertemiz sesi,05.08.2023
citroen update,05.08.2023
evet haklısınız motor rölantide sessiz ben onu kastetmedim zaten ani bir hızlanma bir rampada motor yüke girdiğinde bariz çıkan ses beni rahatsız ediyor önceki aracım kadar güçlü hp bana garip geliyor ben rölantide dışarıdan gelen çevre sesi trafik korna vs gürültüsünden bahsediyorumbelki benim aracımda sıkıntı vardır dediğiniz olabilir başka lerle kıyaslamam gerekiyor tespiti içinkonuyla ilgili benim yazdıklarıma benzer sıkıntılar varsa özelden yazabilirse sevinirimkalın sağlıcakla teşekkür ederim yorumunuz,05.08.2023
