review,date
herkese merhaba feel bold multimedya ekranının dili kendi kendine fransızca oldu değiştiremiyorum önce başına gelen var,29.07.2023
carlinkit i alacagim bakalim android auto kablosuz verimli olucak mi konuda kullanan yoktur dusunuyorum birde wiriless kit alicam benimki feel bold on konsolda start stop olmadigi icin telefon vs sigiyor oraya bir kablosuz pad alicam birde kablosuz auto verimli olacak mi bakalim deneyelim,29.07.2023
yorumlarınızı bekliyorum hocam ben düşünüyorum bir kablosuz android auto cihazı,29.07.2023
aynen aldıktan sonra geri dönüş yaparsanız sevinirim,29.07.2023
tekrar merhaba gidip carlinkit aldım sorunsuz bir sekilde ekrana bağladım tam detaylı inceleyemedim bağlantı gecikmesi biraz var zaten apple iyi çalışıyormuş onuda haftaya denerim kiz arkadasimda iphone varama benim isimi gorur sahsen sadece maps icin kullaniyorum benradyocu tayfadanim ondada kopek baligi anten var biliyorsunuzdur yaklasik yil oldu hicbir sikinti yok cekme yipranma band asinmasi vs sorunsuz stock anten kadar guzel calisiyorfikir olması acisindan video cektim setayli baktikca yorum yaparim gece gece soguk zaten cok karistiramadim acikcasi musait oldugumda guzelce orta konsoldaki telefon koyma yerinin ustune band sabitleyecegim orada kalacak alt taraftada wiriless charge alani yapacagim orayada telefonu atar sarj olur tek sorunum tek cakmaklik girisi var oradada takiligarantisi yil var yil sonra zaten akuye baglatcam tesisatcidakeske type c cikisi koysalarmis bir tane videoyu izlemek tıklayınız videoyu izlemek tıklayınız,29.07.2023
hocam teşekkürler yorumunuz videoyu izledim bayağı gecikme varmış tatmin etmedi beni açıkçası,05.08.2023
sabah araci calistirdim saniyede baglandi gecikme sifirdi telefon gorusmesi vsde yaptimbiraz deneyimlemek lazim maps acinca gecikme oluyor ayarlari var mi bakacagim kurcalamak lazim iyice batarya kullanimi nasil vs direkt android autoyu acmasi guzel birde android bug var maps launcherda gozukmuyor samsung android boyle oldu kabloluda ayni sorun vardi,05.08.2023
merhaba nereden aldınız,05.08.2023
aldim hocam sahibindenden,05.08.2023
arkadaşlar merhaba biraz abes gelicek kusura bakmayın aracınız araç kokusu zaman gitti benim ay oldu artık kokuyu alamıyorum araç kokusu vs kullanmamıştım araç kokusunu sevdiğim,05.08.2023
facebook grubunda baya taktıran vardı den alıp servise taktırmışlardıbilgi ordan eski mesajları aratın bence,05.08.2023
kablosuz android auto rahat oluyormuş baya gecikme konusunda şöyle kullanıyorum ilk açılırken var sonra gecikme olmuyor pek bir sorun yaşamadım telefon görüşmesi vs şimdilik memnunum şimdi wiriless şarj cihazı aldımorta konsola yerleştiricem insan araca bir tane type c koyar yav çift çıkışlı çakmaklık vardı onu kullanıcambir girişten kameraya güç veriyorum diğeri wiriless şarj cihazına güç alıcam son halini haftaya falan konuya atarım,05.08.2023
i̇yi günler arkadaşlar aracım manuel aracı alalı yıl ay oldu aldığım günden bugüne kadar yakıt verilerini sisteme girdim tam sene geçince kasımda paylaşacaktım iş yoğunluğu vs anca paylaşabiliyorumaracı almayı düşünenlere yakıt tüketimi yönünden gerçek pompa verileri referans olur aracın km si şuan kullanım şehir içi şehir dışı karışık özetle aracı genellikle sakin kullanırım şehirler arasında litre civarı şehir içi trafik yoğunluğu na göre litre arası yakıt tüketimi var günlük güzergahımda genelde aşırı trafik yok ortalama şehirler arası civarı giderim ye sınırlarım genellikle geçmem şehir içi ankara kayseri trafiği karışık yüzde i kayseri resime gitmek tıklayın,05.08.2023
nasil birsey ariyorsun hocam ev arac sarjli dik supurgeler var dyson tarzi onlari oneririm bende viaomi var yildir falan ev arac supuruyorum aparatlari var,29.07.2023
yok hocam ev araç istemiyorum mümkünse şarjlı çekim gücü iyi guzel bişey arıyorum sinbo serisi var i̇ş görür bilmem civarı,29.07.2023
merhaba yok maalesef,29.07.2023
arkadaşlar ankarada diğer servislere göre uygun fiyatlıgüvenilir bir yetkili servis biliyor musunuz,29.07.2023
kartal öztekçekmeköy öztekmaltepe değerataşehir canhepsine sordum binde değişiyor dediler,29.07.2023
evet benimkini değiştirmediler verilen bakım planında yılda değiştiği yazıyor telefonda verdikleri fiyat genelde dahil fiyat oluyor bakım sırasında aracın durumuna göre polenhava filtresi şeyleri değiştirmeye gerek olmadığı fiyat düşebiliyor bende öyle oldu,29.07.2023
merhaba çıkıyor hafif kaldırınca bile yanıyor,29.07.2023
merhaba iyidir,29.07.2023
doğru değer kullanma klavuzu depo kapağında yazar lastikler soğukken belirtilen değeri lastiğinizin ölçüsüne göre basın doğru değer budur yaz kış farkı yoktur,29.07.2023
ben shine aracım allianzdan yaptirdim kaskoyu sigortada tuttu şükür kaza yok hasarsizlik son seviye ustune bir meslek indirimi var,29.07.2023
sıfır manuel arıyoruz stok olan bayi bilginiz varsa paylaşabilir misiniz,29.07.2023
kompakt sınıfta kapılı sedan suv genlerini bir arada sunan x ekim ayında bin tl tutarındaki yakıt kartı hediyesi bin tl ay vade yüzde faizli kredi imkanına ek bin tl takas desteği sağlanıyorcitroën xin yüzde elektrikli versiyonu x bin tl tutarında eşarj kartı hediyesi bin tl ay vade yüzde faizli kredi bin tl takas desteği satın alınabiliyor tasarım teknolojiyi buluşturan citroën bin tl ay vade yüzde faizli krediyle sahip olunabiliyorcitroën yüzde elektrikli versiyonu bin tl tutarında eşarj kartı hediyesiyle bin tl ay vade yüzde faizli kredi seçeneği sunuluyor citroënin konfor tasarım işlevselliği bir araya getiren suv modeli aircross bin tl ay yüzde faizli kredi bin tl takas imkânlarıyla citroën showroomlarında yeni sahiplerini bekliyorgüçlü suv tasarımı yönlülüğü sürüş güvenliği konforunu destekleyen gelişmiş teknolojilere sahip citroën aircross modeli bin tl ay vade yüzde faizli kredi seçeneği satın alınabiliyor çeşitli kişiselleştirme kombinasyonlarıyla heyecan verici deneyimler yaşatan otomatik şanzıman seçeneğiyle kullanıcılarına konforlu bir sürüş sunan citroën bin tl ay vadeli yüzde faizli kredi imkânı sağlıyortasarım pratiklik modülerlik açısından yenilikçi çözümleri multimedya özellikleriyle sürüş keyfini artıran citroën berlingo kombi bin tl ay vade yüzde faizli kredi fırsatlarıyla citroën showroomlarında yeni sahiplerini bekliyor kombivan sınıfının öncüsü olan modüler tasarımlı citroën berlingo van bin tl ay vade yüzde faizli kredi seçeneğiyle satın alınabiliyorayrıca skoda kodiaq tanıtıldı yeni teknolojiler şarj edilebilir hibrit sistemcitroën ergonomik tasarımını teknolojik donanımlarla bünyesinde birleştiren jumpy spacetourer günlük hayatı kolaylaştıran bir mesai arkadaşı olarak jumpy modellerini bin tl ay vade yüzde faizli kredi seçeneği sunuyor citroën yüksek kapasite konforu buluşturan jumper modelini bin tl ay vadeli yüzde faizli kredi fırsatıyla kullanıcılarla buluşturuyor,06.10.2023
aman citroene bulaşmayın canınız yanar sonra bkz,06.10.2023
bende var temmuz üretimi önde sensör yok bizim millet bahsettiğim çarpışma önleme benzeri uyarıları park sensörü sanıyor,16.09.2023
yok değil hocam önünde bariz park sensörleri var i̇lanlara bakın birçok modelde görebilirsiniz resime gitmek tıklayın resime gitmek tıklayın,16.09.2023
hatta model olup shine donanımda arkada park sensörü olmayan var i̇lan ilginç anlamadım,16.09.2023
benim aracımda önde sensör yok satış danışmanı olmayacak demişti,16.09.2023
modelde önarka park sensörü varken modelde sadece arka park sensörü olması ayrı bir garabetgerçi geçen sene baya eksik donanımlı araç satıldı çip krizinden dolayı olduğunu söylüyorlardıartık ön park sensörünü eksik olarak görmüyorlar demek,16.09.2023
yalnız değil modellerde gözüküyor ilanlara bakıldığında olarak aradığınızda bir çoğunda önde sensör yok,16.09.2023
arka cam perdeleri yok mesela,16.09.2023
benim araç önarka park sensörü var shine donanımlarda standart idi çip krizi muhabbetinden dolayı ön sensörü geçtim park sensörü olmayan araçlar geldi geçen sene sene mevzu aynısı göründü gözüme,16.09.2023
i̇lk makyajlı kasalarda cam perdesi torpido üstünde tablet koymalık bir zımbırtı vardı geçen sene dolaştığım bayilerdeki araçlarda görmedim benim araçta yok gerçi arka camlara koyu film çektiler içerisi görünmüyor yüzden takılmadım cam perdesine,16.09.2023
öyle gözüküyor umarım gelecek araçta fabrikasyon olarak gelir öyle olup olmadığını başından sordum zaten küçücük bir çıkıntılı parti sensörler çirkin duruyor takıklık işte dediğim ilanlarda gözüken araçlarda önarka fabrikasyon var dediğiniz olmayan var,16.09.2023
ilginç hakikaten size tavsiyem tane sprey tamir kiti alın geçin gidin zira dağ başı olsa kasko ücretsiz çekici yollar olmadı kaza yaptım yoldan çıktım lastik iki lastik yarıldı diyin direkt yolluyorlar lastik bedeli dahi öder tabiki belli bir yıpranma düşerek üstelik artık bir kasko araç bedeli nuna kadar olan hasarlarda hasarsızlığı bozmuyor yok kasko yapmıyorum diyorsan bir tane ince stepne lastik hidrolik kriko bijon şart ayrıca lastik tamir kiti yarık lastiğe bir yapamaz spreylerin afillisi,03.10.2023
merhabalar shine jantı arıyorum arkadaşlar satmak isteyen olursa benim iletişime geçebilir resime gitmek tıklayın,04.10.2023
uzun yolda dizel arasında şehir içi litre civarında dizel kuvvetli giderken araç solladıgım zaman resmen depar atıyor diğer bir arabadan güzel motor bence,23.09.2023
yazılan sorunların hiçbiri yok shine paket dizel aracım var aktif fren sistemi çalışıyor ayrıca,23.09.2023
bakımı teklif aldım bujili şekilde aşağı teklif alamadım fiyatlar geldi bir ön balata değişecek ses gelmeye başladı dahil dedilereuroreparda yaptırmayı düşünüyorum,23.09.2023
merhaba herkese model koyu gri aircrossa sahibim özellikle kapı köşelerinde uç kısımlarda inanılmaz bir boya atması problemi yaşıyorum kötü görünüyor yargıya taşımayı düşünüyorum aranızda benzer sorunu yaşayanlar var net olarak ayıplı mal alışveriş merkezlerinde aynı renk aircross gördüğümde gidip kapı köşesine bakıyorum boya atmış benzer durumu yaşayalar fikir verirse sevinirimnot ci̇troen almayin,23.09.2023
aircross shine haki gribeyaz araçla aranızdayım herkese kazasız surusler,30.09.2023
merhaba aynı araçtan ben aldım güle güle kullanın kazasız belasız araca alır almaz karter muhafaza taktırdım alt taraf oldukça korumasız geldi bana aşağıda muhafazalı resime gitmek tıklayın resime gitmek tıklayın muhafasiz fotoğraflar yükledim,30.09.2023
evet haklısınız eski suzuki mde tamamen kapalıydı bunda açıkta kalmış,30.09.2023
benimde aynı gün aracım inmişti ankaraya bayiye gelmesi yaklaşık iki hafta sürdü aracınızı teslim almışsınız zaten,30.09.2023
yıldır yaklaşık bin km dir kullanıyorum yokuşlu yerlere gittiğim oldu hararet ibresinin oynadığıni bile görmedim sağa çekme farkında bile değilim kullanıcıdan birinde çıkan bı sorun sizi araçtan soğutuyor araç secmeniz neredeyse imkansız olur zaten,30.09.2023
aracimi yeni aldım antalyada derece üstü şehiriçi kullanmama rağmen derecede sabit duruyor hararet sorunu yok çekme sorunuza yok çekme herşeyden olabilir bulmak zor,30.09.2023
yo hayır araç seçmekte zamana kadar zorlanmadım zira zamana kadar araç değiştirdim son honda civic satıp ev aldım geri kalan parayla milyon tl civarı bir araç bakıyorum seçeneklerim b sınıf olmak kaydıyla crossland honda city skoda scala c sınıf olarak renault tce idi renaultyu anlamsız pahalı olduğu eledim scalayı dsgye güvenemediğim içingeriye kalan iki araçtan crossland öne çıkıyordu onu tatsız hararet yapma ihtimali sebebiyle eliyorum zira puretech motorda karşılaşılması olası bir durum galiba peugeot citroen model farketmeksizin yine zaman dönüp dönüp aldığım bir japon otomobili kalıyor elimizde neyse artık,30.09.2023
arkada park sensoru var önde yok fakat önde çarpışma uyarısı yakın araç uyarısı engel uyarısı vs var,16.09.2023
abc otodan aldım ay sıra bekledim,16.09.2023
nadir gördüm bizim araçlarda olma ihtimali diyebilirim,16.09.2023
bakım zamanı gelmiş hocam,16.09.2023
fatura kesildigi tarih garanti baslangici oluyor,16.09.2023
arkadaşlar merhaba whatsapp grubu var,16.09.2023
selamlar temmuzda shine paket araç teslim aldım günden beri ara ara tekrar eden kumanda tanımama sorunu yaşıyorum aracı park ettiğimde araç kumandayı tanımıyor manyetik alana göstermeme rağmen uzun basarak aracı kapatmak zorunda kalıyorum aracı terk ettiğimde kumandalar tanınmadığı aracı kilitleyemiyorum i̇lginç olan kumandaları fiziksel alana dokundurmam çare olmuyor kutup başını söküp takmam bi süre bazen bazen dk beklemeden araç bir kumandaları tanımıyor soruna ek olarak araçta sağa çekme mevcut direksiyonu düz tutarsanız araç bariz şekilde sağa gidiyor yüksek hızlarda net farkediliyor hikaye bundan sonra başlıyor buraya kadar hepsini teknoloji şansı olarak görüyorum olabilir aracı i̇zmirde servise götürdüğümde usta aracın bi süre kalması gerektiğini söyledi açıkçası sorun etmedim citroenin yerde reklamını yaptığı saati geçen arızalarda ikame araç vereceği vaadine güvenerek problem değil yapılsın dedim ancak akşam servis aradı ikame araç olmadığını aracın kalması gerektiğini söyledi yakın servise mesafede oturduğum araca ihtiyacım olduğu aracı alıp dönmek durumunda kaldım haftadır ikame araç olursa arayacaklar i̇şin ilginci araç yerinden hareket edemeyecek bi halde olsa sıfır araç kalıp ayında araçsız ortada kalacakmışım bunları yazıyorum burayı araç alacak olanlar okuyordur ben okudum teknoloji işi şans işi satış sonrası mevzular sanş işi değil aracı aldığınız gün muhtemelen yalnız kalacaksınız gardınızı ona göre alın bundan bir adım ötede şikayet edilir yapılır pek düşünemedim açıkçası alanların şansı bol olsun,23.09.2023
merhabailk iki yıl bakım yapılanlar aşağıdaki eski yazışmalarımda yazmıştım bunlar gerçek hayat verileri kitapçık prosedürlerde yazanları yapılması gerekenler google yazınca illa çıkacaktır,23.09.2023
benim telde nfc ortak erişim açıkken bunu yapıyor şöyle nfc ortak erişim telefonumda açıkken telefonla anahtar aynı anda aynı elimde cebimdeyse kumanda çalışmıyor dokunarak kapı açılmıyor kitlenmiyor kumanda düğmelerine basınca almıyorbunu fark etmem geç oldu bir denedim aynısı oluyor alakası var bende bilmiyorum,23.09.2023
teşekkürler yarından itibaren deniyorum umarım yüzdendir benim sorun,23.09.2023
aldıktan sonra henüz iken farkettim ben ilk direksiyonda bi zorlanma titreme vs yok sadece dümdüz tuttuğumda tatlı tatlı sağa geçiyor diyebilirim lastik basınçlarını bayiler yüksek şekilde veriyor onları olması gereken seviyeye indirdim eşitledim ona rağmen devam etti yakın zamanda farklı marka sıfır araç alan kişilerle konuştum hepsinde bi sağa çekme lafı var yol eğimi kaynaklı bi sağa çekme mi farklı bi durum var emin olamadım yüzden açıkçası umarım seninki sorunsuz gelir,23.09.2023
günaydınlar ekspertiz merkezleri yanal kaymaları milimetrik ölçüp size rapor verebiliyor biliyorum ölçümünü yaptırıp sorun varsa raporla birlikte servise giderseniz sağlıklı bir çözüme ulaşabilirsiniz bence,23.09.2023
mevcut tabiki araç son haziran makyajlandı günden beri aynı kasa satılıyor yeni bir kasa model çıkartılmadı,09.09.2023
şahin alabilirsin bundan sağlam bundan ekonomik fell bold boş bir araba zaten dört teker bir direksiyon neyin bilmişliğini yapıyorsun,09.09.2023
yorumunun kendin boş bı adamsın cevap vermeyeceğim sana,09.09.2023
boş derken hocam yine baya özellik var anahtarsiz giriş calistirma yok camtavan yok seride sokma ekstralar yok onun haricinde güzel fatura kesecekler arac faturası aksesuar faturası sanırım dediğiniz sorunun önüne geçmek bana vergi odetseler çıkarları olur muhtemel yüzden fatura kesecekleryan basamak turuncu renk paketi kamera park sensörü geri görüş kamerasi üst çıta tampona kapılara krom bunları taktiracagim muhtemelen,09.09.2023
yine bir sorun ötv olayını netleştirin aksesuar yan basamağı şahsen ben beğenmiyorum,09.09.2023
araç alırken aracın ham fiyatı ötv kdv ödeniyor malum aksesuar fiyatını aracın ham fiyatına ekleyerek işlem yaparsa tek fatura aksesuarlar içinde ötv kdv ödersiniz aksesuar ayrı fatura düzenlendiyse sadece kdv ödenirbenim anladığım size zaten ayrı fatura edilmiş sizin faydanıza görünüyor,09.09.2023
tamamdır şimdi anladım teşekkürler,09.09.2023
sayın imeyra açıklamış olduğu,09.09.2023
merhabaaraç çalıştığında ekranın geç gelmesi bende oldu bir kaç kere aracım yaşında sonra değil max sonra ekran geldialdığımdan beri usb bellek güncelleme yapmadım,09.09.2023
ben kararsız kaldımama servise bir götüreyim dedimsu anda ekran açılıyor bir ağırlasma var ekranın gelmesinde hissediyorum,09.09.2023
merhaba araca feelbold geri dönüş kamerası taktıran oldumu servis dışında yada servisde maliyeti nedir şimdiden teşekkürler,16.09.2023
merhaba ben serviste hafta önce taktırdım bin tl fiyat verdiler sıfır araç aldığım pazarlıkla son hediye ettiler yer ankara,16.09.2023
peki serit takip start stop a cozum bulan var mi p,02.09.2023
şerit takip kere gerçekten işe yaradı startstop benim arabada zaten çalışmıyor denebilir ayda toplasam dk falan çalışmıştır açıkçası işime geliyor teknik olarak turbo beslemeli bir motorda turbonun yağlamayı bırakmaması açısından startstop sisteminin doğru bir eklenti olduğunu düşünmüyorum zaten sistemler genelde emisyon değerlerini düşük göstermek kullanılan yakıt verimliliği anlamında etkisi olmayan sistemler tabii şahsi kanaatim,02.09.2023
arka ust stop lambası yıkama sonrası böyle oldutazyikli suyla yikanmamasina rağmendisardan kırık çatlak görünmüyorne yapmak gerekir danışmak istedim resime gitmek tıklayın,02.09.2023
merhaba stop lambası fren lambası arka üst stop lambası üretimlerinde dışardan gözüken beyaz lens arkasında kaput içinde kalan gövde ultrasonic kaynak vibrasyon kaynak birbirine monte kaynak edilir bir nevi yapıştırılır gözle görülmeyen kaynak atlamaları yüzünden su sızdırıyor belli parçaların testleri yüksek basınç altında yapıldığı tazyikli su kullanmış olsanız dahi su geçirmemesi gerekiyor aracınızı garantisi devam ediyorsa servise gitmenizi tavsiye ederim garanti yoksa bile hızlıca tamir ettirmeniz gerekir i̇çinde bulunan devreye su giderse aracın elektronik aksamına zarar verebilir buna benzer garanti iadesi görmüş bilen olarak yazıyorum bir olmaz bilemeyizgarantiniz var servisin ücret almadan değişim yapmasını kesinlikle talep edin bütün fatura lambasını üreten firmaya yansıtılıyor,02.09.2023
garanti devam ediyorgötürmem gerekiyortesekkurler cevap,02.09.2023
model shine paket satın aldım ekim sıfır olarak shine paket olmasına rağmen geri görüş kamerası yok dediler parası karşılığında eklettim web sitesinde zaman bin tl yazmasına rağmen bana bin tl geçirdiler farkı cebe indirdiklerini düşünüyorum şimdi bilmiyorum zaman bayiler açıktan para isteme işinden çekinmiyorlardı hatta bir başka ankara bayisi bin tl açıktan elden verisen istediğin arabayı bir aya getirtirim dedineyse konuya dönelim kamera kadar kötü bir görüntüye sahip sorduğumda orjinal kamera olduğunu ana yazılımın sadece kısıtlı bir çözünürlüğe destek verdiğini söylediler i̇yi böyle bir halt görünmüyor dediğimde durum dediler ödemeyi falan çoktan yaptığımız mecburen aldık devam ediyoruzservisten yaptırma derim kalitesi düşük dedikleri doğruysa ana yazılım desteklemiyorsa dışarıdan kamerayı upgrade etsek bir işe yaramaz ben yokluktan citroen aldım yaşadıklarımdan sonra asla asla almam aldırmam aracın web sitesinde bayide yüz yüze anlattıkları çoğu özelliğin olmadığını gördümörneğin aktif frenleme sistemi active brake sytem olduğunu sanıyorsunuz değil mi sadece uyarı olarak çalışıyor web sitesinde video anlattıkları aktif olarak frenleme yapmıyor servisin cevabıdır çalışması radar donanımı gerekir aracın önünden baktığınızda radar görüyor musunuz dediler tabiki cevabı yazılı alamadım kısaca citroen dolandırıcılık yapıyor türkiyeye böyle gönderiyorlar falan diyerek yumşatmaya çalıştılarneden konuya kadar taktım eşim kullanacağı ben aracı sadece özelliği almış shine paketi yüzden tercih etmiştim,02.09.2023
donanıma yıla göre değişir mi bilmiyorum shine makyajsız paket kullanıyorum öndeki araba aniden durunca ben frene yetişemeyince zonk kendi durmuştu hız falandır,02.09.2023
bunu servis şefi şekilde açıkladı aktif frenleme sadece uyarı sevşyesinde var menülerde yer alanda uyarının zaman verileceğine dair mesafe tercihi aracın aktif frenleme yapabilmesi önğnde radar donanımı olması lazım tamponun orada plastik levha gördüğün üzere yok dedi kesin kanıtım yok sizin yaşadığınız örnek acil fren destek sistemi eba düşünüyorum çoğu araçta standart bir güvenlik donanımı zaten bizim araçlarda ayrı bir özellik olarak var klavuzunda yazar aktif güvenlik fren sistemi bambaşka km hıza kadar otomatik frenlemeyle sonlanan bir güvenlik modu,02.09.2023
bir iki benim yerime fren yapmışlığı var evet bir radar yok keşke olsa muhtemelen ileriki yıllarda çıkar özetle sistem aşamadan oluşur,02.09.2023
tip konularda iyisi kitapçığı okumaktır scanmycitröen uygulamasını indirebilirsiniz resime gitmek tıklayın resime gitmek tıklayın resime gitmek tıklayın,02.09.2023
valla forumda pek bir şikayet eden olmadı hatırlıyorum,02.09.2023
merhaba normalde tarz toplara girmem bende sorun olup olmaması araçta kronik bir sorun varsa bunu değiştirmeyecektir kapak olsunlu konuşma tarzını yakışıksız bulduğum yazma ihtiyacı hissettim cam tavandan su almadı benim aracım karadenizde sele sebep olan şiddette bir yağış altında dahiel freni çekiliyken hareket ettiğine bakmamıştım denedim hareket etmediboya henüz atmadı boya kalitesi harika diyememaracı çalıştırdığımda klima söylediğiniz şekilde çalışmıyoraktif fren sistemi sadece uyarıdan ibaret değilkoltuk tamamen kişisel bir konu günde km yaptığım oldu aksine diğer b sınıfı araçlara göre bana konforlu geldi birçok arkadaşım koltukları konforlu buluyor dediğim insan fizyolojisi kişiden kişiye fark ederbenim aracın model shine paket aldığım dönemde fiyata alınabilecek dolu fonksiyonel arabaydı kadar ekmek kadar köfte bir söz var verdiğim paraya göre fazla verimi alıyorum ben sırada tamamen farkındaydım sorunlu bir aracın gelebileceğinin işler biraz şans işi an sorun yaşamıyorum yarın yaşamayacağım bir kaide yok dediğim bir kronik problem varsa benim yaşamıyor oluşum araçlarda problemlerin olmadığı anlamına gelmez ancak verimtecrübesorun paylaşımı konusunda üslubun seviyede olmaması gerekiyor yüzden ben cevap verme ihtiyacı hissettim,09.09.2023
bro senin araban model makyajsız model haziranda citroen yeni kasa çıkardı benim yazdıklarım yeni kasaya yönelik yeni kasaya yönelik eleştirileri özellikle su almasını citreon genem merkezi basın açıklamasıyla kabul etti diğerleri servis raporuyla onaylandı dediğin senin arabanda yaşanmadı eski model arabanda olmuyor yazan insanları yaftalamayın bin tl para verdik paramızın karşılığını istiyoruz örneğin basitinden senin arabanda arka kamera vardır benim arabam ekim model shine paket arka kmera yok sen bahsediyorsun şimdi aldığım raporlarla dava açacağım hukuki tarafına bakıyor avukat henüz satın almamaış arkadaşlara kesin tavsiyemdir almayın abi para kolay kazanılmıyor iki kuruş ucuz çöp almayın,09.09.2023
kardeş dokümanı okudum video tanıtımlarını izledim hatta ülkeye göre farklı yapıyorlar fransa web sitesindeki fransızca kullanım klavuzunu okudum sonuç sizin aktif güvenlik fren sistemi sandığınız acil fren destek sistemi park etmeye çalışırken göremediğiniz engellere çarpmanızı önler tam hatırlamıyorum sanırım km üstünde işe ayaramaz mesela km üstünde km ye kadar olan destek sisteminin adı aktif güvenlik fren sistemi servis der avrupada olan bir sistem sizin aracınızda sadece uyarı olark var kullanım klavuzuna bakarsan ülkede olmayabilir yazıyor der ayrıca bunun çalışması aracın önünde radar plakası olmalı sizde radar olmadan çalışmasını beklersiniz sizin aracınız ön camındaki sensör sadece sadece uyarı olarak çalışır der gayet kanıtlı bilgi bunun neyini tartışıyorsunuz,09.09.2023
