review,date
otoyol sürüş destek sistemleri erken önümüzdeki ay gelebilir dediler ay fransa limanında bekleyen araçlarda kesinlikle yok zaten ekim itibariyle üretilmeye başlayan araçlarda olacak,07.10.2023
merhaba ben denemedim model astra classic aracımda vardı arabanın motorunu kapatıp sinyal kolunu bir tarafa iterseniz tarafın park lambaları açık kalıyordu kitapçığında yazan bir bilgiydi hatırlıyorum sanırım bir çeşit test uygulaması birçok araçta varekleme yazdıktan sonra denedim aracı kapatıp şöför kapısını açın sonra sinyal kolu oynayın oluyor saygılar,07.10.2023
review,date
yılında aldığım shine bold aracımın kapısında dökülme oldu ay önce merkeze bildirdim bugün aradılar boyamak dışında yapabileceğimiz bir yok dediler citroen alırken kere düşünün i̇lgi alaka sıfır hukuki mücadelemiz başladı bir kişi hayırlısı bakalım,04.10.2023
foto paylaşabilirnisiniz üstad,04.10.2023
shine,04.10.2023
aracı uzaktan açtıktan sonra tekrar basılı tutuyorum sn sonra camlar açılmaya başlıyor lerde olmasın mantıksız başka bir çalışma prensibi mi var servise soralım diyeceğimde onlar bizden fransız arabaya,05.10.2023
aynen bunlara rağmen aracı seviyorum sürünce keyif alıyorum,05.10.2023
başardım bir baglanamadim bugun dk uğraştım yok yine bağlanmadi herseyi denedim yok aracı uygulamadan silip tekrar deneyeceğim bakalim,05.10.2023
önce web üzerinden kayıt bıraktımsağdaki otomatik chat yetkiliye bağladı benidurumu anlattım dakika içinde aradılaryurtdışı kaynaklı bir problem varmış güncelleme bekleniyormuşi̇lk girişte i̇ngilizce seçip devam edebilirsiniz geçici çözüm şekilde dedilerhenüz denemedimgüncelleme gelince düzelecekmiş i̇nşallah,06.10.2023
ben denedim ingilizce yapipbi bağlanır oldu kilometreyi güncelledi sonra tekrar iptal,06.10.2023
united kingdom evet,06.10.2023
shine aracım var benzinli genel olarak baya memnunum fiyata iyisi zor yakıt km oldu ortalamalardayım i̇stanbulda gayet iyi yakıyor düşüğü zor sadece bir kere ekranlar gitti siyah oldu akü kablosunu sökünce düzeliyor psa araçlarında bazen yaşanıyormuş peugeot vbde falan güzel fiyat bence alınır ortamda,07.10.2023
eksikleri uzun far asistanı ön park sensörü kör nokta uyarı eco led ön farlar gündüz farları v tarzı imzalı versiyon ön sis farları karartılmış arka camlar kapı kolları gövde rengi krom çerçeveler ekstra hoparlör head display kablosuz car play android auto navigasyon arka kol dayama elektro krom dikiz ayna bulabildiğim eksikleri an citroen bir firmada liste fiyatından bol bol indirimler var bin takas desteğini direk indirim olarak yapıyorlar üzerine fiyat düşüyorlar bin yakıt desteği var cam tavan arada shine bold versiyonda geliyor,07.10.2023
bence önemli farklılar şunlarkablosuz android auto kablosuz şarjperde hava yastıklarıön park sensörü kör noktaarka kol dayamaotomatik kararan dikiz aynasıköpek balığı antenshine boldda sadece bunlara ek cam tavan artısı var kayda değer,07.10.2023
bilgi teşekkürler acc olayı aklımda bugün onuda konuşacağım,07.10.2023
geri dönüşünüz teşekkür ederimevet ters giden bir şeyler var sisteminde bugün yine detaylı denedim profilimi cihazı sildim vs yine değişen bir olmadı ilk bağlantıyı bluetooth üzerinden yapıp wifiye geçerek carplayi aktif ediyortelefon onay talep ediyor bt bağlantısı yapıldıktan sonra carplay wifi bağlantısını açmamı istiyormy citroen bende aşağıdaki gözüküyor bir işe yaramıyor maalesefneyse şimdilik araç yeni herhangi çalışmayan bir özellik yok ilerleyen zamanda bakacağız duruma resime gitmek tıklayın,02.10.2023
shine bold sahibiyim ilk basma sonucu kilitleme sonra tekrar basma sonra cam sunroof kapaniyor acma icinse tam tersi ilk kilit acip sonra camlar vs sekans sekilde,02.10.2023
uzun süre basarsanız açma kapama özelliği mevcut araç kilitlendikten sonra camlar açıkken kilit tuşuna basmaya devam edin hatta kapanıyorken elinizi çektiğiniz yerde duruyor camlar ocak shine aracım,02.10.2023
kapama var açma yok bende shine bold sanirim x lerde özellik yok,02.10.2023
yazılımsal bir fark olabilir saçma bence sunroof mantığını değiştiyor diyeceğimde sunrooflu modelinde kapanıyoraçılıyor demiş üstte bi arkadaş servise bi sormak lazım çalışma mantığı farklıdır uzun bir süre bastığımı tekrar edeyim arkadaşların dediği sn vs değil camlar açıkken aracı kilitledikten sonra tekrar sn basılı tutuyorum,02.10.2023
açmada aracı açtıktan sonra uzunca bir süre basılı tutuyorum dediğim değil asla,02.10.2023
klasik jant icin olculer j jant iki kenar arssi genislik inc iken ideal olan lastik genisligi son olcu taban genisligini artirmak icin lastik yanagindaki direnci degistirmek bence dogru degil kaldi aracın virajlardaki davranisini hepimiz biliyoruz yazlikta standart olculerle devam edip kislikta bir jantla devam ediyorum suruse gore araci degistirmek yerine araca gore surusu degistirmek gunluk kullanicilar icin emniyetli oldugunu dusunuyorum resime gitmek tıklayın resime gitmek tıklayın,02.10.2023
zaman hukuki acidan yapilacak hicbirsey yok ben ocak ayinda araci teslim alirken sozlesmeye donanim listesini zimbalamislardi bayii bile koltuk isitmanin olmadigini bilmiyordu citroen merkezi eksikligi kabul etti cok dusuk saka bir geriodeme teklif etti kabuletmeyerek mahkemeye verdim,03.10.2023
kadar teklif etti hocam,03.10.2023
citroen shine aracım dün çalıştırdım ekranlar simsiyah açılmadı araç çalışıyor ancak göstergeler aktif değil bugün servise gösterdim araç kmde binden sonra bakım ışığı yanmıştı sormak ekran olayı şubatta teslim aldım sene olmadığı bakımı bilgisayara bağlayıp sene haber verecek şekilde güncellediler ekran kararması sanırım akünün kutup başlarını söküp geri taktılar reset bisey yaptılar i̇nsallah bir vermez böyle bir hata,03.10.2023
ekran psa grubunda kronik an dk bir hata olabilir,03.10.2023
açmayı bir türlü yapamadım,03.10.2023
aracın arka difüzör parçası dün serviste garantiden değiştirildi müsait zamanda fotoğraf çekmeye çalışırım,03.10.2023
aracınız neydi,03.10.2023
üstat başıma gelmedi frene yeterince basmayınca oluyor normalonun dışında böyle bir problemle karşılaşmadım bende şekilde bi sıkıntı oluyor yağmur yağdığında yağmur sensörü yavaş çalışıyor seviyeleri arttirsam hızlı yağdığında hızlanma yeterince olmuyor aracın sensörleri mi dandik anlayamadım kör nokta uyarı sisteminin önce haber vermesini isterdim araç neredeyse yanımdan geçerken haberim oluyor sadece,03.10.2023
otomatik silecek zaman yapmıyor onu bazen iyi çalışıyor bazen yağmurun hızlanmasını algılamıyor ayrıca silecek suyu fışkırtmıyor bazen depo dolu olmasına rağmen kanallar tıkanık desen çalışmaması lazım bazen sorun yokmuş tekrardan çalışıyorbende geri görüş kamerası kararıyordu servise götürecektim kendi kendine düzeldi bir sorun çıkarmadıaracın tuhaf huyları var,03.10.2023
teşekkürler geçmiş olsun diyelim civatalar altta kalıyor herhalde görebilmek altına yatmak gerekiyor sanırım kmye gelmeden ara ara kontrol ederim,04.10.2023
açma bende yok feel bold sadece camları kapatıyor basılı tutunca bir şekilde açtıramadım camları,04.10.2023
resime gitmek tıklayın sonunda oldu,30.09.2023
bin civarı,30.09.2023
park sensörü ses çıkarmıyor sizce olabilir,01.10.2023
cok yaklaşınca ses çıkarıyor ekranda uyarı gösteriyor belli bir noktaya kadar,01.10.2023
size açık bir şekilde şunu diyebilirim baglandigimi bilmiyorum hemen hemen hergun aracı telefona bağlamaya çalıştım kablo aldim onla denedim vs yine olmadı artik vazgeçme noktasına gelmiştim sonra bluetooth bağlantımı sildim android oto bağlantımı kestim bluetooth tekrar eşleşme yaptım arada telefonun i̇nterneti kapalıyken denedim bluetooth i̇nternet bağlantısını paylaştım hepsinde ayrı ayrı denedim bi tanesinde bağlandı hangisi olduğunu bilmiyorum mesela kablo bağlıydı karma karışık şekilde bağlandı tahminim sekilde bizde android auto sizde carplay otomatik bağlantısını kesip otomatik bağlantının önüne geçmek gerekiyor sonra bluetooth u silip tekrar eşleştirme yapmak bluetooth bağlantı sağlamak gerekiyor mesela bugün tekrar denedim çalışmadı zamanım yoktu uğraşamadim,01.10.2023
hasan bey ben denemelere devam edeceğim fırsatta pratikte yaptığınız kesin bağlantı durumunu tespit ederseniz bizleri bilgilendirin sizlerden ricamsevgiler selamlarböyle zor olmamalı,01.10.2023
bunun nedeni yazılım sınırlaması olabilir mi feel bold bende olmuyor üst paketlerde vardır peugeot arabadan indiğimde otomatik geliyordu bilgi an ekran güncellemesine baktığımda yok diyor grupta geldiğini yazanlar var,01.10.2023
yazılım sınırlaması olabiliri̇os güvenlik sebep olabilir buna güvenlik sebebiyle almıyordur anlayamadımdenemelere devam edeceğim,01.10.2023
bende shine bold varbende panaromik cam tavanı açıyor ancak camları açmıyorcamlar tavan açıksa ikisini kumandadan kapatıyorcam tavan açılabildiği zannedersem camları açmıyordur düşünüyorumbu arada süre olarak gecikme hasan beyin dediği fazla vw polo vardı sene önce hızlı açıp kapatıyordu camları,01.10.2023
kadar yaklaşsam ses çıkarmıyor bir kaç gündür anlayamadım sebebini,01.10.2023
saniye bekliyoruz devreye girmesi icin bir camlar kapanana kadar elimiz basılı kalmak zorunda elimizi çekince açık bırakıyor cam tavanin acilabilmesi kapanabilmesi kaynaklı dediğiniz,01.10.2023
haber vereceğim gıcık bi durum bakalim denemeye devam,01.10.2023
arka park sensörü peki dediğiniz telefon bağlantısını iptal edip deneyeceğim,01.10.2023
arkadaşım ben açıklık getireyim araçta wifi çaşılışıyor otamatik bağlanıyor araca telefon bununla carplay auto yu kablosuz kullandırıyor bağlandığı wifi noktasından internet almıyor araç bağlantılarda wifi açılsa oradan bağlantı gerçekleşse telefondaki interneti araç alacak harita yazılım vs güncellemelerini yapacak servis bunun yazılım çıkacağını söylüyor şimdilik bekleyin diyor,02.10.2023
ler içinde yazılım çıkarmı onlarda kablosuz android auto yok,02.10.2023
icin jant lastik alan oldumu yardimci olabilecek varmi ölçüleri boyle gözüküyor jant olayini anlayamadim,02.10.2023
servise götüreceksiniz arıza kodu verdiyse sorun belli olacaktır,30.09.2023
ben dikkat etmedim var vwlerde mercedeslerde vs var sinyali hangi tarafta bırakırsanız tarafın park lambaları yanıyor,30.09.2023
bugün ben wifi bağlantısını denedim tuşa basınca önce açılıyor sonra tekrardan kapalı moda geri dönüyorkullanma kılavuzu sayfada aşağıda yazan duruma dikkat edip telefon mirror screen bağlantısını kaldırıp denedim olmadıyarın usb bağlantısı iletypec tarafı tekrardan deneyeceğim resime gitmek tıklayın,30.09.2023
bende vidanın bir tesi düştü servise gidicem,30.09.2023
yarın deneyeceğim sinyali sağa verip arabayı kapatacağım sonrasında aynı olursa sıkıntı yok zaman yorumunuz teşekkür ederim,30.09.2023
wifi bağlanmıyor yaptıysam baglayamadımmy citroen programa baglayamadım arabayı güncelleme felan olmuyor citroen in para etmez sistemi,30.09.2023
araca gelen güncellemeleri ücretsiz yaptırıyorsunuz servise,30.09.2023
kayseri mersin servislerini aradım ikisi şase numaramı istediler kendileri tarafinda bir güncelleme görünmediğini dolayısıyla güncellemeyi bizim yapmamız gerektiğini söylediler,30.09.2023
geleen güncellemenin sürümü,30.09.2023
bugüne kadar yaptığım güncellemeler arayüzde hiçbir değişiklik olmadı arka planda değiştiriyorlar bilemiyorum uida ufak tefek değişiklikler olsa azından güncelleme yapmak bir hevesimiz olurdu bana gelen updatein adı yabancı forumlara baktığımda güncellemeyi yaptıklarını fakat gözle görünür hiçbir değişikliğin olmadığını yazmışlar acele etmiyorum yüzden ben artık güncelleme geldi,30.09.2023
psacode ekibi görüşün bir özelliği aktif hale getiriyorlar bir servis sizin talebinizi gerçekleştirmez zaten markalar konuşuyorum,30.09.2023
shine bold aracimda kumandadan cam kapatmada bekletiyor peugeot aracimda bile camlar kapılar kendiliğinden kapaniyordu anahtara sn basılı tutunca kapaniyordu bunda saniye tutuyorum bazen kapatmıyor kodlamacilara yaptırmak lazım kumandadan cam açma yok mesela,30.09.2023
teşekkürler olmamasının imkansız olduğunu düşünüyorum fiziki olarak araçta herşey var yazılım olarak tetikleyecek sadece camları,30.09.2023
ford wv saniye basılı tutunca kapatıyor,30.09.2023
bende shine var kumandadan kapanıyor açılmıyor böyle yarım koymuşlar özelliği,30.09.2023
yetkili servis çıkarır özel servislerde bakım yaptırırım kadar derler bilmiyorum arada cam tavan tabiiki iyi olrudu özellikle sunroof kullanan birisi olarak fiyatfarkı var malesef kısmet denk gelir,30.09.2023
lpgli bir araç yakar bilmiyorum izmir ortalaması şehir içi lt ankarada ortalamalar olacaktır konfor olarak artısı olacaktır citroenin size özel bakım dediğiniz yetkili olmayan yerlerde bakım yerde ucuz zaten sıfır araç alıp garantiyi bozup sokabilirsiniz aynı fiyatlara servis ücretleri civarında olacaktır ortalama bakım km bin km sene şeklinde an kampanyalar mevcut liste fiyatının altında araçlar sıkı pazarlık shine bold bulup almanız iyi olarak geçen aracı arayın olanı acc özelliği yok,30.09.2023
shine bold liste fiyatı anda fiyattan konuşuyor bayi ancak eklenen aksesuar yapılan uygulamalara göre üzerine çıkabilir bir miktar ereğli bayisi konuda aç gözlü değildi açıkçası ben zaten dışarıda yaptıracağım uygulamalarıaksesuarları onlar yaptığı razıydımbelki anda fark vs dahi istenmiyordurbenim aracım zam aldı temmuzda kapora ödemiştimaçıkçası stellantis citroen türkiye fransa merkezlerinde ulaşabildiğim yöneticiye yere yazdım citroen ertesi gün aracımı gönderildi bayiye cimere başvurdumöğrendiğim kadarıyla araç sevkiyatı fazlaymış fransadan ilk gelen ilk çıkmıyor sevkiyata eski araçlar arkada kaldığı gecikmeler fazla oluyor sizin aracınızdan sonra gelen araçlar teslim edilebiliyor,30.09.2023
gelmiyorsa almak mantıklı değil ab normlarına göre çoğu standart olacak güvenlik önlemleri ekstra paralar vermek mantıklı olmuyor şahsi görüşüm birde para verip normalde olan donanımları alamıyor olmak kötü,30.09.2023
evet zaten aracın özelliklerini kismasalardi şuan bizde bircok yönüyle memnun olabilirdikaz önce uyandigimda rüyamda satip geçmişim derece takmışım konuya,30.09.2023
gt olmalı gerçi onda baya indirimler başladı mantıklısı sıra ondan sonra grandland donanım rakam anlamında,30.09.2023
hocam selam muhtemelen görünüyordur çözüm olarak kelebek somun yerine perçin kullanılıyormuş tamir esnasında sebepten isterseniz kelebek somunları bir kontrol edebilirsiniz yada aracı servise götürüp kontrol ettirebilirsiniz,30.09.2023
versiyon versiyon olanları var acc adaptive cruise control açılımı aracı almadıysanız iyice araştırıp almanızı öneririm test sürüşlerinde acc şerit ortalama yok,30.09.2023
ben aracın ödemesini yaptıktan sonra burdan öğrendim versiyon acc nin olmadığını önemsemiyorum belli başlı otobanlarda kullanabileceğiniz şehir içinde pek işinize yaramayacak bir ozellik sıkça uzun yol yapanlara bir diyemem aracı haftadır kullanıyorum özellikle konforunu oldukça sevdim bakalım ilerleyen zamanlarda olacak,30.09.2023
bence yaniliyorsunuz ocak ayindan beri kullaniyorum sehiricinde bile acc yi kullaniyorum ozellikle sikisik trafikte durkalk cok konforlu oluyor,30.09.2023
ocak ayinda teslim aldigimda aracda koltuk isitma cikmadi mahkemeye verdim eksik donanim arac teslim alanlar nicin mahkemeye vermiyorsunuz hakkinizi arayin,30.09.2023
önce acc kullanmadınız sanırım yorumunuzdan çıkarımım acc sadece otoban sürüşlerde konforu arttırmaz sıkışık şehir içi trafiğinde arkanıza yaslanın direksiyonu tutun sadece acc birlikte şerit asistanı birlikte çalışarak size başlangıç otonom sürüşü sunar büyük şehirlerde yoğun iş giriş çıkış trafiğinde bulunmaz nimettir,30.09.2023
dediğiniz biraz alışkanlık meselesi olabilir ben aracın kendi kontrolumde olmasına alışığım sanirim yüzden dert etmedim,30.09.2023
herkese merhabacitroen genel müdürlüğüne durumu bildirdim bir gün sonra parçaların garantiden değişeceğine dair onay verildiğini servise bilgi yollandığını belirtiler servisi aradım onay geldiğini teyit ettiler pazartesi gününe servisten randevu alabildim serviste garantiden değişimini yaptıktan sonra buraya bilgi geçerim hala serviste sorun çıkarabileceklerini düşünüyorum,30.09.2023
teşekkür ederim start stopa alışmaya başladım ancak otomatik şeritte tutma özelliğini direkt kapatıyorum virajlı yollarda kaza yaptırabilme potansiyeli var gibime geldi,30.09.2023
garantinin karşılamasına sevindim mümkünse yaptırdıktan sonra perçinli halinin fotoğrafını paylaşabilirseniz diğer kullanıcılar örnek teşkil eder,30.09.2023
ay olmadan bayi sizden normal koşullarda alamaz dışarıya satmanız gerekir sıfır ortalama bandına alanlar mevcut,30.09.2023
herhangi bir bayiye mi satamıyoruzkanunu bilmiyorum kusura bakmayın,30.09.2023
resime gitmek tıklayın alt kisimda,30.09.2023
geçmiş olsun hocam yaşadığınız duruma kronik diyip kendi hatalarını olduğunu kabul etmeleri sonrada para istemeleri ilginç ben olsam sadece servisle muhatap olmaz konuyu birde citroen genel merkeze açardım kayıt açsınlar oradan cevap alın bende silecek suyunu püskürten püskürtücünün araçta yer almıyordu bugün götürdüm garantiden takacaklar duruyor büyük ihtimal araç şekilde bana teslim edildi ilk kullanımımda ortaya çıktı sizin garantiden yapmaları gerekir düşünüyorum ayrıca süreç hakkında bizleride bilgilendirirseniz sevinirim kronik bir sorun olduğuna göre zamanla bizde yaşayacağız azından deneyimlerinizden yararlanırız,30.09.2023
lastik basınç kurulumu araç menüsü içinde güvenlik menüsünden yapılmakta lastik değişimi hava bastığınızdatersi olabilir buradan basınç resetleme kaydı yapıyoruz resime gitmek tıklayın,30.09.2023
i̇deal basınç değerlerini biliyor musunuz,30.09.2023
x shine bold önler arkalar barya önler arkalar psi,30.09.2023
binde netleştiniz mi,30.09.2023
yeni çalıştırmada tekrardan devreye giriyor özelliklerkullanma kılavuzu sayfa sürüş yardımcılarını kısayollara ekleme çoklu devreden çıkarma kullanışlı özellikler varseçtiğiniz özellikleri tek seferde devreden çıkarma resime gitmek tıklayın,30.09.2023
citroen bayilerinin alacağını sanmıyorum yasal mevzuat gereği el altından alır almaz bilemem dışarıya sarı siteden vs satabilirsiniz mantıklıdır,30.09.2023
yok hocam götüremedim fırsat olmadı iş güç aracı pek kullanamadım hafta haber ederim görüşünce servisle,30.09.2023
bence pişman olmazsın ort civarı yakıyor dur kalk çoksa lt gözden çıkarmak lazım uzun yol sık yapanlar lt yakıt var arac kesinlikle iyi bakım civarı deniyor henüz bayiye sormadımbütçeni biraz zorlayıp shine bold almalısın cam tavan yeter,30.09.2023
üstat bende böyle çıkmıyor araçta telefondacitroen uygulaması zaten bozuk,30.09.2023
merhaba kendiniz sorunuza cevap bulmuşsunuz d modunda frene tam basılmazsa araç hareket etme eğilimi gösterdiğinden manuel araçlardaki kavrama titreme yapıyor aracımda aynı geçmiş tecrübelerime dayanarak normal olduğunu düşünüyorum servise falan sormadım n modunda rölantileri mümkün olduğunca düşük tutmaya çalışıyorlar muhtemelen ondan yapmıştır bekleme süresince d modunda frene tam basarak sabit tutmanız fren balata ömrüne katkı sağlar zira hafif tutarsanız araç gitmefren tutma eğilimi gösterir sürtme oluşur balata çabuk yıpranabilir,23.09.2023
cevabınız teşekkür ederim hafif basmıyordum frene evet d modunda bunu bir parça normal karşılamak gerekebilir aynısını n modunda yapması beni şaşırttı bilmiyorum biraz kullanınca anlayacağım yada servise soracağım önceki aracım dacia sandero yine otomatik silindirli turbo motordu yıl boyunca böyle görmedim,23.09.2023
i̇lk teslim aldığımda bende bin görünüyordu servise sordum sonra getirin yapalım demişti benimde an yüzden sordum,23.09.2023
start stopu tamamen kapatamıyoruz sanırım ayarlardan kapattığımda araç yeniden çalıştırılana kadar start stop devre dışıdır yazıyor araç trafikte motoru durdurunca direksiyon kilitleniyor yoğun trafikte frenle dur kalk yaparken biraz sarsıyor hafif rampada geriye kaydırdığını gördüm bunlar nedense start stop sisteminden kaynaklı olduğu anlaşılıyor önce kullanmadığım bir sistem kullandıkça alışırım düşünüyorum bakalım,23.09.2023
dışarıdan yazılımla komple iptal ettirebilirsiniz,23.09.2023
aaa anladım hocam bir götüreyim bakalım ben teşekkür ederim,23.09.2023
makyajlı b suv gt niyetlendim üzeri bir fiyatı var araç güzel sonra kendime dedim araç fiyatı hak etmiyor imdadıma yetişti kasa göreceli ben beğendim konforu malzeme kalitesi güzel bir araç yakıtı bir tık yukarı silindir biraz performanslı kullanımla depoda ortalamam an kısa mesafe sürüşüm olduğu normal diyebilirim yukarıda yazılan bir şeye katılıyorum araç bir aile aracı sport bir kullanımdan ziyade konfor odaklı bir sürüşü var motorda gayet performanslı direksiyon keyifli virajlar korkutmuyor performanslı sürüşe uygun değil özetle konforlu bir aile aracı ikinci elde km yapmış araçlar güzel fiyatlarda an bir bakın,23.09.2023
beyaz yanmasını istiyorsanız led takmanızı öneririm ancak arıza ışığı yakabiliyormuş normal ledler yüzden canbus özellikli olması gerekiyorcanbus çipi olan ledler aşağıda resmini paylaşıyorumdevamlı yanmasını bir elektrikçi yapabilir ancak garanti konusunda olumsuzluk yaşar mısınız bilemiyorum ayrıca gece sürüşlerinde devamlı yanması rahatsızlık yaşatabilir resime gitmek tıklayın,23.09.2023
aman hocam cetas dan uzak durun soyledieri özellik arabada çıkıyor hatalarını kabul edip arkalarında duruyorlar yetme birde teşhir araç sattılar bana psa nev oto bende arkadaslarimda sıkıntı yaşamadık cetas bin aşağı verse vallahi almam,23.09.2023
nesi kıpır kıpır ikinci şehir içi aracım ayrıca benim kadar aracı eleştiren yok geçmiş mesajlara bak istersen,23.09.2023
aracımız geldi bugün alıyoruz i̇nşallah citroen shine bold resime gitmek tıklayın,30.09.2023
hayırlı olsun kazasız belasız günlerde kullanmanızı dilerim ereğliden mi aldınız aracı,30.09.2023
teşekkür ediyorum iyi dilekleriniz evet ereğli bayisi gençler otomotiv,30.09.2023
çetele tutmuyorum benimle olan mesajlarınız ortada,30.09.2023
teşekkür ederim hasan bey hasan can beydi temsilcimizaracı sürerken kontrol ettim acc şerit ortalama yok şeritte tutma asistanı var sadeceakşam ekranları vs kurcaladım önce bahsettiğiniz wifi tuşu açılmıyor aktif değil,30.09.2023
shine farkı bulamadım ben arada i̇kisinde kampanyalar vs derken fiyatları arası aşağı düşer,23.09.2023
üst donanım fiyatı feel bold otomatik alabiliyorsunuz hatta bırakıyorlar derseniz bayrampaşa çetaş derim hemen yan tarafındaki peugeotda küsür fiyat çekmişlerdi oradan aklımda küsür fark var aklımda kaldı,23.09.2023
baz donanım kıyaslamak doğru olmadığı yazdım shine paket allure örnekleme yaptım boş paket ps baya boşlar boşu bir araç genellemeleri yaparken yakın seviyede muadil örneklemeler yapmak lazım bilgi almak okuyan kişileri yanlış yönlendirmemek adına bunun dışında iki aracın zaten platformları bile farklı kalite algısı bir tık yukarıdadır donanım vs dahil yaklaşık paket fiyatlarına bakarsak arada dağlar kadar fark yok,23.09.2023
boş dediğin paket manuel olan dediğim fiyat otomatik feel bold paket senin dediğin hp lik versiyonu e alabilirsin an,23.09.2023
hayır muadili yazdınız an e otomatik alabiliyorken neredeyse lira vermeniz gerekiyor aradaki fark bin tl değil küsür bin fazladan ödemesi gerekiyor onu diyorum aynı fiyat aralığında değil küsür fazla verecek olduktan sonra alternatif var i̇ki araç üç aşağı beş yukarı aynı fiyat olur alternatif olarak düşünülür zaman diyeceksiniz allurede fazladan donanım var evet bin tl fark yaratacak donanım yok allurede feel bolda karşılıkayrıca d sınıfı diğer b sınıfı yazıyorsunuz dağlar kadar fark var şanzıman motor boyutlar araç ağırlığı bagaj hacmi araç uzunluğu araç yüksekliği azami hız yakıt tüketimi vsvs neredeyse birebir aynı deseniz tasarım olarak güzel bin farka değer zaman hak veririm teknik boyut olarak farklı bir araç değil,23.09.2023
ben şahsen shine bold almadan önce chery omoda dolu paketi arasında gidip gelmiştim omoda shine bold göre bağımsız arka süspansiyon silindirli turbo motor ambiyans aydınlatma derece görüş park asistanı özellikleriyle öne çıkıyordu bin tl ucuzdu benim tercihim citroenden yana oldu,23.09.2023
arasında bir rakamdaydı geçen ağustos ayında varsa farklı farklı servislerden fiyat alın bildiğim kadarıyla bosch car service garanti kapmasında bakım yapıyordu onu teyit edin,23.09.2023
