review,date
max battery paketli elektrikli vw adam güney türkiyeye yakın enlemi almanyadan silivriye yolu şarj yaparak geldi araç aynı yolda kaç şarj olur düşünemiyorum ancak iyi şehir aracı dediniz zaten neler diyorum ben,05.08.2023
spring km yol i̇kisi bir cümlede olmaz,05.08.2023
alibaba arabası,05.08.2023
eh tenekeden hallice,05.08.2023
fiyatı önemli aralığında girerse karaborsa üstü satılmazçünkü togg çıkmış olacak bandında çıkarsa millet bunun yerine togga yönelirhalâ nazlanıyor gelmek yıl önce geleydi iyi iş yapardızaten çinlilere ekstra gümrük vergisi kitlemeselerdiortalık çin çan çün arabası kaynardı,05.08.2023
boş verin bayiler markalar sürekli reklam yapar bayiler araç yok der eskilerde yokmuş zaten,05.08.2023
el alemin fakirinin bile suratına bakmadığı araçlar türkiye bin birim para ülkeye bak giriş seviyesi olan araçlar bile artık lüks sayılıyor evet gerçekten uçuyoruz uçurumdan aşağıya,29.07.2023
euro normları bizi bitirdi zengin avrupa ülkeleri uygun bizim ülkeler eziyet,29.07.2023
dacia ceo su dacia gelecek hibrit değil lpg li motorlarda açıklaması yapmıştı avrupada jogger oldukça başarılı olmuşsatışların ü lpg li versiyonmuş satılan joggerların büyük bölümü full donanım olanlarmışotomatik olması hibrit olması jogger büyük avantaj avrupanın ucuz koltuklu hibrit motorlu aracı oluyorbir sonraki motoru renaultun yeni hibrit motoru olur yıl sonra,29.07.2023
eco lpgotomatik gelse keşke peynir ekmek satar,29.07.2023
otomatik vites koymadikca satması zor,29.07.2023
gelen araçlar satılmışbugun bayiler yine pazar yeri gibiydi araçlarda satılmıştır yazisi vardi yeni gelecek araçlar ide aralık üretim ocak teslim ocak ayı fiyatı gecerli deniyor,29.07.2023
vay be özellikler sunmuş özellikle araçta gaz pedalının fren olması mükemmel bir detay düşünsene belli bir kilometre hızla gidiyorsun ayağınla bir şeye bastırdığın zaman araba duruyor i̇şte fren deniyor ona kadar güzel teknolojik aletlere biniyoruz oyy,29.07.2023
beğenmediğimiz araçlara ulaşamıyor olmak artık,29.07.2023
şehir içi köy yeri iş görür başarılı,29.07.2023
fiyatlar iyi yok öyle türk müslüman olup insan yaşamak,29.07.2023
hale bak işçinin maaş ına senede kadar zam gelmedi bakıyorsun herşeye adelet ten anladıkları sanırım,29.07.2023
