review,date
türkiye ye giriş yapsın ay içinde satış rekorları kıracak bi arac logan dan sonra mükemmel bencebakkal manavklimaciekmek servis aracıpen işi yapanlar yapi marketler servis yapan gıda marketler küçük çapta bağ bahçesi olup ondan gelir sağlayanlar yok satar bi elektrikli olsa tadından yenmez ülkemizde fiat pratico harici mini pickup malesef yok yok yok,16.09.2023
elektirikli araçlar km fazla dakika bir sürede tam dolum olursa yeterli şarj portuda olursa kimse gidip benzinli dizelli araç almaz kırılım sağlam olacak biryerden sonra,16.09.2023
yinede elektrikli araçların handikaplari var ülkemiz vergileri yüksek batarya zamanla eski performansını kaybediyor bir noktadan sonra değişmesi gerekiyor değişim ücreti yüksek oluyor,16.09.2023
ula öle kala,16.09.2023
e taktırdım yaklaşık yıl kadar oldu yağmurda problem oldu içine su aldı matkapla altından küçük delik açtım sorun çözüldüonun dışında bir problem yokbu arada servise taktırmadım dışarıda yan sanayi taktırdım,26.08.2023
takılan yok düşünüyorum benarabada ciddi sorunumuz yok olanı yazıyoruz cevap veren yok hayırlı olsun,02.09.2023
aydır kullanıyorum dacia duster journey anahtarsız giriş çalıştırma otomatik vitesinden motorundan memnunum genel olarak bir sorunum yok multimedyasından biraz şikayetciyim multimedyasi bendeki avi dosyalarını çalıştırmıyor çocuklar yolda çizgi film seyrediyordu seyredemiyorlar ayrıca multimedyasinin takilan usb hafızayı tanıması uzun sürüyor,02.09.2023
araç giderken video çalıştırmaması gerek,02.09.2023
onu anlarım durarken çalıştırmıyor bendeki standart codecli avi dosyalarına format bozuk diyor eski sanderomdaki multimedya android tabanlı idi hepsini çalıştırıyordu,02.09.2023
orijinal aksesuarlarda çalıştırmıyor biliyorumextra takılanların çalıştırıyor biliyorum hocamservis çözerolmadı şirinevler esnafı çözer muhtemelen,09.09.2023
merhababen journey paket sahibiyim aydır kullanıyorum km yol yaptım memnunum fiyata özellikler iyi pusula eğim açı ölçer altimetre özelliğini micom menüsü açtım menü temasını halen değiştiremedim sonraki versiyonda inşallah,16.09.2023
hocam ben tecrübe etmedim takmayı düşündüm gidip ürünleri yerinde inceledim bizzat serviste yeni takılan bir aracı inceledim fazla işçilik hatası vardı parçalar birbirine tam oturmamıştı sonradan takıldığı belli oluyordu bir üstündeki yapışkanlar kaliteli mi bilmiyoruz ilerde düşse kırılsa bir olsa boyaya zarar verir mi sorusu akla geliyor,26.08.2023
arkadaşlar ben arabayı aldığımdan beri kalkışlarda olan bir titreme sorunu var defalarca servisine götürdüm debriyaj volan değişti debriyaj öğretmesi yapıldı felan sonuç yine aynı bir iki ay gidip sonra yine başlıyor araca sahip olupta sorunu yaşamayan var sorunu çözebilen var,16.09.2023
bende journey var saati hava derecesi araç bilgisayarında yok multimedya üzerinde gösteriyor,19.08.2023
yazılımla eklenebiliyormuş buraya yazdıktan sonra biraz araştırdım youtubeda videoları izledim pek uğraşmak istemedim açıkcası ekranda olmaması cidden saçma,19.08.2023
hakan bey sorunu nasil hallettiniz cevapları goremedim,02.09.2023
arkadaşlar merhaba duster aracim icin xenon onerisi istiyorum kullanan tavsoye eden olursa sevinirim,09.09.2023
duster vites kutusu hararet uyarısı verdi biraz bekledim geçti sonra ciddi bir durum mudur,16.09.2023
arkadaşlar latutude aracımız var iki üç ay oldu alalı hatasız boyasız kazasız binde ortalama yakıt tüketimi litrenin altını görmüyor litreleri yakan arkadaşlar yapıyor araç ileri olduğundan elin vites topuzunda gidiyorsun zaten sürekli vites değiştirmekten kolun yoruluyor vites geçişlerini genelde bin devirde yapıyoruz modunda kullandığımız halde şehir içi şehir dışı karışık kullanımda şehir dışıdır ortalama tüketim litre altını görmüyor,12.08.2023
bright like a diamond aleyküm selamfiyatı pahalı comfort duster kullanıyorum sağlam sallantı vs yok lök derler ürünün kolisini kaldırınca anlıyorsunuz sadece biraz yüksek boy altındaysa sıkıntı olabilir belkiyoutubeda montajı var fazlayorumum reklam değil tavsiyedir arada araçtan memnunumondaki tek eleştirim bir aylık süreçte yine boyla ilgilizira altı üzeri sürüşte koltuk yükseltme alçaltma olmadığı orta pakete baksınlar bencedipnot boyum,12.08.2023
aralıkta yeni kasa sıfır sandero stepway fabrikasyon lpgli aldım memnunum i̇nternette teknik özellikleri var i̇stanbul şehir içinde çevre yolunda kmde ortalama litre lpg yakıyor şehirler arası denemedim yılından beri sırasıyla ford taunus renault tx şahin s renault clio sedan ford focus kullandım sadece reno txi kısa süre kullandım diğerlerini oldukça uzun sürelerde kullandım bir önceki arabam yılından beri yıl süreyle kullandığım model sedan trend ford focus idi araca yılında simit brc lpg sistemi taktırmıştım yıllık bakımlarını düzenli yaptırdım ufak tefek ayarlar dışında bir sorun yaşamadım satmadan önce on yılı doldurduğu sadece tank tamir kitini orijinaliyle değiştirmiştim şimdiki aracım yeni kasa sandero stepway orijinal lpgli turbo motor tork,16.09.2023
yeni dacia springin fiyatı temmuz açıklanacak extreme donanımıyla satışa sunulacak dacia spring electric motoru lansmana özel arduvaz mavi renk seçeneği donanıma özel tasarım öğeleriyle temmuz tarihinde türkiyede yollara çıkacak yeni donanımın tavan barlarında yan aynalarda jant göbeklerinde bagaj kapağındaki dacia logosunda aracın sis farlarının üstünde yer alan dekoratif parçalarda bakır kahverengi kullanılıyorspring extremein iç tasarımında kapı eşiklerinde ön kauçuk paspaslarında topografik desenler karşımıza çıkarken ön kapı panellerinin belirli bölümleri dışında havalandırma ızgaraları navigasyon ekranı çerçevesinde bakır kahverengi dekorlar bulunuyordacia spring extremein electric motoru adından anlaşılacağı hp güç nm üretiyor standart versiyondaki hplik motordan güçlü versiyonda kullanılan vites kutusunun uzun bir menzil yoğun enerji geri kazanımı sağladığı iyi bir hızlanma performansı tekerleklere iletilen torku artırdığı belirtiliyortamamen yeni electric motor kwsalik lityum iyon batarya spring extreme wltp ortalama döngüsünde km wltp şehir döngüsünde km menzile ulaşabiliyor son hızı kms sınırlandırılan modelin bataryası dc şarj opsiyon dakikada yüzde doluma ulaşabiliyor kwlık ac şarj tam dolum saate yakın sürüyor ayrıca bkzopel gelecekte üreteceği otomobillerin öngösterimini experimental konseptiyle yapacakyeni spring extremein standart donanımları arasında teknoloji paketi bulunuyor paket inç multimedya ekranı navigasyon arka park sensörleri geri görüş kamerasından oluşuyor elbette bunlar essential versiyona göre fiyat farkı oluşturuyordacia spring extremein fransadaki fiyatı eurodan başlıyor springin çinde üretilen bir otomobil olduğunu hatırlatmakta fayda var geçtiğimiz aylarda çinden ithal edilen elektrikli otomobillere ilave gümrük vergisi getirildi dolayısıyla spring planlanandan pahalıya gelecek ancak marka fiyat konusunda hala iddialı,16.09.2023
yılına yakışmayan içdış tasarımı yüksek fiyatı piyasaya girecektir çinli marka burun kıvırdıgınız cheryler bile bunun yanında premium araç duruyor,16.09.2023
kadar sürelik fiyatı önemli,16.09.2023
leş tasarım ilk okul çocuğa araba çiz desen güzel bir çıkartır ortaya neyse zaten çoğu alamayacak bişey olmaz d,16.09.2023
sene önceye dayanan alibabada satılan düşük teknolojili çinli araç yüzden,16.09.2023
vw olsa a getirirdi reno der,16.09.2023
kilometre nedir scooter alsak iyi,16.09.2023
yerli milli otomobilimiz dacia fiyatıyla bizi üzmez,16.09.2023
normalde avrupadan gelseydi düşük ötv avantajıyla bugün tl olacaktı çinden geleceği olacak,16.09.2023
bin lirayken getirmedi şimdi isteyecek,16.09.2023
avrupada teşvik üstüne teşvik veriyolar bin euroya geliyor burada milyon olur,16.09.2023
dacia araçları dandik,16.09.2023
bin mi paralara zor satar baz versiyon togg bin deyken,16.09.2023
km hız yaparsan km menzil km ye düşer muhtemelen yüzden hızı kesiyorlardır,16.09.2023
arkadaşlar merhabadacia solenza sandik motor ariyorumyardımcı olursanız sevinirim,16.09.2023
hayırlı olsun hocam kazasız belasız binin inşallah sıfırından pahalıya gelmiş zaten paket satılmıyor arasanız bulamazdınız araç kullanımıyla ilgili verebileceğim bir tavsiye yok ben genelde aracı uzun mesafede kullanıyorum şehir kısa mesafelere hala eski arabamla gidiyorum uzun mesafede yakıttan fazla tasarruf sağlıyor bana trafik magandalarına dikkat etmeniz yeterli güle güle binin,16.09.2023
teşekkür ederim hocam i̇nşallah kazasız belasız bineriz dediginiz,16.09.2023
yılda zam gelmiş be,19.08.2023
hocam uzun bekleme sırasında bence araç kavramayı ayırıyor n moduna geçiyor kendisi bunu fren pedalından hissedebilirsiniz yüzden yeniden kavrama yaparak sn kalkıyor kısa dur kalklarda durum oluşmadığı hemen hareket ediyor,16.09.2023
bir dikkat edilecek husus yok bana aracın boyası biraz önce geldi boya koruma yaptırmak kuş pisliği şeyleri hızlı temizlemek iyi olabilir lastik hava basınçlarına dikkat edersiniz onun dışında keyfini çıkarın özellikle alt yüksekliği nedeniyle hafif arazide bile rahat arabanın altını vurur muyum derdi yok,16.09.2023
teşekkür marttan beri bekliyordum nisanda aracı teslim aldım ye geldi fatura fiyatı,02.09.2023
henüz km yaptım tl lik benzin kullandım bunun kilometresi uzun yol gerisi kısa mesafeortalama gösteriyor tüketim ekrandabu arada kablo bağlayınca oluşan android auto özelliğini beğendim aracın kendi navigasyonu kullanışlı arayüzü apple car play olarak geçiyor özellik,02.09.2023
araç geriye meyilliyse yokuş kalkış tutuyordur arabayı,09.09.2023
tamamen normal olan bir durummuş çözüldü,09.09.2023
dacia marka model araçların ankara koltuk döşemelerini rahatlıkla bulabileceğiniz aracınızın uzerine tam uyumlu döseme eser oto koltuk kılıfları sincan aracıma yaptırdım dacia duster orjinal eser oto koltuk kılıf döşeme,09.09.2023
resime gitmek tıklayın resime gitmek tıklayın,29.07.2023
dacia fiyat listesi güncellenmektedir yazısı var sitedebakalım kadar binidirim gelecek,29.07.2023
resime gitmek tıklayın resime gitmek tıklayın,29.07.2023
bim şok migros suçlu onlar olmasa memleket güllük gülistanlık olacak,29.07.2023
hocam dacia akıllı olsun yoksa haddini bildiririzağrı zabıtaya söyleyelim baskın yapsınlar savcı sayan göreve,29.07.2023
varrr üstelik yerli milli resime gitmek tıklayın,29.07.2023
resime gitmek tıklayın,05.08.2023
ay sonra milyon liralık egealar dusterlar gezecek ortalıkta vah vah,05.08.2023
mis ecog resime gitmek tıklayın,02.09.2023
resime gitmek tıklayın,09.09.2023
resime gitmek tıklayın,09.09.2023
dacıa sandero stepway aracımız var uzun kısa sis halojen ampul bunları beyaz yapmak istiyoruz kaç h takcağımızı bilmiyorum takan varmı yada bilen cevaplayabilir mi teşekkürler birde photon markasından almayı düşünüyoruzbir ekleme yapacağım farların üzerindeki etikette h değerleri yazıyor hangisi uzun hangisi kısa resime gitmek tıklayın,09.09.2023
dacia sandero stepway prestige otomatik vites arabamda kumanda aracın yanından biraz ayrılınca kapıyı otomatik kilitliyor yanına gelince açıyordu arabayı yıkarken kumanda cebimdeydi ondan mıdır bilmem kumanda kapıyı otomatik kilitlemiyor pillerini değiştirdim hala çözülmedi yardımcı olur musunuz,09.09.2023
alıcısı illa olur,26.08.2023
koltukları duz katlanmıyor dıye sacma paketlerle algıya baslamıs bunlarda anlasılan,26.08.2023
ön koltuklar eğilmeseymiş sürerken diğer uyuyabilirmiş,26.08.2023
mezar paket,19.08.2023
hayalimde araç,19.08.2023
güzel düşünülmüş avrupada euro burada tl tutacak kimse bi yatak kadar para vermez zaten arka koltukları katlayınca içerisi salon oluyor çarşaf yorgan atıp yatabiliyorsun,19.08.2023
on numara,19.08.2023
deprem sonrası arabada yatmak uygun,19.08.2023
arabada paket,19.08.2023
valla harika olmuş,19.08.2023
depremler kira artışları sonrası birebir çözüm,19.08.2023
euroya avrupada bir sürü araba var bence pahalı,19.08.2023
bekar adam ideal,19.08.2023
toros a paket eklesen olur kalabalık aileler uygun olabilir,19.08.2023
paketi paraya kusra bakmayın kimse ekletmezkeresteciye git koltukları yatırtölçüyü alsın kessinzımparalasınbuna benzerini taksınurfa şark köşecidende üstüne süngeri kestir oldu bitti kağıthadi,19.08.2023
sağ ön koltuk seyyar tuvalet olsaydı on numaraydı,19.08.2023
kendi aracımda var buna camping box diyorlar aracınızı karavana çevirme imkanı sunuyor,19.08.2023
baya mini karavan olmuş süper bence,19.08.2023
son olaylardan sonra tutar büyük ihtimalle,19.08.2023
aynısını bir marangoza mdf den kestirip yaptirilabilirüstünü süngerciden sünger kestir kaplat olsun bitsin,26.08.2023
aşırı pahalıaraç üstü çadır taktırılır p praya kalanı extra kamp ürünleri alınır,26.08.2023
merhaba herkese duster araç aldık yeni multimedya ekrana güncelleme yapılmış direksiyon ses açıp kapama tuşların birisi çalışmıyor kullanım klavuzunda basılı tutarak tuş atamasından bahsediliyor denedim halledemedik konu hakkında bilgisi olan varsa lütfen yardım,26.08.2023
manisa ordu aş firmasindan uzak durun arkadaşlar renault dacia satis servis yetkili bayi bana motoru sanzimani ellenmiş arabayı sıfır sattilar mahkeme devam efiyor bilirkisiler lehime rapor verdi ayrıca once bakima goturdüğumde aracimın bujilerini degistirmemisler yolda kakinca anladım aman uzak durun manisa dacia renault bayi ordu aş,26.08.2023
uretim kalitesi romanya aynı olur avrupa standartlarında uretilir hindsitan falan olsaydı bizim üretim kaliteli onlardan,26.08.2023
hayırlı olsun,26.08.2023
hayatinda bırak avrupayı türkiyenin avrupa yakasına ayak basmamış insanlar dacia avrupada satıyor iyidir algısı yaratmaya çalışıyor ancak yok boyle birsey dacia avrupadaki ucuz araba turkiyedeki renoya yakın fiyatlara degil fiyata satılıyoravrupanin çoğu şehri bin nüfuslu bir anadolu ilçesi kadar bırak arabayı bisiklet önemli ulaşım aracıdacia sehirdisinda zaten birsey ifade etmiyor sehiricinde gidecek bir yer olmadı icin bisiklet bile yetiyortaksi işi sıkıntı çoğu sehir küçük olduğu icin gelişmiş bir taksi sistemi yok über çağırsanız sırf dakika aracın gelmesini bekleyebilirsinizyani arabaya ihtiyacım yok ucuz arabayı alayım köşede durur lazım olursa kullanırım mantıgi alınan bir aracbu aracı alıp bir türk ailesi şehirden şehre gezen uzun mesafeler kateden insan sayısı avrupada azdir zaten aracın yapısı uzun süre kullanıma müsait degilo yüzden yüksek miktarda satması cinli arabalar dışında doğal bir rakibi olmadığı icin hiçbir anlam ifade etmiyor,26.08.2023
normal işçi emekçileri unutma,26.08.2023
evet avrupa ülkeleri genelde böyle coğrafya küçük zaten ülkenin bir ucundan bir ucuna saatte gidiyorsun iki şehir arası saat anca sürer duster algı oldu kalitesiz ilk versiyonları öyle sonrasında üretilen dusterlerin artık asgari düzey kalite algısı olması lazım halledecekler bilmiyorum arabayı alan kişiye kalitesiz araba almışsın denmemesi gerekiyor öyle bir kalite artışı olması lazım arabada,26.08.2023
üretilecek araçlar tr olacak olsaydı haklı olabilirdin ihraca gider merak etme bundan dolayı öyle türk usulü iş yapamazsın,26.08.2023
oyak renault yeni clionun kopyası olarak karşımıza çıkacak mitsubishi coltun üretimini bursada yapacağını duyurmuştu emre özpeynircinin haberine göre şirketten büyük bir sürpriz geldi üçüncü nesil dacia dusterın bursada üretileceği açıklandıhatırlanacak olursa şirket megane sedan üretimi karsan anlaşmıştı buradan doğan kapasite boşluğu yeni mitsubishi colt dacia dusterın gelişiyle fazlasıyla dolacak yılında avrupada yollarda olması beklenen yeni duster yapılacak yatırımla birlikte mevcuttaki bin adetlik kapasitenin bin adede çıkacağı iddia ediliyorayrıca bkztogg mobil deneyim merkezleri şimdi samsun antalyadaözpeynircinin haberine göre söz konusu kapasitenin yaklaşık bin adedinin duster bin adedinin renault clio ikizi mitsubishi colt modellerinden oluşması bekleniyor açıklanan yatırımla birlikte oyak renault aynı anda üç farklı marka üretim yapan bir şirket haline gelecekdacia duster yıldır avrupada satılan suv model olarak karşımıza çıkıyor ülkemizde satılan suv modeller arasında yer alıyor son dönemde egea cross duster arasında kıyasıya rekabet söz konusu egea crossun yerli avantajının ortadan kalkmasıyla rekabet kızışacak görünüyorkonuyla ilgili oyak renault tarafından henüz bir açıklama yapılmadı resmi açıklamanın yakında yapılması bekleniyorkaynak,26.08.2023
bursanin göreceği niteliksiz yatırım,26.08.2023
bursada üretilecek araç bulabileceğinizi sanmayın yüzde ihracata gidecek,26.08.2023
yatırım nedir senin gözünde,26.08.2023
hindistanda sokaktaki vatandaş lokantanın önunden gecerken içerdeki turisti görür durup yutkunur onun yediği yemeğe parası yetmez burası hale geldi çadırdan çıkamamış bedevi millet ahlak olmadan çalmadan zenginleşilmedini yuzlerce yıldır çözemedi,26.08.2023
yatırımın niteliklisi niteliksizi olmaz yatırım yatırımdır i̇yidir bölgenin katma değerini arttırır,26.08.2023
zannediyor musun burda üretilecek duster avrupadaki kadar kaliteli güvenli olacak alım gücü düştüğü kalitesiz bomboş araba üretip piyasaya sürecekler sen senin bilinçsiz tüketiciler bayılacak gereksiz araca,26.08.2023
arabayla zaten alakası yok alım gücünün bunu dünyada örneği var histindan latin amerika bölgelerine giden oralarda üretilen araçlar euro ncap testine tabi oluyor avrupada satılan aynı model araçlardan düşük puan alıyor düşün bakalım oluyor şirketler tüketici olarak değer vermiyor ondan maliyetten düşüyorlar merak etme,26.08.2023
aracın dandik algısından kurtulması lazım makyaj değil kasa değişimi şart,26.08.2023
türkiyede işçiliğin romanyadakinden iyi olduğunu düşünüyorum bence duster işçilikte kalite artışı olur,26.08.2023
ben ülkemiz işçiliğinin iyi seviyede olduğunu düşünüyorum mesela tofaş fabrikası altın fabrika öyle bir ödül sahibi duster ülkemizde kuvvetle muhtemel yeni kasası üretilir şimdiden hayırlı olsun,26.08.2023
latin ülkeleri hindistan vesaire oralar avrupa birliği direktiflerine tabi değil kendi standartları normları vartürkiye avrupa standartlarına tabi pek konuda istesen düşük standartlarda araç ithal edemezsin satamazsın motorların düşük hacimli olması harici avrupada satılıyorsa burada satılıyor girip bahsettiğiniz ülkelerde markaların websitelerine bakarsanız otomobillerin tamamen farklı olduğunu görürsünüz bizde böyle bir durum yok otomobiller avrupa standartlarında,26.08.2023
yeni coltu mitsubishi kökenli düz vitesle hothatch olmasa bir warmhatch olarak beklemek fantazi olur,26.08.2023
abi iyi güzel dacia spring yok,26.08.2023
duster kamuflajla dolaşmaya çoktan başladı bileön kapı kolları olması gerektiği arka kapı kolları clio gizli kapıların cam çerçeveleri rüzgar sesini azaltacak şekilde düzeltilmiş diğer araçlarda olduğu mevcutlar üste kadar gidiyordu resimdeki duster bigster bunun kadar uzunu olacak koltuklu olacağı versiyonlar arka aks elektrikli düşünülüyor euro normlarını karşılamak içintürkiyede üretilmesi iyi haber mevcut dusterdan ucuza satılacak demektirduster gerçekten başarılı olacak üretimin türkiyede olması kalite artışı sağlayacaktırmesela türkiye toyota japonya toyatayla yarışıyor kalitede defalarca japonyadan iyi seçildi resime gitmek tıklayın resime gitmek tıklayın resime gitmek tıklayın,26.08.2023
bin,19.08.2023
dacia macera outdoor ruhunu iyi yansıtttığı belirtilen extreme donanım seviyesini yakında türkiyedeki duster jogger modelleriyle buluşturmaya hazırlanıyor dacia duster versiyonda joggerın extreme versiyonları haziran ayından itibaren türkiyede kullanıcılarla buluşacakdış tasarımdacia duster joggerın extreme versiyonlarında genel olarak kozmetik dokunuşlar öne çıkıyor sedir yeşili gövde rengi parlak siyah köpekbalığı anten tavan raylarında bakır harflerle yazılan model ismi yan ayna kapaklarında jantlarda bakır kahve dokunuşlar bagajda bakır kahve dacia logosu bahsi geçen detaylar arasındaayrıca bkzdacia jogger uyku paketi duyuruldu haziran itibarıyla türkiyede sunulacakbunların dışında dacia joggerın extreme versiyonunda ön kapılar üzerinde topoğrafik tasarıma sahip şeritler topoğrafik tasarıma sahip kapı eşikleri ön kapılar çamurluk arasında dusterın imzası niteliğindeki şnorkele gönderme yapan detaylar görmekteyiz dusterda topoğrafik tasarıma kaplamalara sahip b sütunları bakır kahve şnorkel dikkat çekiyor ayrıca parlak siyah alaşım jantlar dusterda inç joggerda inç özellikler arasındai̇ç tasarımextreme donanım seviyesine sahip dacia duster joggerın iç mekânında gri renkli yeni bir döşeme türü olan microcloud bulunuyor kadifeyi andıran görünüme sahip döşemenin aşınma yıpranmaya karşı dirençli olduğu kolay temizlenebildiği ifade ediliyorbunun dışında ön koltuklarda kabartmalı dacia link amblemi topoğrafik tasarıma sahip paspaslar yer yer bakır kahve süslemeler dikkat çekiyor son olarak dacia duster özelinde vites kolu çerçevesindeki bakır kahve dekor kaplama vites kolu körüğündeki bakır kahve dikişler extreme donanım seviyesinde karşımıza çıkan detaylar arasında yer alıyorstandart artırılmış yol tutuş kontrolükozmetik dokunuşlara ek olarak dacia joggerın extreme versiyonu artırılmış yol tutuş kontrolü özelliğini standart olarak içeriyor orta konsoldaki bir düğmeyle etkinleştirilen özellik elektronik denge kontrolü esc ayarlarını düzenleyerek tekerleklerin serbest dönmesini gevşekzorlu zeminlerde iyi tutunmasını sağlıyor,19.08.2023
kağıt parçalanan araba değilmi,19.08.2023
diğer firmaların birçok modelinin artık manuel seçeneği yok joggerın otomatik seçeneği yok buradan anlayabilirsiniz farkı,19.08.2023
araba çıkarıyorlar dlcmi belli değil,19.08.2023
rengi bakır detaylar ayrı bir hava katmış keşke ön ızgara logo tavan rayları alüminyum kaplamalı kısımlarda aynalardaki mat bakır renginde olsaydı görsle bütünlük sağlardıbu versiyonla beraber tce edc kombinasyonu gelmeli artık,19.08.2023
türkiyede ekonomi kotu diyebler tarafindan milyonluk mercedes s classlar rekor sayıda satılıyor ben almanyada yasiyorum burada goremedim araclar turkiye yollarinda gordugum eski araba model turkiyede valla nankorluk bir yere kadar allah devletimize güç kuvvet versin la i̇lahe i̇llallah muhammed rasulullah,19.08.2023
arabaya lut paketi gelmiş,19.08.2023
elektrikli araç hala erken olduğunu düşünenlerdenim şarj süresi menzilin artması gerekiyorspring menzille zoe yarışır ancatogg milyon altı olmaz diyorum an önce bi piyasaya çıksın millet kullansın servis giderleri kronik problemler görülsün araç dış tasarım iç tasarımı güzel yüzden hedeflerim arasında duruyor,05.08.2023
bin tl kdv ötv ucuz elektrikli araç olacak sanırım,05.08.2023
vay be renault europalarda dizel beygir motor vardıbak litre dizel kara dizel kamyonet ses çıkartırdı beygirşimdi litre motorlardan neredeyse beygir alıyorlar,05.08.2023
dacia geçen sene aracı getirmeyerek büyük hata yaptı artık getirsede kimse almaz,05.08.2023
common rail teknolojisinden once oyleydi dizel motorlarin silindir hacminin buyuk olmasi gerekiyordu yuzden binek araclarda nadiren gorulurlerdi motorin sadece ticari buyuk araclarda kullanildigi icin dusuk fiyattan verilirdi common rail kucuk hacimli guclu dizel motorlar mumkun oldu,05.08.2023
evet atomize etmesinden birde hava yakit karisim orani cok hassas grami gramina mikro kontrolcuyle denetleniyor verimlilik ciddi sekilde artiyor,05.08.2023
cr enjektörler gücün pek ilgisi yokdüşük hacimli yüksek güçlü araçların üretilmesini sağlayan büyük yenilik değişken geometrili turbolar turbo boşluğunun azaltılması oldukarşılaştırma olmasi açısından vw motoru üretilmiş iyi dizellerden iken tdi motor üretilmiş kötü dizellerden,05.08.2023
ice araçlarda benzin deposu verilirken earaçlarda batarya kapasitesi verilmiyor wltp şehir menzili dediği kmyi bölün evw max pack menzil deniliyor gerçekte ancak görüyordu,05.08.2023
tamamen hava sıcaklığı klimaısıtıcı kullanımıhız etkenlere bağlı derecelerde menzil illaki düşecektir yüksek hızda illaki düşecektirama aracın felsefesi şehir içinde kullanım avrupada ülkelerde teşvikle satılıyor hatta euroluk fiyat ekstra euro indiriliyor bizde şuan gelmiş olsa ötvden dolayı maksikum seviyelerinde olurduçok iyi fiyat iyi şehir aracı,05.08.2023
beygir extreme olmamış dacia yaptın sen kontrol edeceğiz aracı,05.08.2023
ben mevcut araçlarımızı özellikle ab segmentelektiriğe çevirmeyi isterdim sökelim içten yanmalıyı döşeyelim pilleri pound resime gitmek tıklayın,05.08.2023
geç kaldı spring,05.08.2023
