review,date
ben yan dodikleri sevmiyorum bir tampon etekleri bana sorun çıkartabilir genel olarak bozuk yolda dolasacağım alt yere sürtmesin benim an istediğim tabandaki halı kaplamaların üzerine ekstra kauçuk tipi kaplama yapmak koltuklara kılıf kapı içlerine arka tampona krom parça sis farı krom parça kapı kollarının iç kısmına boyayı korumak film ekran koruma filmi araç içi kamera seti,23.09.2023
teşekkür ederim hocam hepimiz kazasız bineriz inşallah benim araçta arkadaş km uzun yol yaptı onun ortalaması yoksa genel ortalama tam bilmiyorum gösteriyordu,23.09.2023
hayırlı olsun öncelikle bagaj havuzu ihtiyacınız olacak aksesuar paketlerini değerlendirin derim ben müsait bir vakit bulursam şahsen kendi aracım tabana para desenli muşambadan cırt cırtlı döşeme yaptıracağım halı tozlanacak,30.09.2023
model uyumlu koltuk kılıfı önerisi bekliyorum arkadaşlar yüksek rakamlara çıkmak istemiyorum tl arasında bir tercih yapmak istiyorum,30.09.2023
arkadaşlar sıfır aldım aracı titanyum plus araçta yedek lastik yok yedek lastiği geçtim yedek lastik taşıma aparatı yok yedek lastik taşıma aparatı takılması baya işçilik gerekiyor kesme biçme vb montajı yedek lastik alıp bagajda taşıyacağız mecburen üzdü durum beni,16.09.2023
hayırlı olsun hocam ticari mi yoksa hususi tuhsatlı aldınız,16.09.2023
sağolun ruhsatta kullanım amacı kısmında yük nakli̇hususi̇ yazıyor koltuk sayısı yazıyor,16.09.2023
journey yazanlar hususi ruhsata sahip olanlar ancak araçların olayı ticari sayılıp ötv uygulanması sayesinde ucuza satılması otomobil ruhsatlı modeller sıfır fıyatında neredeyse arada ilan sahipleri yanlışlıkla journey kategorisine kamyonet ruhsatlı ilan açıyorlar onlara dikkat etmek lazım ruhsat fotoğrafı isteyin,16.09.2023
evet doğru ecoboost titanium plus tdci titanium plus kategorisindekiler ticaridir diğer paketlerde aynı şekilde,23.09.2023
yeni courier fransada satışa açılmış ford fransanın sitesinden inceleyebilirsiniz kablosuz car play kör nokta asistanı direksiyon ısıtma katlanır ayna hayalet ekran yeni özellikler var artık sürüş destek sistemleri mevcut acil fren şerit takip arka camlar açılıyor hp ileri otomatik active dolu paket opsiyonlarla bin euroya kadar çıkıyor fiyat yeni kasayı aşırı beğendim iç dış çağ atlamış resime gitmek tıklayın resime gitmek tıklayın resime gitmek tıklayın resime gitmek tıklayın resime gitmek tıklayın resime gitmek tıklayın,02.10.2023
review,date
journey olunca otomabil ruhsatlı oluyor ancak hiçbir mantığı yok pahalı bütün avantajı kayboluyor aile kullanımı olacaksa titanium plus almanızı öneririm turbo benzinli modelini kullanıyorum yardımcı olabilirim benzinli düşünüyorsanız,02.09.2023
teşekkür ederim motorun performansı motorlu otomobil ruhsatlı araç yok galiba ben bulamadım otomobil ruhsatlı olmasını radar olayından dolayı düşünüyorum,02.09.2023
artık bayiler otomobil ruhsatıyla satmıyor biliyorum performans konusunda memnunum multijet fiorinodan araca geçtim fiorinoya göre atik motor canlı hissettiriyor araçlar kamyonet ruhsatlı ancak arka sırada koltuk bulunduğu panelvan olarak geçer hız sınırı normal otomobillerden sadece km hata payıyla birlikte yollarda levhalarda yazıyorsa aracın hız sınırı oluyor,02.09.2023
ay kovaladıktan sonra alabildim süreçte bayinin kapısında yattık desem yeridir ancak takas desteği olsun istediğimiz renk olsun yardımcı oldular bizim aldığımız bayi takasa araç veren müşterilere öncelik verildiğini belirtti aynı zamanda full aksesuar paketini aldık herhangi bir dayatma olmadı kendimiz isteyerek satın aldık,02.09.2023
takas yoluyla modelde ben aldım hafta sonra teslim edileceğini söylediler titanium plus benzin versiyonu aldık tek kötü yanı bayinin tl ye zorla kaput koruma cam filmi satması oldu arabama iyi fiyat verdikleri kabul ettim,02.09.2023
aracı gün önce teslim aldım yaşanan gecikme özür dileyip hediyede verdiler modeli gerçekten güzel olmuş titanyum plus modeli boğazına kadar dolu yapmışlar dijital klimadan koltuk ısıtmasına kadar herşeyi var tavsiye ediyorum,02.09.2023
temmuz başı teslim tdci titanium plus aracımız gelecek geldiğinde editlerim şuan fiyatı tam net değil,09.09.2023
arkadaşlar araç model titanium araçta hız sabitleyici var varsa kullanılır,16.09.2023
hocam hangi ay girmiştiniz,16.09.2023
online alınmıyor biliyorum ekran görüntüsü ekleyeyim gösterdiğiniz zaman bayilerde yardımcı olurlar montajını yapıyorlar resime gitmek tıklayın,23.09.2023
vites olarak üretildi aynı yıl viteste çıktı muhtemelen yüzden karıştırıyor olabilirsin bende vardı ön konsolda telefon tutucu yerleştirilmişti direkt olarak multimedya sistemi vardı,29.07.2023
benim araçta kışın kısa mesafede fan açıyor bir iki sorduğumda egzozda biriken pisliği yakmak çalışıyor vs şeklinde bir açıklama yapmışlardı ben genelde şehir içi kısa mesafe biniyorum böyle olunca egzozda biriken atık yapıyordur aklıma yatti gerçek nedir bilemedim,05.08.2023
önce model trend ardından model trend eskittikten sonra son olarak model journey trend teslim aldım sorularınız olursa cevaplarım bir önceki araç son daydı ara sıra fan açıyordu boş vitese yokuş aşağı salınca devir yükselip binlere çıkıyordu yenisinde böyle şeyler yok adblue var bagajda soketi var stepne yok tamir takımı var,19.08.2023
merhaba journey demek farkı var diğer journey olmayan corier den otomobil ruhsatlı olanı almayı düşünüyorum trend titanyum arasında özellik farkı var mıdır,02.09.2023
lsdbull muridi keşlere bak erkansyk denen lsd müptelası ferrariye iftira atmış keştrolliçe,30.09.2023
son sezonlardaki seyir zevkini düşüren dominasyonlardan sonra motor üreticisinin altıya çıkması rekabet açısından sevindirici bir gelişme özellikle ford köklü bir markanın dönmesi eski günlerdeki ford vs ferrari savaşını izlemek mükemmel olacak kendi motorunu üretemeyen takımlar hondadan güçlü bir motor tedarik edebilirler,12.08.2023
ortaklık yalan oldu porschenin takım alarak yoksa sıfırdan bir takım kurarak gireceği hala muamma,12.08.2023
hileredbull redbull içeriğinde lsd olmasa müptelası olmazdınız,12.08.2023
anlatıyorsun dayı,12.08.2023
sen ağlıyorsun redbull şampiyon oldu resmen hile şampiyon oluyor,12.08.2023
mercedes ferrarinin ford motoruna ihtiyacı yok an sahnede red bull olduğuna göre motora ihtiyaçları olduğuna göre ford fırsatı kaçırmamış,12.08.2023
karbon ayak izi politikası tür organizasyonları etkilemiyor lafa gelince büyükbaş hayvan çiftliklerini bile kapatmak isterler,12.08.2023
cayır cayır cayirdayan motor istiyorum ben sesi bile güzel,12.08.2023
ford le mansa geri dönsede tozu dumana katsa fordu le mansta görmek istiyorum,12.08.2023
emisyon standartları normal araçlara uygulanandan sıkı uymuyorsa yarışa katılamazlar,12.08.2023
le mansa ford geri dönerse yine güzel bir rekabet izleriz,12.08.2023
massi ye neler verildiyse dunyanin gozu onunde adına artik hango gate denecekse yapilacak olan yapildi abu dhabi sirf dominasyon kirilsin,12.08.2023
hile sahtekarlık dedin mi redbull bunun üstadıdır lsd katkılı olmasa kadar fanatik savunan olmazdı,12.08.2023
bence fazla i̇ngilterede mercedes verdiyse onu vermişlerdir olsa adamın fiyatı belli,12.08.2023
selamlar dizel powershift ps şanzimanda sorun yaşıyorum i̇stanbul yada yakın çevresinde önerebileceğiniz sağlam bir servis varmidir büyük ihtimalle kavrama kaynaklı,05.08.2023
hocam ankara i̇stanbulda atco şanzıman var biraz araştırdığım kadarıyla adamlar iddialı internetten bakıp telefonla yağ değişimi fiyat alın isterseniz,12.08.2023
aynı aracın modeli bende var haftadan uzun yattığıda oldu aracın çalışmamazlık yapmadı akünün değerlerine bir bakın araca uygun akümü,16.09.2023
e tabiki hocam tam kış lastiği performansı vermez i̇stanbulda kış söktür taktır eziyeti fazla maliyetli ayrıca kış lastiğinin iyisini almak lazım adı sanı duyulmamış kış lastiğine güvenemem i̇yi marka yaz iyi marka kış varsa iyisi olur tabi bolu vs yolda yaptım şoföre araca göre değişir elbet dört mevsimde iyi değil yazdığım lastik testler sonucu iyi lazım markanın islakta buz kış lastiği performansı beklemiyorum önceki kışlıklar petlas tı memnun değildim eski aracımda petlas vardı onlar iyiydi değişiyor sonuç olarak ben beğendim fp,30.09.2023
aracı ev satmak istiyorum piyasa durumda an bilgisi olan var takip ettiğim evlerin bir tanesi bile satılamadı aydır araçlarda aynı durum var,16.09.2023
ortalaması,16.09.2023
ustam parçacıdan getirtmiş,23.09.2023
,23.09.2023
dizel otomatik viteste görüyorsunuz ben lt nin altına düşemedim bir türlü ortalamada,23.09.2023
ortalama ben genelde arasında oluyor,23.09.2023
benim ortalamam an kullandığınız yol aracın bakımları aracı kullanma süreniz etkiler gün içi kısa süreli motor açılmadan kullanıyorsanız yollar yokuş viraj vs ortalamanız iyi zaten kalıptaki çoğu dizel araç litre arası yakar dediğim gün içi uzun süreli kullanım oluyorsa yol güzelse litre fazla yakıyor trafik kısa süreli kullanım yol kötü ortalamanız normal hatta bir tık iyi bile,23.09.2023
uzun yol hemde şehir içi var içinde ortalamayı biraz düşük bekliyorum açıkcası düşüremedim bir türlü bakımı yeni yapıldı filitreler yağ vs yeni değişti gerçi kullanımlada alakalı olabilir full bagaj klima full açık uzun yol ortalama hızla hızı biraz düşünce ortalamam geriliyebilir,23.09.2023
ben yazan havayı bastım şimdiye kadar iyi geldi bana konfor anlamında,30.09.2023
ben basınç olarak basıyorum,30.09.2023
neredeyse e denk geliyor bende normale döndürmeliyim halde yada e,30.09.2023
zaten kapıdaki etikette değerler yazıyor hocam kullanıyorum ben,30.09.2023
arası yapıyorum ben benimki,30.09.2023
marka model olarak kullanıyorsunuz arkadaşlar lastiktebenim aracın üzerinde continental olarak geldi,30.09.2023
titaniumda yazlık good year eagle xl kışlık good year ultra grip ebat,30.09.2023
kışlıkta good year ultra grip üstüne lastik tanımam önceki aracımda sürekli modeli kullandım muhteşem bir kar hatta buz performansı vardıkışlıkta yine modeli almaya çalışıcam,30.09.2023
le yola devam lastikleri getirdim,30.09.2023
hankook kinergy dört mevsim tavsiye ederim michelin latitude tour hp nin yaz performansından beğendim ayrıca araba yüklü değilken lastikler araba yüklü kalabalık iken önler arkalar benim iyisi zaten etiket değeri öyle,30.09.2023
sayfa uzun süredir sessiz kalmış,05.08.2023
zaman bir soru sorayım resime gitmek tıklayın kuga dizel otomatik bin bakımı şimdi fiyat alıyorum ancak yetkili servis fiyatları inanılmaz artmış şanzıman yağı bakımı rutin bakım bin tl indirimli yaş indirimi haliyle fiyat veriyorlar garantisi bitti aracın özel servisler bosch tarzı yerler fiyat veriyor kimisi binde şanzıman yağı değişmiş bin km sonra bin bakımında değiş diyende var sadece bakım yeter diyorlar bin bosch euro master tarzı yerlerde sizler yaptınız fikir alayım yetkiliye devam etmek lazım garanti bitmesine rağmen şanzıman yağı konusu doğru,19.08.2023
selamlaryetkili servislerin fiyatlarının yüksek olduğu kar marjlarının oldukça fazla oldugu bir gerçek ancak mümkün olduğunca yetkili servisten çıkartmamak lazım sonuçta fordun yetkili servisi olursa olsun garantisi bile bitmiş olsa yetkili servisin kontrolünde gitmenin size uzun vadede manada kazandıracağını düşünüyorum azından ben öyle yapıyorumdizel powershiftlerde şanzıman yağı km katlarında değişmesi gerekiyor durumda sizin şimdi değiştirmeniz gerekiyor bir sonraki değişim kmde,19.08.2023
merhaba tarihte kuga arıyordum fakat başka araca yöneldimgaranti bittiyse sadece ford kurumsal eurorepar vs yerleri tercih edinşanzıman yağı mutlaka değişmeliherkese aldanmayın bilimsel bi gerçek var sonuçta,19.08.2023
cevap teşekkürler yetkili servis konusu doğru nedenle yetkiliye gitmek istiyorum fiyatlar şişti artık garantisi bitmiş araçta şanzıman yağı değişip bir sorun olursa arkasında duracaklar ben ford hariç diğer markalarda garantisi bile varken söylediğim sorunların düzeltildiğini görmedim aşırı baskı yapacaksın dava vs uğraşacaksın hemen anında sorunu düzelten varsa bana denk gelmedi genelde geçiştiriliyor bende kaldı garantisi biten araçta kadar arkasında dururlar emin olamıyorum yoksa kesinlikle yetkili servis derim bende hatta rutin sıradan bakımları bile isterse yaşlı olsun yine yetkililiye giderim cevaplar teşekkürler yalnız son durum şanzıman yağı değişecek mecburen olsa yetkiliye gideceğim sanırım teşekkürler,19.08.2023
düşüncem şöyle sonuçta arabanız alındığından beri yetkili servis dışında işlem görmediyse fordun gözünde hala orjnal bir araçtır yağını zamanında değiştirirsiniz ileride olur bir sıkıntı oluştu sonuçta araç dışarıda işlem görmüş yapabilirizin önüne geçmiş olursunuz diğer türlü garantisi bitmiş durumda dahi hala bizim orjinal aracımız arkasında duralım durumu oluşacaktır ha burası türkiye işler farklı ilerleyebiliyor olursa olsun olası bir kötü duruma karşı arabanızı yetkili servise götürerek koz sizin elinizde olur özellikle motor şanzıman aracın hayati kritik iki parçasının yetkili serviste yetkili kişilerin elinden geçmesi sizi aracınızı kullanırken güvende hissettirecektir düşünüyorum,19.08.2023
ford kuga ecoblue sık yapılan hata motor yağı kullanımıdır lt kullanılıyor bilginiz olsun,02.09.2023
forum ilgisiz kalmış kimse gelip gitmiyor,16.09.2023
yan basamak yakışıyor araca hocam titanyum paket bende tavan citası vardı zaten,16.09.2023
serviste yapıyorum ben uygun olan servisi bulup yaptırmak kolay tek tek parça alıp yaptıranlar var balata vb şeyleri kendim alıp dışarda yaptırıyorum,16.09.2023
bakımını yaptırdım yıllardır tanıdığım güvendiğim ustama ford servis tl çektibosch özel servis çektibenim ustam tl ye halletti orjinal filitreler esp yağ kullandı mazot filitresi sonraki bakımda değişecek,23.09.2023
malzemeleri kendiniz mi aldınız,23.09.2023
model escort aldım araç benzinden çalışırken devir saati duruyor araç rolentesi aşırı yüksek gaz geçtiğinde iniyor gazdaki sıkıntımda su araç km üzeri hızda bir anda gaz kesiyor sapıtıyor stop ediyor yardımlarınızı bekliyorum teşekkürler,16.09.2023
tercih meselesi vw peugeot gayet sıradan boş araçlar artık tasarımları rezalet ilk ay harika görünse yılın sonunda yıllık araç tasarımı geliyor göze hele peugeot oldukça vasat tasarım konusunda logitech direksiyonuyla,30.09.2023
aynen arabalar yıllık görünüyor resime gitmek tıklayın resime gitmek tıklayın i̇ç tasarımlarına senin övdüğün ford nesil sonra ulaşır karman çorman diyebilirsin göz yoruyor diyebilirsin göze eski görünüyor demek komikşu konsollara bakınca fark ortaya çıkıyor hangisi yıllık araç resime gitmek tıklayın resime gitmek tıklayın,30.09.2023
gösterdiğin fordun içi derli toplu düzgün kaldı arıza oranlarına girmiyorum fransız araçlarının bana tasarımını anlatma boşuna,30.09.2023
onu diyorum ben derli toplu diyebilirsin ikisi arasında demode eski görünen focus konuları karıştırmamak lazım,30.09.2023
logitech direksiyon hizasız ekran direksiyon üzeri aptalca gösterge paneli yenilik değildir,30.09.2023
ford transit custom nugget kamp araçlarında uzman olan westfalia iş birliğiyle geliştirilen bölgeli kabin düzenine sahip aracın içerisinde dört kişinin rahatça uyuması kamp yapması gerekli olanaklar mevcut arkadaki l şekilli mutfak çekmece tip buzdolabı lavabo özelliklere dahil ford ayrıca yeni kamp aracının selefine kıyasla iyi sürüş dinamiklerine sahip olduğunun altını çiziyornugget dışarıdan bakıldığında neredeyse sıradan bir transit custom görünüyor tavandaki açılabilir mekanizma yandaki westfalia markalı tente nuggetı dışarıdan fark edilir kılan büyük detaylardan yeni nuggetın tavanı kolay bir kullanım kendi kendine katlanabiliyor ek ücret karşılığında tavana güneş paneli entegre edilebiliyori̇ç mekan üstteki açılabilir tavanın etkisiyle iki tane çift kişilik yatağa yetecek alana sahip önde sürücü yolcu döndürülebilen kaptan koltuklar mevcut arkadaki koltuklar opsiyonel olarak ısıtma usbc girişleri hoparlörler tercih edilebiliyor aracın arkasında standart özellik olarak sıcaksoğuk duş mekanizması var ancak bagaj kapağına entegre edilen duş çadırı ektra ücret ödemek gerekiyorford transit custom nugget sistemiyle çalışan kablosuz android auto apple carplay desteğine sahip inç multimedya ekranıyla donatılmış bunun dışında arka tarafta ısıtma su seviyesi aydınlatma kontrollerin yapıldığı inçlik küçük bir ekran mevcut ford yeni kamp aracında kablosuz şarj standart modem özelliklerine yer vermişayrıca bkzmakyajlı peugeot türkiyede i̇şte fiyatı özellikleribağımsız arka süspansiyona sahip olan dört tekerlekten çekiş özelliğiyle tercih edilebilen transit custom nugget ilk şarj edilebilir hibrit seçeneğiyle satılıyor kugadan alınan sistem toplamda hp güç üreten litre benzinli motor bir elektrik motorunun kombinasyonundan oluşuyor kwsa kullanılabilir kapasiteye sahip olan batarya kamp aracının kmye kadar saf elektrikli sürüş modunda ilerleyebilmesini sağlıyorford transit custom nugget ilk olarak beygirlik dizel motorla satışa sunulacak yukarıda özelliklerini sıraladığımız hibrit motor sonra listeye eklenecek aracın almanyadaki fiyatı eurodan başlıyor,30.09.2023
ülkemiz boş beleş bir haber,30.09.2023
depremden sonra araçların hayat kurtarıcı olduğunu beraber deneyimledik maalesef,30.09.2023
tente kapalıyken kulağının üstünde sigara gezen ustalara benzemiş gizleyememişler mi onu,30.09.2023
ford araba işini artık beceremiyor ticaride gerçekten numara işler çıkartıyor transit custom yeni courier f max güçlü bir tablo çiziyor bence,30.09.2023
yaa kıyamam cok tatlıııııı öghhhh,30.09.2023
milyondan assa gelmez paraya al bı tane arsa koy prefabrik depremde işe yarar,30.09.2023
fiyatı avrupa bile yüksek hymer marka motokaravanlar var fiyata mercedes araç üzerine kurulu full karavan banyomutfak su deposuyatak oturma grubu vsr li,30.09.2023
çoğu karavanda tente öyle dışarda durur hocam pek gizlemezler pek tabii gizlense güzel olur pek rast gelmedim,30.09.2023
i̇nsan kurulmuş yatak fotoğrafı koyar galeriye,30.09.2023
araba ege akdeniz turu yapmak vardı,30.09.2023
akaryakıt fiyatlarından sonra motor almak sanmıyorum,30.09.2023
anlamadım hocam fiesta yıl focus başında üretimi duracak modeller rakipleri golf öte noktadalar suv çinliler farklı noktaya oynuyor,30.09.2023
kulvarda vw california varken rekabet iddalı olmasını beklerdim bana biraz zayıf geldi özellikleri,30.09.2023
bizi bağlamıyor pek,30.09.2023
araba takla atarsa olacak peki onu merak ettim ben arabanın tavanı gövde tümleşik değil gördüğüm kadarıyla takla anında kopup giderse içerideki yolculara olur acep,30.09.2023
merhaba söylediğiniz husus önemli güzel bir nokta tarz açılır tavanlarda yatay iskeletimsi parçaları kestikten sonra dikdörtgen tavanın şeklinde bir sert iskelet takıyolar benim düşünceme göre tarz ford vw fabrika üretimi tavanlar güvenilirdir gerekli testleri yapilmaktadır piyasada yurtdisinda hazır lisanslı kitler satılıyor cesitli turkiyede firmalar üretiliyor onlar nasıldır bilemem tam bilgim olmasa cam tavanlı araçların tavaninda yatay destekler yok yüzden olmayacak bir sey degil bence,30.09.2023
gölcükte suriyeliler epey karavan toplamış durumda merkezden tepelere doğru çıktın ara sokaklar karavan dolu,30.09.2023
bilgi alamadım ihtiyacı olan arkadaşlar yaptırdığım yer tamsan,23.09.2023
aracım ford fiesta otm titanyum aracımda soğukken sis farı açtığımda fanın devreye girip girip kapandığını fark ettim ha bunu fark etmeden led takım aldım sis kısa uzun siste yapıyor sadece akü ölçtür dediler gittim ölçtüler iyi sonra durumu anlattım sisi yak dedi yaktım fan devreye girmedi akşam motor diş soğuduğunda tekrar denedim kere açıp kapattı hemen i̇lginç bir durum biliyorum önceki sislerde yapıyormuydu bilmiyorum cidden canım sıkıldı akıl verecek birisi varmı,23.09.2023
hız sabitleyici opsiyonel donanım olarak satılmış olabilir,23.09.2023
sadece efsanenin adı kullanmışlar,16.09.2023
fransada yaklasik senedir satiliyor modèle gore bin euro arasi degisiyor hic fiyati degismedigi bugunde kdr gordum yoldaama adim basic sehir mahallede tesla kayniyor cok ucuza cok populer bunun satma sansi cok cok aa,16.09.2023
emekli daciasina donmus,16.09.2023
böyle dacia varsa can kurban,16.09.2023
çoook pahalı olmuş ford iyi hoş benana,16.09.2023
kafayla yakında direksiyonda dokunmatik olursa şaşırmayacağım şaka değil,16.09.2023
aracın genel olarak iç dışı görüntüsü iyi görünüyor fiyatı hala kabul edilebilecek seviyede değil satmak amacında değildirler aracı konumlandırdıkları seviye yakın bana göre araca parayı verene kadar alternatiflere rahatlıkla gidilebilirşu modeli sene sonra getirmeleri bir garabet asıl olay fiyat etiketinde çinli üreticiler havalı araçlara gidecek olan tüketiciyi rahatlıkla çelebilecek kadar iyi araçları ucuza üretiyorlar ford türkiye besbelli olsa satar havasıyla azından ilk dönem fiyatı dayamaya odaklanmışlar çinliler girsinler görürüm ben satış adetlerinidetaylı incelemelerine bakmak lazım,16.09.2023
yolu var,16.09.2023
mustangın ilk tasırımcısı bunu görse düşünürdü,16.09.2023
resime gitmek tıklayın nesil gerçek mustang varken bence elektrikli olan tasarımı olmamış,16.09.2023
mustang yerine başka bir isim koysalarmış yerinde olurmuş,16.09.2023
sahibinden den beri mevcut araç nesi yeniymiş anlamadım,16.09.2023
arabayı geçen gün trafikte görmüştümsadece arka stoplar mustanggeri kalanı mustang alakası yok resime gitmek tıklayın,16.09.2023
yıl sonra üstelik fiyatla zahmet edip getirmişler anlamadım,16.09.2023
sıfır olsa satılıyor ondan,16.09.2023
öyle bir piyasa yok artık bitti sayılır,16.09.2023
modern hemen arabayı beğeniyorum çoğu kişinin sövdüğü araçlar bile bana güzel geliyor araba tam bir ucube,16.09.2023
kötü bir araç değil uygun ülkemizde satılan bir dünya alternatif araç var mesela aklıma ilk gelen kia araçlara yönelirim,16.09.2023
araba karizma duruyor,16.09.2023
tesla benzinli suv parası gerek var tek araca,16.09.2023
tasarımı olarak tesladan iyi duruyor tesla yerine tercih edilebilecek bir araç bana göre,16.09.2023
güzel,16.09.2023
bayiilerde sıfır araç bulunmuyor hala,16.09.2023
sıfır araç konusunda liste fiyatının altında bile bulanları görebilirsiniz modeller yok sadece polo golf dün jeepalfa romeo bayisindeydim renk renk araç vardı içerde saat durdum arayan oldu gelip bakan müşteri psa yine ay içerisinde hemen hemen araçlar var renaultta araba var honda istemediğin kadar var yakında toyotada araç rahatlıkla bulunabilecek,16.09.2023
allah rızası klima kontrollerini analog elle basmalı çevirmeli akımı çıksın klima ayarı yapacağım derken kamyonun altına gireceğiz seveyim sizin dokanmatik fetişinizi,16.09.2023
sevinsem mi üzülsem mi bilemedim hocam,16.09.2023
fiyatlara ulaşamadıktan sonra araç bulunabilmesinin pek manası yok bence eller düşüyor senaryoda sadece al sat devri bitti,16.09.2023
özelliğini fiyatını geçtim tipteki bir araca mustang isminin verilmesi tam bir facia bence mustangin önüne atı koyanlar mezarında ters dönmüştür kesin,16.09.2023
mustang değil doğmadan aldırın bunu,16.09.2023
üzücü üzdühayal kırıklığı açıdan,16.09.2023
