review,date
ford performance tamamen elektrikli mustang super cobra jet tanıttı yeni elektrikli mustang fordun kısa mesafeli motor sporları çalışmalarının devamı niteliğinde tek bir amaç geliyor var olan rekoru geliştirmekkendi rekorunu geliştirecekönceki model cobra jet çeyrek millik yaklaşık metre drag yarışını sadece saniyede tamamlamış kendisinden önceki rekoru büyük oranda geliştirmişti mustang super cobra jet cobra jet agresif bir revizyonu olarak nitelendiriliyor fordun açıkladıklarına göre super cobra jet şasi aktarma organları kontrol sistemlerinde yapılan çeşitli yükseltmelerle hafif güçlü bir hale sokulmuşford performance motorsports küresel direktörü mark rushbrook yaptığı açıklamada zaman motor sporları dünyasının köşesinde kendimizi zorlamaya çalışıyoruz drag yarışı ürünlerimizi teknolojimizi sergilemek önemli bir alan olmaya devam ediyor yalnızca çeyrek milde kendi rekorumuzu kırmaya çalışmaktan değil aynı zamanda elektrikli araç manzarasında yapmaya devam ettiğimiz süregelen gelişmeyi sergilemekten heyecan duyuyoruz ifadelerini kullandıayrıca bkztesla avrupada fiyatları düşürdü türkiyedeki model y ucuzlayabilirsuper cobra jet önce olduğu iki çift istiflenmiş motor çiftine bağlı aynı dört invertörünü kullanıyor ancak yapılan optimizasyonlar ağırlık azaltımları araca beygirlik bir güç eklenerek beygirlik bir canavar elde edilmiş super cobra jet çeyrek millik dünya rekorunu kırmaya çalışmanın yanı sıra kms hızdaki hızlı elektrikli araç rekorunu kırmaya talipkaynak,26.08.2023
meraklısına ila arası indirim olurken bizde sürekli artıyor fiyatlar,26.08.2023
türkçeyi ağlatmak buna denir şasi aktarma organları kontrol sistemlerinde yapılan çeşitli yükseltmelerle hafif güçlü bir hale sokulmuş,26.08.2023
tesla model s satış rakamları yakalayıp ismini iyice duyurunca ford ceosu elektrikli gelip geçici bir heves elektrikli araçların yaygınca kullanılmasına yıl var bir laf etmişti güzel yalatıyorlar insanlara sözlerini,26.08.2023
bataryasının tek draglık canı vardır zaten şov arabaları bunlar,26.08.2023
çocukken bugattinin beygirlik yapılmış ilk arabasının videolarını izlerdim youtubetan videolardan vay be,26.08.2023
zaten yeni transporter ortak platform olarak üretilecek vw kendi motorunu şanzımanı donanımlarını vs koyup transporter satacak,29.07.2023
katılıyorum söylemeden geçemeyeceğim aracın tasarımı kadar güzel olmuş yahu dışiç yakışıklı ticari araçlardan olabilir ford ticari araçlarına önem veriyor gerçekten,29.07.2023
merhaba ford focus tdci trend hatchback kapı model benzinli model aracım var araç türkiyede yok sahibindende bile bakıyorum araç yok gözüküyor dizelleri mevcut benzin modeli yok,26.08.2023
araç yarı otomatik,26.08.2023
ruhsattan,26.08.2023
seçeneğindede yok araç yarı otomatik benzin hatchback trend,26.08.2023
sizce bin bütçe alınır kadjar dizel otomatik icon ford kuga titanyum dizel otomatik opel dizel,19.08.2023
merhaba bende model ford focus kasa var ondada aydır tekleme sorunları yaşıyorum gittiği yerde motoru silkeliyo gaz yemiyooateşleme bobini değiştir dediler kablolarını değiştir dediler değiştirdim sorun hala devam ediyor bunun kesin sonucu nedir biliyorsanız söyler misiniz teşekkür ederimm,19.08.2023
öncelikle yapmanız gereken bujilere baktırmak yada buji değiştirmektir ateşleme sisteöi set olarak bobin bobin kablosu buji şeklinde dğişir,19.08.2023
insan eli bilinçli fayi patlatma oluyor kısacaböyle bir imkansız faylarin patlayacagini senedir herkes bağırıyor aziz yetkililerimiz dikkate almıyor bkz naci görür bkz seramar projesi bilimle kavga eden adam sictim demez sictigi zaman kendine haarpci arar,19.08.2023
lü yıllarda büyük deprem olmuş padişah bile çadırda kalmış sarayın avlusunda vefat sayısı fazla olur aşırı nüfus öncesi evler çürük,19.08.2023
öncesi çürük demek sonrası sağlam demek değil,19.08.2023
i̇stiklal cd boyunca evler çürük durumda i̇stanbulu ispatulayla kazıyıp yeniden inşa etmek gerekiyor sizin mantıga göre,19.08.2023
valla ben demiyorum bin rakamını naci görür ahmet ercan dediler öleçek olan,19.08.2023
istanbulda fay hattı varpatlarsa risk misk dinlemez fabrika kalır orada çalışacak işçi yatirimlar anadoluya kaydırılmalı i̇stanbulun nüfusu acilen yarıya indirecek politikalar uygulanmalı,19.08.2023
binlerce yıldır deprem olmayan i̇stanbulun altında patlama ancak yeraltına yerleştirilecek bomba mümkün olabilir doğal olamaz iş ağusto depreminin doğal olmadığına dair gözlemler vardı konu yönden araştırılmalı tuzun kimyasal türevi olan lityumun metal olarak tanıtıldıgı atmosferden çekileren üretilen milyarlarca kw elektriğin termik santralde üretiliyor gösterildiği dünyada herşey olabilir,19.08.2023
abicim bırakın saçma sapan haarp tatavasini yaistanbulda devamlı deprem oldudeprem tarihini açın okuyun fay hattı şiddetinde deprem ürettiği zaman isterse deprem merkez üssü uzakta olsun i̇stanbul merkezde taş üstünde taş kalmaz,19.08.2023
yaklaşık yıl önce kayda değer büyük deprem olmuş eski olduğu büyüklüğü biliniyor düzgün kayıp sayısıuzun yıllar deprem olmaması korkutucu bir arada ufak ufak kırılmalarla stres almalarla deprem iyi uzun süredir kırılmayan marmara fayının kısımının birden kırılması söz konusu benim tahminim büyüklüğünde deprem olur i̇stanbulda yapıların yarısından fazlası yıkılır milyon kişi ölür,19.08.2023
yıl önce zaman oldugu büyüklüğü bilinmeyen bir deprem üzerine teori üretmek bilim degil kaldı iddia edilen depremin gerçekte oldugunu kesin ispatlayacak bir belge yok ortada i̇stanbul yıl önce roma imparatorluğu döneminde şehirleşmiş büyük depremler geçirmiş olsa şehir başka yere kaydırılırdı öyle olmamış sizi korkutmuşlar korku halindeki sağlıklı düşünemez,19.08.2023
fayin yüklendiğini bilim adamları söylüyor marasi söylediler kimse inanmadı noldu gördük sanayinin nüfusun anadoluya yayılması şart deprem sebeplerden sadece birisi,19.08.2023
maraş depremi şaibeli dünya tarihinde görülmüş biçimde üstüste deprem olması insan parmağı olabileceğini akla getiriyor hal böyle olunca evet i̇stanbulda deprem olabilir,19.08.2023
evet haarp attulaaaate allah im,19.08.2023
üstüste deprem dünya tarihinde görülmemiş doğal olmadığını oradan anlayamadı iseniz anlayamayacaksınız,19.08.2023
fayin ayni anda kırıldığı depremler var bunlardan i̇stanbul oldu ağır saçmalıyorsun,19.08.2023
dünya tarihinde örnekleri var dediğim gibituz konusu ayrı haarp zirvalamak ayrı,19.08.2023
batarya paketi üretmek tesis kurdu tahmin ediyorum,12.08.2023
türkiye nin yatırımlara ihtiyacı büyük ankara tarafının seçilmesi güzel bir seçim bence,19.08.2023
froto den lot alıp den satmıştım yükseldi son gördüğü di,19.08.2023
zaten ancak ortak yapar yaparsa koç grubu sadece ülkemiz kazanmasın yabancılarda kazansın koç grubuda sevilsin dışarda yıllardır hazır alıp satıyordu herşeyi zahmet edip ortaklık yapmaya karar vermiş ağalaralıp satsaydiniz imalat uğraşıyorsunuz diyecek şarkı bilmiyorum sesim çıkmıyor gerçi kadarını zekii olan insan grubu anlamıştır düşünüyorum saygılar sunarım,19.08.2023
i̇stanbul dışında başka yerlere yönelmeleri iyi olmuş,19.08.2023
akpliler çıldırmıştır muhalif koç reizin aksine istanbul a değil depremden uzak ankara yapmaya karar vermiş mansur yavaş a vergi geliri demek ayrıca,19.08.2023
i̇stanbulun deprem risksiz bilimsel olmayan kasdi olarak i̇stanbulu riskli gösteren medyadaki fotoşop haritalara aldanmayın deprem konusuna tarım asır ömür harcamış ahmet ercanın bilimsel metodlarla çıkardığı türkiye deprem risk haritasına bakın resime gitmek tıklayın batarya fabrikasının ankaraya kurulmasının sebebi bence tuzgölüne yakın olması lityum dünyanın büyük tuz yataklarından çıkarılıyor arjantindeki ragozina tuz gölü resime gitmek tıklayın,19.08.2023
i̇ş imkanı olur azından,19.08.2023
gebze den silivri ye sahil boyu birinci derecede deprem den etkilenecek kısım harita yeşil göstermesi risksiz demek mi,19.08.2023
kursa nolcak asgarı ucret bellı iç savas var,19.08.2023
alırsın ford olursun koç,19.08.2023
yeşil renk bölgeler depremin merkez üssü olmadığını sadece enerjisi azalmış risk içermeyen sarsıntı yaşayabileceğini gösterir sarı renk bölgeler enerjisi azalmış ancak olsa risk içerebilecek sarsıntı yaşayabileceğini beyaz bölgeler hiçbir sarsıntı yaşanmayacak risk içerdiğini gösterir,19.08.2023
hayırlı olsun güzel haber üretimin ülke geneline yayılması gerekiyor son depremlerden sonra bunun önemini iyice anlamış olduk,19.08.2023
yanlış yazdınız sanırım deprem riskli yerler valla ali ağaoğlu doğru diyor sanırım istanbulda ölen şanslı bin ölen olacak doğru,19.08.2023
şekilde devam etsin milyon ölen olur net bir şekilde öncesi binalar tamamen yıkılıp yeniden yapılmalı temel yok bakımsız su içinde rutubetten beton direk çürümüş temelin metre üstünden aşağısı beton demir çürümüş kesilmiş,19.08.2023
bende onu dedim zaten denizden karada km yukarı sahil taraf tamamen birinci derece etki altında gebze den silivri ye,19.08.2023
aydıntepe giriş kst aldım bakarken kiracı vardı demek iyi bakamadım kiracı çıkınca gördüm adamlar mt kare murc yapıp direk dikmiş direk yumruk un ufak olup dökülüyordu içindeki demir balya teli ip olmuş çürümüş ev ararken baktığım bina var fukaraliktan eski bina giriş bodrum vs baktığım diyorum altı yapılmış binalar kontrol e bile gerek yok kesi̇nli̇kle yıkılıp yeniden yapılmalı,19.08.2023
yıla değil niteliğe bakılır i̇skenderun sahil şeridi boyunca binaların coğu öncesi zengin işi yapılar nerdeyse hiçbirinde sıva çatlağı bile yok arka mahalleler gecekondu onların önemli kısmı yıkılmış arada ilde yıkılan binaların sonrası,19.08.2023
aspilsan a rakip olacaklar,12.08.2023
vatana millete hayırlı olsun,12.08.2023
koskaca başkent uluskızılay merkezini görün içler acısı ankara sadece saray dan ibaret değil kentsel dönüşüm fikirleri sadece i̇stabulu kapsıyor vallahi ankara yı başkent olmaktan çıkardıklar sanayi fabrikaçarşı hiçbirşey yok ölü kent haline geldi,12.08.2023
koç sanıyorum batarya fabrikasını toog hazırlıyor nasılsa yeni alınan araba yıl gider sonrada bataryalar su koyvermeye başlar bunun fabrikada sonunda talepleri karşılamaya hazır hale gelir,12.08.2023
başarı olsun tebrikler,12.08.2023
yüz ölçüm olarak konya büyük alan olarak düz atıl olarak kalan tarım yapılmayan arazilerde fabrika iyi yapılabilirdi konya tükiyenin neradeyse tam ortasında bir yer sayılır şehire lokasyon olarak uzak nede yakın,12.08.2023
fabrika sincan osbde kurulacaktı dersek peki,12.08.2023
ankarada be koç telaş yapma deriz,12.08.2023
başlık altında konu yanlış bir şekilde tartışılıyorniye şura değil bura orası olsa iyi olurdu falan farklı ulustan firmanın beraber yaptığı kaç milyon dolarlık yatırımı bizim dayı oğlunun ankarada yeri var ucuza kapatırız diyip yapmıyorlar herhaldefizibilite çalışması yapıp uygun yeri belirlemişler ülkemizin herhangi bir yerine son yılda yapılan faydalı işlerden birini yapmaya karar vermişler inşallah tamamına erer,12.08.2023
ankaradaki hangi osb ye kurulacak,12.08.2023
ankara batarya fabrikasını mecburen kurdular cunku tuzgölüne yakın büyük şehir lityum tuzdan üretiliyor resime gitmek tıklayın,12.08.2023
yaklaştın lithiumion pillerin yerine geçecek sodiumion piller yapılmaya başlandı soda tuz hammaddelerden olacaksa ankaraya fabrika kurmak mantıklı herhalde düşünmüşlerdir sodiumion bataryalar geliştiriliyor,12.08.2023
kardeşim görende ankarada sanayii yok sanacak keşke konya kayseri şehirlere yapılsaydı ankara sanayi konusunda arşa çıktı be yüzde i devlet destekli sanayi olduğu ankarada sanayi yokmuş yazmış herkes ankara merkezli büyük firmalarla çalışıyor abimin firması bence anadolunun küçük şehirlerine yapilmaliydi,12.08.2023
birleşik,12.08.2023
lityum dünyanın hafif metali olarak yutturulan enerjisığa özellikli tuzdur tekniğe girmeden sadece lityum fotograflarına bakarsanız tuz görüntüsündedir akü suyu enerji tutma özeliğine bakarsanız tuzdur ufak nem görünce elektrik tutmasının bozularak yanması özelliğiyle tuzdur son derece reaktif odugu kwh batarya içinde tane metal kapsüle mekanik zorlanma olmaması onlar metal kasalara konulur batarya yüzden ağırdır,12.08.2023
toggun pili bursaya kurdu çinliler fabrikayı kendi arabalarına anca yeter hatta yetmez bileşu ortamda bile yatırım yapana ekstra helal olsun,12.08.2023
ford koç holding lg energy solution geçtiğimiz gün ortak bir girişim kurmak mutabakat metni imzaladı yapılan anlaşma ankara yakınlarında avrupanın büyük ticari batarya üretim tesisini içeriyor kurulacak yeni batarya fabrikasının fordun elektrikli otomobil dönüşümüne büyük katkı sağlaması hedefleniyorfabrikanın temeli yıl atılacakford koç holding lg energy solution tarafından kurulacak dev batarya fabrikası ankaranın organize sanayi bölgesinde yer alacak bununla birlikte fabrikanın temelinin yıl içerisinde atılması bekleniyor fabrika tamamlandığında potansiyel olarak gwhye kadar çıkabilen gwh yıllık üretim kapasitesi sağlayacak kapasite onu avrupanın büyük batarya üretim tesisi yapıyor arada üretimin yılında başlaması bekleniyor fabrika üretime başladıktan yaklaşık üç yıl sonra üretim kapasitesi kadar artırılarak gwh seciyesine çıkartılacakayrıca bkzyeni honda zrv ehev çinde satışa sunuldu i̇şte tasarımı özellikleriford ankarada kurulacak olan batarya fabrikasını şirketin elektrikli otomobilleri avrupadaki gelecek planları kritik öneme sahip olduğunu ifade ediyor ford ayrıca koç holding köklü bir geçmişleri olduğunu yılı aşkın bir süre önce kurulan başarılı ford otosan ortak girişimi güçlü bir ilişkiye sahip olduklarını belirtiyorlg energy solutionın ceosu youngsoo kwon anlaşma kapsamında şimdi türkiyede ford koç güçlerimizi birleştirerek avrupadaki elektrikli otomobil geçişini hızlandırmak lider pil teknolojimizi devreye sokacağız böylece sürdürülebilir bir gelecek küresel girişimlere öncülük edeceğiz ifadelerini kullandıkoç holding yaptığı açıklamada yatırımın küresel rekabet konusunda türkiye avantaj sağlayacağını söyledi şubatta meydana gelen korkunç deprem felaketinin acısını derinden hissediyoruz koç topluluğu olarak imkanlarımızı ülkemiz seferber ettik olağanüstü zorlu dönemin aşılmasında büyük yatırımların önemli rol oynayacağına inanıyoruz doğrultuda otomotiv sektöründe ülkemize önemli bir küresel rekabet avantajı kazandıracak yatırım tesisini iki küresel şirketle hayata geçirme kararlılığımızın altını çiziyoruz milletimize başsağlığı diliyor zor günleri birlik beraberlikle aşacağımıza yürekten inanıyoruzkaynak,12.08.2023
sonunda marmara bölgesi nde olmayan bir büyük sanayi projesi,12.08.2023
hayret bursa istanbul kocaeli üçgenin değil,12.08.2023
umarım kurulur,12.08.2023
sanayiyi istanbuldan kaydirmak lazim kisa zamanda yoksa istanbul depreminde cok zor duruma duser ulke,12.08.2023
önümüzdeki yıl içinde ankara konya karaman mersin yeni üretim bölgesi olacak,12.08.2023
seçimden sonra bol bol böyle haberler duyacağız inşallah,12.08.2023
marmara yeterince kirlenmisken oraya kurulsun ankaraya kuruluyor zaten yeterince pis hava,12.08.2023
i̇stanbulun deprem risksiz bir tek güneybatısı deprem riskli oralar kıyı şeridi fabrika kurulmaz resime gitmek tıklayın,12.08.2023
ford türkiye pazarını uzun bir süre domine edecek,12.08.2023
deprem sonrası günlerde twitterda bir gönderide gördüm heryerde dolaşan deprem haritalarından değişik olduğu kaydettim,12.08.2023
ankara eleman bulmak iyi bilkentodtü hacettepe vs i̇stanbul bölgesiyle yarışabilir i̇stanbulbursa kocaeli üçgeninden kolay alan bulunabilecek bir yer ayrıca görece ucuz riskin düşük fırsatların olduğu marmara kadar olmasa elbette yatırım kalkınmamış bölgeye yapılsa iyi olabilirdi yine son derece olumlu bir gelişme,12.08.2023
heh şöyle diyesim geliyor diyemiyorum çinden kaçan yada kaçmakta olan yatırımları olursa olsun çekmek lazım çekmeyi başarmışlar memleketin coğrafi olarak avantajını kullanmak lazım ilgili bakanlıkların bilimum diğer üreticileri anadoluda fabrika açmaları teşviklerle şartları elverişli hale getirmek çalışması lazımkoç elektrikli araçlarla ilgili sene önce gerekli adımı atmıştı zaten yatırım yapacak üstüne fordun elektriklisinin üretim bantlarını kaptı şimdi yanına bir taşla kuşluk batarya yatırımını yapıyor helal olsun diyorum,12.08.2023
sincan temelli i̇vedik osbde tip mega fabrikalara destek atacak bir yan sanayi oluşumu hali hazırda var anadolu marmara demiryolu otoyol bağlantısı ankarayı diğer anadolu sanayi şehirlerine göre avantajlı kılıyor bir osblerdeki arsa fiyatları önemli tabi temelli osb hala uygun konuda teşvikle alıyorlar para veriyorlar diyen çıkmasın valla pis söverim,12.08.2023
haber seçimi kimin kazanacağını gösteriyor,12.08.2023
volkswagen ford işbirliği büyüyecek volkswagenford yada fordvw birleşebilir,12.08.2023
ticari araçlarda amarokranger transportertransit custom caddyconnect birlikte hareket ediyorlar ford vwnin meb platformunu kullanarak i̇spanyada kuga boyutlarında bir crossover üretecek lakin fiat peugeot arasında olduğu ford vag arasında bir birleşmeye tekelleşme endişesi nedeniyle yetkili kurumlar izin vermeyecektir,12.08.2023
abdli otomotiv şirketi ford aracın geri alınmasına ilişkin sistem yöntemler başlıklı bir patent aldı belgede bir otomobil kredisi birden fazla ödemede gecikme olması durumunda aracı kilitleme otomatik olarak hareket ettirme teknolojisi açıklanıyorayrıca bkzaraç satışında ay bin km şartına uymayanlara milyon lira ceza kesildisistem şirketin internet erişimi donatılmış gelecekteki araçlarından herhangi birine kurulabilir yeni teknoloji araca el koymadan önce araç sahibini uyaracak bunlar göz ardı edilirse banka hız sabitleyiciden klimaya kadar aşamalı olarak önem taşıyan işlevleri devre dışı bırakmaya başlayabilecek araç içinde hoş olmayan bir ses çalma özelliği olacağı iddia ediliyori̇cra dairesine gönderilebilecekbuna ek olarak teknoloji kapı mekanizmalarının bloke edilmesine izin vererek araç sahibinin araca binmesini engelleyebilecek araçta yarı otonom sürüş sistemi varsa banka aracı çekici icra dairesine çekmek uygun bir noktaya alabilecek seçeneğe sahip olacak örneğin araç sahibinin garajına giden yol tamamen insansız sürüş özelliklerine sahip olan araç kredi veren kurum tarafından belirlenen yere icra dairesine kendi kendine gidebilecekayrıca aracın kilometresi durumu el koyma ilgili maliyetlere dayalı olarak aracın piyasa değerine ilişkin bir değerlendirme yapılabilecek el koyma bankaya aracın satışından elde edilecek potansiyel faydadan pahalıya mal olacaksa araç bir geri dönüştürülmek üzere hurdalığa bile çekilebilecek diğer patentlerde olduğu fordun böyle bir sistemi gerçekten uygulamaya koyup koymayacağını zaman gösterecekkaynak,19.08.2023
malca bir inovasyon müşteri kaçtırılıra tez olarak okutulur üniversitelerde,19.08.2023
lastiğine sapladım bi yere gidemez d,19.08.2023
türkiyede tuningciler liraya fordu ayağına getirir ay sonra,19.08.2023
bunlar kullanıyor,19.08.2023
ford alacak müşteriyi düşündürtmek güzel kendi kendine patent trollüğü yapmış adamlar,19.08.2023
hackerlar bunu beğendi,19.08.2023
teknolojinin oku çıktı,19.08.2023
ford elektrikli araçlarını fiyat açısından erişilebilir kılmak pahalı materyallere olan bağımlılığını azaltmak yeni yollar arıyor kapsamda şirket avrupada satılan ford mustang mache modelinde lityum demir fosfat lfp batarya kullanmaya başlayacakaçıklamaya göre lfp bataryaya sahip mustang mache modelleri mevcut modellerle birlikte satılacak halihazırda satışta olan modellerde nikelkobaltmanganez ncm batarya kullanılıyor abdli üreticiye göre yeni bataryalar uzun ömür maliyet hızlı şarj süreleri avantajlara sahipayrıca bkztürkiyeye dönen cherynin yeni amiral gemisi chery tiggo belirttiğine göre lfp bataryalar ncm muadillerine göre dayanıklı üstelik ncm büyük oranda nikel kobalta bağlı olmadığı fiyat açısından avantajlı dolayısıyla adım şirketin nikel kobalt kritik materyallere olan bağımlılığını azaltması yönünden önemli bir role sahiplfp bataryalar önümüzdeki yıl ford lightning modelinde kullanılmaya başlanacak ardından şirketin yeni nesil binek ticari araçlarına hayat verecek ford sonra bataryaları michigan eyaletinde kuracağı milyar dolarlık batarya fabrikasında kendi bünyesinde üretmeye başlayacak söz konusu fabrikanın üretime başlaması planlanıyorford attığı adımlarla elektrikli araç üretimini artırmayı planlıyor şirket yılın sonuna kadar bin adet sonuna kadar milyon adet elektrikli araç üretmeyi hedefliyor,12.08.2023
sandınız ataçta paket fiyatı olmasınmı ufak bir parça yada özelliğini ekle yada çıkar al sana paket,12.08.2023
lion bataryaları üretmek zor değil mi,12.08.2023
ford toyota honda hyundai kianın gelişmiş ülkelerde satılan modelleri var keşke türkiyeye gelse dedirten,12.08.2023
benzin candır yalan dolan bunlar,12.08.2023
herkese merhabalar dizel otomatik bir aracım var ağır bakımda triger harici neler değişmesi gerekiyor yakın zamanda yaptıran oldu ortalama kadar tutuyor,12.08.2023
bir süredir fordun avrupadaki iş gücünü azaltacağı konuşuluyordu söylentiler abd merkezli şirket tarafından doğrulandı ford önümüzdeki üç yıl içerisinde çalışanını işten çıkaracağını duyurdui̇şten çıkarmaların sebebi elektrikli araçlara geçiş olarak açıklandı konuyla ilgili automotive newse açıklamada bulunan ford model e genel müdürü martin sanderelektrikli araçlarda mühendislik açısından yapılacak iş var dünya küresel platformun dolayısıyla mühendislik çalışmasının gerekli olduğu bir yöne evriliyor i̇şte yüzden ayarlamalar yapmak zorundayız dedi ayrıca bkzhyundainin yeni suv modeli ortaya çıktı hyundai mufasagelen bilgiye göre işten çıkarmaların büyük bölümü mühendislik pozisyonlarında yapılacak bunun yanı sıra yönetim pazarlama satış dağıtım departmanlarında küçülmeye gidilecek ülke bazında baktığımızda almanyada birleşik krallıkta diğer ülkelerdeki çalışan ille yollar ayrılacakford yıllara kadar avrupadaki elektrifikasyon sürecine hız verecek önce mondeoyu emekli eden otomotiv devi fiesta focusun üretimine son verecek kaynak,12.08.2023
takmıyorum açıkçası focus fiestaya yol verdi yerine puma ucubeyi getirdi,12.08.2023
ford uzun süredir kötü yönetiliyor bir marka düşünün bütün segmentlerde silinip gitsin son çıkardıkları modeller tasarım ergonomi vs bakımından özensiz alelade model çıkarmış olmak çıkarılmış modeller bir ford sever olarak ben bile araç bakarken aklıma ford markası gelmiyor artık,12.08.2023
bunlar eskı nesıl fabrıka satıyorlar,12.08.2023
bir zamanları gm den sonra dünyanın büyük motorlu araç firmasıydı nerden geldi ford,12.08.2023
çinliler baktı yeşil kağıtların bir değeri kalmadı onlar satılık mal bulsa alıyorlar,12.08.2023
satsın olacak,12.08.2023
ford otosan alsa güzel olabilir bence tabi parasal durumlara bakar,12.08.2023
tip yüz yılı devirmiş yada arifesinde onlarca usalman japon otomobil markaları var vizyonsuzdur mercedes dahildiryenilik işlerine gelmez devrim yapalım bir katkımız olsun dünya halkına vsdiyeyillarca içten yanmalı körüklü motorları şanzımanı yarı otomatikotomatik makyajı aynalı dijitale klimali evirip çevirip sattılarallah tanhızır yetiştide elon tesla yi aldida petrolun kemikleşmiş lobisini kırıp emotor lu bilgisayar aksanı olan hızlıkaliteli oemisyon araçlar bunlara iyi bir ders verdişimdi fordmazdabmw markalar depolardaki cvt şanzımanlari yakıt depolarını stoklarını ertitiz hesabindalar marka kucukuecekveya kepenk indirecek yılda,12.08.2023
ayda bütün avrupada satışları çakıldı fordun bilinçli olarak yaptılar rekabet etmeyi bırakıyorlar tamamı emisyon standartları olan uyuşmazlıkları maliyetler sebebiyle başka nedeni yok avrupa işi kademe kademe amerika üzerinden yönetilecek elektrikli araçların altyapılarını volkswagenden alacaklar hatta platformlu suv aracı hazırlamaya başladılar bilekısacası efsane kölnlü ford havlu attı minimum maliyetlerle avrupada araç satmaya çalışacaklar ileride modelleri vw ortak olması düşünülüyor amerikada iyiler kendi kıtalarında kendi bildikleri devam ederler,12.08.2023
almanyada üretim rekabetçi değil i̇şçilik maliyetleri yüksek,12.08.2023
avrupada rekabet edemeyeceklerini gördülerondan kaçıyorlar psa vag üstüne toyotabir çinlilerben olsam kaçarım,12.08.2023
nokianın benzeri bir akıbeti olacak fordun,12.08.2023
