review,date
ford performance gran turismonun sponsorluğundaki broadmoor pikes peak uluslararası tırmanma yarışının the broadmoor pikes peak international hill climb organizasyonuna tamamen yenilenen geliştirilen elektrikli supervan katılmaya hazırlanıyor tutkunlarının merakla beklediği yarışta araçların tırmanma performansını optimize eden çığır açıcı tasarımlar ileri teknolojiler benzersiz özellikler sergileniyorford performance stard i̇leri araştırma geliştirme uzmanları bir güç birliği yaparak amerikanın dağı anılan pikes peaki fethetmek elektrik gücünün uç sınırlarını sergilemek supervan özel olarak tasarlanmış bir versiyonu yarattı tasarımında levent tunanın imzası bulunan supervan revize edilen aerodinamiği tırmanma performansına odaklı özel şanzımanıyla efsanevi pikes peak uluslararası tırmanma yarışına heyecan katmaya hazır supervan direksiyonunda yıl sekizinci yarışa katılan motor sporlarının efsane pilotu romain dumas oturacakyüksek irtifa aerodinamiği tamamen yenilendipikes peakin yüksek irtifada hareket edebilmesi aerodinamiği tamamen yeniden tasarlanan supervan bastırma kuvveti downforce kmsaat hızda kilogramın üstüne çıkarıldı aerodinamiği iyileştiren temel unsurlar arasında yer alan karbon fiber hafif arka spoyler ön splitter aracın virajlı parkurda yolu kavramasına yardımcı oluyor virajlı dağ yollarında çevikliği sağlamak genel dengeyi iyileştirmek amacıyla hafif bir şasi paketi kullanıldı kargo alanı ford sync copilot koltuğu kaldırılarak şasideki ağırlık azaltıldısupervan güç aktarma organlarında iyileştirmeler yapıldı stard uhp fazlı motor sayısının dörtten üçe düşürülmesi stardın ultra yüksek performanslı lipolimer nmc kese tipi hücrelerin kullanılması sayesinde araçta optimum güçağırlık oranı elde edilirken önde bir arkada iki motora güç sağlayan dört tekerlekten çekiş sistemi korundu supervan toplam kwın hp üzerindeki motor gücüyle potansiyelini açığa çıkarırken optimum enerji kullanımı bataryanın yeni kw rejeneratif performansından yararlanıyorayrıca bkzford teslanın cybertruck aracını eleştirdi silikon vadisi insanları içinşasiyi detaylı olarak elden geçiren ford performance stard ekipleri supervan karbon seramik diskli frenlerle revize edilmiş bir fren sistemi pirelli p zero yarış lastikleri magnezyum jantlar yükseltilmiş tahrik milleriyle donattı ayrıca dağda iyi zamanını elde edebilmesi zorunlu olmayan türlü ağırlık unsurunu azaltmak amacıyla pleksi ön cam kullandı minimal bir iç mekân yarattıpikes peak uluslararası tırmanma yarışı haziran pazar günü gerçekleşecek yarış hakkında detaylı bilgi adresini ziyaret edebilirsiniz,09.09.2023
tırmanma deniliyor ortada dağ tepe görünmüyor,09.09.2023
ford yeni nesil elektrikli binek araçlarını üretecek olan yüksek teknolojili üretim tesisi köln elektrikli araç merkezini açtı şirket yenilikçi üretim merkezini oluşturmak yılında kurulan tarihi fabrikasını milyar dolarlık yatırım dönüştürdüyüksek verimlilik amacıyla tasarlanan yıllık fazla elektrikli araç üretme kapasitesine sahip hektar üzerine kurulu tesis yeni bir üretim hattı pil montaj hattı son teknoloji araçlar otomasyon sistemleri donatıldıford explorer kölnde üretilen ilk elektrikli araç olacakmustang mache etransit lightningin başarılarının ardından fordun kısa süre önce tanıttığı dördüncü elektrikli aracı explorer markanın kölnde üreteceği ilk elektrikli aracı olacak bunu elektrikli bir spor crossover izleyecekköln elektrikli araç merkezi fordun küresel çapta açtığı ilk karbon nötr üretim tesisi olarak şirketin yılına kadar avrupadaki tesis lojistik operasyonları doğrudan tedarikçi ayak izinde karbon nötr taahhüdünü destekleyecekayrıca bkzaudi cam geri dönüşümü projesini seri üretime aktarıyorköln elektrikli araç merkezinin açılması avrupada yeni nesil temiz üretim elektrikli araçların başlangıcı diyen ford executive chair bill ford tesis sektördeki verimli çevreye duyarlı tesislerden olacak çocuklarımıza torunlarımıza sıfır emisyonlu bir gelecek hazırlamak çalışmaktan heyecan duyuyorum eklediford avrupada yeni bir dönemköln elektrikli araç merkezinin hizmete girmesi yana avrupa otomotiv endüstrisinin kalbinde yer alan ford köln fabrikasının köklü tarihinde yeni bir dönem anlamına geliyor burada üretilen ikonik araçlar arasında ford model a taunus capri granada fiesta yer yılı aşkın sürede milyondan fazla otomobil üreten kölndeki fabrika fordun dünya çapındaki verimli tesislerinden olarak nesiller boyunca milyonlarca avrupalıya hareket özgürlüğü sağlamasıyla biliniyordaha i̇yiye giden yol planı gerçeğe dönüşüyorford karbon nötrlüğe ulaşmak yeni süreçler makineler teknolojilerin devreye alınmasıyla tesisteki enerji kullanımını emisyonları azaltıyor tesisi çalıştırmak gereken elektrik doğal gaz karbon nötr yüzde yenilenebilir enerji kaynaklarından sağlanıyorüretim tesisinin yarattığı emisyonlar yerel enerji tedarikçisi tarafından ford adına telafi edileceğinden tesisin ısıtılmasında süreçlerde kullanılacak ısı karbon nötr oluyor harici bir enerji santrali atık yakma tesisi tarafından üretilen ısı forda özel bir buhar şebekesi üzerinden iletiliyoryerel enerji sağlayıcısı ısı dağıtımı işletme emisyonlarını yılında yaklaşık yüzde oranında azaltmayı yılına kadar emisyonları tamamen ortadan kaldırmayı planlıyorford köln elektrikli araç merkezi tam olarak faaliyete geçtiğinde bağımsız olarak karbon nötr sertifikasına sahip olacak bağımsız sertifika düzenli olarak denetlenecek kalan emisyonlar yüksek kaliteli karbon dengeleme programları telafi edilecekford köln elektrikli araç merkezindeki teknolojik güncellemeye biyolojik çeşitliliğin mevcut fabrika yeşil alanının ekolojik dengesinin iyileştirilmesi eşlik ediyor alınan önlemler arasında yeni uzun ömürlü bitki örtüsünün yerleştirilmesi ekolojik açıdan zayıf çim alanların yabani çimlere dönüştürülmesi böcek yarasa kuş habitatları oluşturulması yer alıyor,09.09.2023
fidan ekerek nötrleme değildir umarım ortadoğu ülkeleri,09.09.2023
lityum tuzdan üretiliyor gerçek maliyeti cok düşük earaçta yangın cıkıp yandığında oluştuğu söylenen karbon atmosfer tarafından temizleniyor temizlenmeseydi anda atmosfer balçığa dönmüştü iklim değişikliğinin sebebi havada oldugu söylenen karbon değil insani faaliyetler değil doğanın normal bir süreci karbon ayak izi karbon nötr vs devletlerin geliştirdiği birer kavram amacı yeni sektörler oluşturmak muhtemelen yeni vergiler çıkarmak,09.09.2023
model sıfır km ranger wildtrak aldım ancak alidigim günden itibaren sorunlar peşimi bırakmıyor aracın yerinde bir problem var korna takılı kalıyor vites geçişleri kötü fren yaparken değişik sesler geliyor olduğunuz yerde vites atarken araç aşırı derece sallanıyor yetkili bayi servis aracın normal olduğunu emsal araç denediklerini aynı durumun araçta olduğunu söylüyor bizde emsal aracı görmek denemek istiyoruz ancak bir şekilde emsal araç gözükmüyor model ecoblue wildtrak araçlar arıyorum muğla çevresinde tercihen fethiye şuan aracım yargı sürecinde aracımin kusurlu olduğunu düşünüyorum başka kullanan kişilerden konuda destek bekliyorum bulunduğum çevrede olup aynı araca sahip olan kişilerle birebir görüşüp araçları kendi aracımı kıyaslamak istiyorum yargı sürecinde sonuç hızlı ortaya çıksın teşekkürler,09.09.2023
aracın boyu caddy tourneo connect rifter berlingo segmentinde değil fiorino segmentinde düşünebilirsiniz şuan dolu modeli bin tl şuan gelse muhtemelen full modeli civarı olurdu,02.09.2023
eskiden markanın kendine has görünümü olurdu şimdi git gide bütün markalar birbirine benziyor,02.09.2023
araçla ilgili gözden kaçan bir detay var elektrikli versiyonu düşük vergi diliminde kalacağı ruhsatta otomobil olarak geçecek muhtemelen benzinli b suv parasına satılacak bugün gelmiş olsa civarı tahmin ediyorum otomobil ruhsatlı olacağı hafif ticarilere uygulanan hız kuralları uygulanmayacak yüzden aracın elektriklisinin fazla talep göreceğini düşünüyorum,02.09.2023
led halojen far yapın kasa eski land roverlara benzemişforddan soğuttu,02.09.2023
vergi diliminde olacak deniyor,09.09.2023
merhaba arkadaşlar araç romanyadaki reanault dacia fabrikasında üretilecek kasa dokker sadece motor ford aynı sistemi fiat doblo peugeot rifter citroen berlingo toyota procity rekabet adına kalite geçen gün düşüyor,09.09.2023
sudan ucuz olur kesin,02.09.2023
baya güzel olmuş defender havası var,02.09.2023
resime gitmek tıklayın a sütunu fiat dobloyı birazda kia soul andırıyor biraz doblo dan biraz skoda yetiden esinlenme var geldi,02.09.2023
yeni doblo hayırlı olsun fort la alakası var,02.09.2023
yetiye aşık olduğum yıllar canlandı gözümde sütun yapısından yeti geri dönmüş sandım bir an sınıfta beklenmez arka süspansiyonu bağımsız yapsalarmış direk modern yeti olacakmış,02.09.2023
fiyatı uçurmak ticari defender yapmışlar,02.09.2023
bildiğim enişte arabası olmuş,02.09.2023
ha gayret ford seneye defender inşallah,02.09.2023
eski courierin kendine has havası vardı gitmiş rover doblo karışımı bir çıkmış tasarımı şahsen beğenmedim eski tasarımları özgündü,02.09.2023
binek müşterisi çeker epey haki yeşil renk beyaz tavan kombinasyonu şık duruyor,02.09.2023
hayret kimse yazmamış makyajlı doblo olmuş yeni nesil doblo olur sorsalar işte böyle olur diyebiliriz,02.09.2023
doblo landroverın aşkı olmuş,02.09.2023
land rover zannettim yeminle,02.09.2023
yeti doblo karışımı,02.09.2023
vw caddy olmuş üstünde satılıyor bunun fiyatıda ondan aşağı kalmaz,02.09.2023
enişteler doblodan artık buna geçer,02.09.2023
sinifin iyisii wolkswagen caddy dir bence oturaklii saglam güvenirlik sey var mukemmellik benim tercihim caddy,02.09.2023
bir an land rover sandım,02.09.2023
bari atmosferik motor getireydiler tüp takaydık,02.09.2023
dizeli yokmuymus,02.09.2023
batarya kapasitesi menzili resmi olarak açıklanmadı,02.09.2023
güncel kasada dizel motorlarda yağa mazot karıştırma sorunu var bence dizel defterini kapatabilirler,02.09.2023
duymuştum hocam rejenerasyon yaparken mazot yağın karıştığını koca firma heralde bir çözüm üretir diyordum gerçi alacağımdan değil ancak ülkemizde üretilen tercih edilen bir aracti bakalım tüketici turbo benzinli ticariye bakacak umarım yerli üretim iken satan i̇spanyaya kaydirilan üretimi esamesi bile okunmayan kornet olmaz sonu,02.09.2023
banada öyle geldi yeni defendere hafif hava basıp şirşirmiş,02.09.2023
enişte değilim araç güzel olmuş binek müşterisini bile çekebilir araçların binek görünümlü olanı kedi bile minibuse benziyor,02.09.2023
sene dizelini kullanmıştım güzel araçtı hala sattığıma pişmanım modeline benziyor bence,02.09.2023
yolcu tarafı insanı yoruyor araçlarda şöfor kısmı rahatı sorsan market aracı binek değil deniyor fabrika çıkışnda koltuklar var reklamları aynı,02.09.2023
doblo olmuş,02.09.2023
mükemmel görünüyor hususi binmek bile alınabilecek bir tasarım olmuş,02.09.2023
ford logosunu söküp landrover logosu taksak gram sırıtmaz dodikli çakma hb crosslarda cross duruyor,02.09.2023
güzel olmuş fiyat olarak uçarlar artık,02.09.2023
land rover kasasını anımsatıyor hoş kasa yapısı var,02.09.2023
elektrikli konsept araç çıkarmak nedir olduğu belli değil suv crosover ticari mi belli değil,02.09.2023
araç courierlikten çıkmıştourne olmuş boyutlarıylaelektrikli mantıklı olmaz sınıfta zaten ötvsi varelektriklinin olacak ha motor motor yetersi geldi kw,02.09.2023
ford flex esintileri var dizel artık gelmez bemce anki dizeller adblue birlikte geliyor dpf tıkanması ilgili soruna bir çözümdür,02.09.2023
ford rakibi tesla ford elektrikli otomobil ev sahiplerinin abd kanada genelinde fazla superchargera erişimini sağlayacak bir anlaşmaya vardı ancak anlaşma bir adaptör aracılığıyla teslanın supercharger cihazlarına erişim sağlamanın ötesine uzanıyorford yeni nesil elektrikli araçlarının itibaren teslanın kuzey amerika şarj standardı nacs adı verilen şarj portu donatılacağını söyledi fordun ikinci nesil elektrikli otomobil portföyünde elektrikli bir kamyon üç suv modeli bulunuyor sürpriz anlaşma geçtiğimiz saatler tesla twitter ceosu elon musk ford ceosu jim farley arasında yapılan bir twitter spaces yayını sırasında duyuruldutesla ford arasında önemli ortaklıkforda göre nacs bağlantı noktasına sahip ford ikinci nesil evler bir adaptör aracılığıyla ccs şarj cihazlarında şarj olma seçeneğine sahip olacak otomobil üreticisi adaptörün uygun fiyatlı olacağını söyledi farley fordun abonelik farklı ödeme seçenekleri sunacağını belirtti musk adaptörün yüz dolar aralığında olacağını belirttiayrıca bkztesla cybertruckın iç mekan tasarımı ortaya çıktı güneşlenmek idealmusk yaptığı açıklamada ford araçlarını tesla supercharger ağı desteklemekten ayrıca api erişimi sağlamaktan mutluyuz dedi musk açıklamasının devamında bir ford aracı bir ford uygulamasını kullanarak bir tesla süper şarj cihazında sorunsuz bir şekilde şarj olabilir esasen fikir tesla supercharger ağının duvarlarla çevrili bir bahçe olmasını istemiyoruz bunun genel olarak elektrifikasyonu sürdürülebilir ulaşımı destekleyen bir olmasını istiyoruz ifadelerini kullandıtüm tesla araçlarındaki şarj konektörü ac şarj mwa kadar dc şarj imkanı sunuyor kompakt tasarımı performansı kuzey amerikadaki çoğu elektrikli araç tarafından kullanılan kombine şarj sistemi ccs konektörlerinden üstün kabul ediliyor tesla geçen yıl teknolojiyi diğerlerinin benimsemesi paylaştıbu arada mevcut ford ev müşterileri kombine şarj sistemi bağlantı noktasına sahip ford lightning mustang mache etransit araçlarının teslanın superchargerlarına erişebilmesi tesla tarafından geliştirilen bir adaptör kullanacak belirtilenlere göre ford müşterileri tesla yapılan anlaşma sayesinde baharından itibaren iki kat fazla hızlı şarj cihazına erişebilecekkaynak,09.09.2023
musk geçenler fordu övmüştü övdüğü ortaya çıktı,09.09.2023
i̇şin başındayken süperşarj vs neyse tek standart olsun bir çevirici aparat uğraştırmayın,09.09.2023
ford stratejik olarak mantıklısını yapıyor umarım tesla fsd tam otonom sürüş yi paylaşmaya başlar konuda rakiplerinin önündeler,09.09.2023
fordun fişi muskın elinde artık,09.09.2023
usb abc derken usb c mutabık kaldığı teslada kendi geliştirdiği soketi teker teker piyasanın eski balinalarına kabul ettirmeye başladı tesla şarj noktaları amerikada dünyanın geri kalanında yaygın istasyon gurubu mecburen ayak uyduracaklar yada elektirikli araç satmakta zorlanacaklar buna benzer durum süper benzinden kurşunsuza geçerken olmuştu kurşunsuz çalışan araba benzinliklerde bir süre benzin bulamamıştı pompa girmediği,09.09.2023
hocam programa hala ihtiyacınız varsa sizin istediğiniz programın orijinalinin bulunduğu bir program şirketinde çalışıyorum,02.09.2023
kaliforniyada şimdiden yaygınlaştı toyota mirai almış otobanda pedalı kökleyerek gitmiş depoyu fullüyor depoyu fullemesi dk resime gitmek tıklayın,02.09.2023
tamam,02.09.2023
üretici menzili yıl yada bin km yakıt hücresi garantisiepeyde güzel duruyor,02.09.2023
ford dünya geneli aptallar tarafından yönetiliyor evet türkiyede koç resmen bitirdi fordu göz göre göre böyle bir marka yok edilir izin verilir anlam veremiyorum arkadaş tek derdiniz ticari satmak yan bir marka kurar oradan devam edersin,02.09.2023
gerçekten ilkimi enerji verimliliği pratiklik amaçlanıyor olsaydı hidrojenli araçlara ağırlık verilirdi elektrikli aracın altında kiloluk batarya pedala basıldığında veta yokuş yukarı çıkarken gereksiz enerji harcatır hidrojenli araçta depo kg benzinliden bile hafif araç kg menzil tırla taşınabilecek boyutta konteyneri bıraktığınız heryerde sadece su kullanarak hidrojen üretebiliyor resime gitmek tıklayın yakıt hücresi şimdilik garantili yaygınlaşırsa çıkar hidrojenli araca ödenen para kendisini türlü amorti eder elektrikli aracı hızlı şarjda full şarj harcanan saati amorti etmenin imkanı yok,02.09.2023
sanırım ford kullananlar yorumlarıma kızmış olayı hakaret boyutuna taşıyacak kadar göz karartmışlaren fazla elinizde bir modeli var kadar kızmak mantıklı değil hissedarı olsanız neyse onların bile kızmasına gerek yok yazdığım fordun ticari işleri tıkırındafocusun fişinin çekilme sebebi dünya suva kayıyor diyorlar sırada yılında dünyada satılan otomobil toyota corolla focus kaçıncı listede allah bilirben burada yorum değil tespit yapıyorum bunu yaparken işkembemden sallamıyorum satış rakamı trend gösteriyorumgelen cevap aklın yok fikrin varalmanya brezilya hindistan fabrikalarını satışlara yetişemediği kapattı zaten fordneyse rakamlarla bir cevap gelirse tekrar değerlendirme yaparız yoksa hayat kısa fordlar uçuyor kardeşim aynen,02.09.2023
geleneksel otomobil üreticileri süratle elektrikli otomobillere yöneliyor olsa ford firmalar dönüşümden kazanç elde etmekte zorlanıyor raporlar fordun ilk çeyrekte yalnızca elektrikli araç teslim ettiğini dönemde satılan elektrikli araba yaklaşık bin dolar kaybettiğini gösteriyor elbette fordun durumu tesla oldukça iyi ancak şaşırtıcı bir şekilde ford teslanın ceosu elon muskın tarafından övgü dolu sözlerle karşılandımusk fordun stratejisini akıllıca buluyormusk insanları forda karşı sert olmaya teşvik ediyor teknolojide radikal bir dönüşüm gerçekleştirmenin asla kolay olmadığının altını çiziyor hatta ileri giderek fordun elektrikli araç stratejisini övüyor yüksek talep gören lightninge övgüler yağdırıyor fordun elektrikli araçlarla ilgili genel stratejisinin akıllıca olduğunu düşünüyorum otomobil endüstrisinin elektrikli araçlara geçişinde lider olduğu birçok alan var bunlardan marj seviyeleri neredeyse eski otomobil üreticileri elektrikli araçlara geçme yoluna girmiş olsa çoğu araçları satarak para kazanmakta zorlanıyor çoğu üretici elektrikli araçları zararına bir pozitif marjla satıyor arada tesla araçlarını yüzde brüt kar marjı yüzde net işletme marjı satmayı başarıyorford elektrikli araç model e iş birimini ayırmasından yana ilk elektrikli araç programlarının arkasındaki finansal bilgileri detaylandırdı elektrikli araç işinin anda yüzde negatif marj ürettiğini doğruladıayrıca bkzmakyajlı peugeot tanıtıldı yeni tasarım güçlü elektrikli versiyonmuskın forda yönelik olumlu sözleri tesla eski otomobil üreticisi arasındaki fiyat savaşının hızıyla devam ettiği bir zamanda geldi tesla ford mustang machenin ana rakibi model y suv dahil olmak üzere araçlarının fiyatlarını yıl altı düşürdü ford rekabetçi kalabilmek karşılık vermek zorunda kaldı arada tesla yıl elektrikli suv modeli cybertruckı çıkarmayı planlıyor doğrudan lightning rakip olmayı hedefliyorkaynak,02.09.2023
hmmm elon fordu övüyorsa demek yakında fordu satın alacak demektir,02.09.2023
bence satin almak isteseydi ovmek yerine degerini dusurmek amaciyla yererdi ovdugune gore mevcut ford hisselerini satmak istiyor herhalde desek mantikli olabilir,02.09.2023
sen övme senin övdüğün üç gün yaşamıyor,02.09.2023
an otomotiv sektöründe ford kadar kötü yönetilen başka bir firma yoktur adı otomotiv tarihiyle anılan dünyada ilk seri üretim bandını kuran firma otomotiv sektöründen silinip gitmek üzere,02.09.2023
bilgisi olmadan fikri olanlar yorum yapmış yine milyonun üzerinde satarak satışlarını arttırabilen nadir otomobil üreticisinin arasındadır ford muska gelecek olursak ay öncesinde volkswageni övmüştü şimdi forda övgüde bulundu ford volkswagen yöneticileri teslayı övdüler kısacası firmalar arada sırada karşılıklı olarak birbirlerinin reklamlarını yaparlar normaldir,02.09.2023
elektrikli otomobil işi yakında patlar ben farklı teknolojilerin hidrojen avantajlı olduğunu düşünüyorum,02.09.2023
alınca çalışanların çoğunu kovar,02.09.2023
onunda önünde biraz zaman var,02.09.2023
fordun otomobil işleri yıllardır kötüye gidiyor kadar kalan modelin fişini çekiyorlarfiesta focus gerçi focusu vw golfle beraber vw üretecek bir anlaşmaları vardı galiba ticari araç yönündeyse epey karlılar satışları yüksek yüzden vwe araba yaptırdığı vw transporterı üretmeyi ford gölcük fabrikasına devrediyorduyani ford batmaz mitsubishi bir kamyonet markasına dönüşebilir,02.09.2023
bi zaman sonra fordu alıyormuş d,02.09.2023
fordu sadece tr pazarından ibaret mi sanıyorsunuz,02.09.2023
bir böyle bilmiş gülücük falan koyuyor böyle tiplemeler vallahi bayılıyorumaynen kardeşim focus fiesta sadece tr pazarına özel araçlardı onu artık bırakmaya karar verdiler avrupada abdde ganimet focus fiesta satıyorlar hatta mondeo hatta cortina satışları şuan uçuyor araç yetişmediği tr pazarını boşladılar sadece,02.09.2023
bilmediğiniz konular hakkında böyle kesin konuşmayın bence,02.09.2023
kartalus,02.09.2023
musk teslasinin arkasina alirim ford olurum lord yazdirmis diyolla,02.09.2023
öncelikle yorumunuz teşekkür ederim ben yine fordun binek otomobillerde hala oldukça önemli bir oyuncu olduğunu düşünüyorum amerikada bronco explorer escape edge mustang mach e expedition f serisi kamyonetler kamyonetler bildiğim kadarıyla ticari araç kategorisine sokulmuyor büyük satış rakamlarına sahipler avrupaya bakıldığında kuga puma ecosport mustang mach e suvlar fazla tercih ediliyor özellikle vw ortak geliştirilen explorer evin avrupada önemli bir pazar payına sahip olacağını düşünüyorum yıllara kadar gelecek olursak tabii zamanlar amerikan otomobillerinin mutlak bir hakimiyeti vardı bunu kimse inkar edemez günümüzeki satışlardaysa son yılda pandemi çip krizinden dolayı birçok firma fordun satışları etkilendi gayet iyi bir çıkış yaptılar bence çip krizinin olumsuz etkileri tamamen ortadan kalktığında satışları tekrar milyonu görebilir düşüncesindeyim,02.09.2023
beygirlik arabadan bekliyorsun,02.09.2023
haklısın araç eski hali böyle değildi otobanda hafif yokus oldugu zaman vites zorlanmasinda arabanin harareti geçiyor bi ariza olduğunu düşündüğüm icin yazdim,02.09.2023
merhabalar son bir kaç gündür kasis tümseklerde araba esnediğinde bariz bildiğiniz gacır gucur ses geliyor ön taraftan geldiğini tahmin ediyorum sorunun olduğunu öğrenmek istediğimle beraber değişmesi gerekecek parçaları hangi marka önerirsinizsorun burçlarda orjinal alıcağım parça alakalı sıkıntı varsa orjinale yakını tercih edeceğim malüm hayat şartlarıaklıma gelen parçalar ön takım içinsalıncaklarrot başırotilz rotviraj lastikleri orta viraj lastikleri ikisi atnı olabiliramortisör üst takozuarka takım torsiyon burçlarıhalde hazırda aks kafaları alakalı sıkıntı var araç life kalkmışken onlarıda aradan çıkartayım aks kafalarında hangi marka iyidir anka duydum lakin bulamadımarızanın nedeni sebebi alakalı parçaların orjinale yakın marka ismi olarak yardım önerilerinizi bekliyorumsaygılar,02.09.2023
benzinlikte bide kendin olc,02.09.2023
aynı sorunu fiesta aracımda yaşadım fren disklerini tornaladılar balatalar değişti sorun çözüldü,05.08.2023
hocam bende sorun vardı yazmıştım geçen senelerde diskleri tornalatmıştım belli bir süre sonra gene aynısını yaptı tornadan sonra diskleri komple değiştirdim maşalla tık yok tornadan ziyade değiştirmekte fayda var düşünüyorum,02.09.2023
öncelikle selamın aleyküm bugün aracımla eve dönüyordum ışıklarda fan sesini duymaya başladım normalde aracım fan açtığı zaman saniye açar sonra kapatırdı kapatmadı sürekli çalışmaya devam ediyordu bende bir terslik olduğunu hissettim aracımı kenara çektim kaputu açtığımda radyatör üst hortumundan su akıtıyordu aracı park halinde bıraktım akşam geri gittiğimde genleşme kabındaki su bitmişti hepsini akıtmıştı çatlak delik noktayı bulmak su ekledim akıtmaya başladı fakat radyatör üst hortumundan değil onun hemen dibinde buluna demir bir borunun girişinden akıttığını fark ettim üst radyatör hortumuna değdiği oradan sızıyor zannetmişim borunun borusu olduğunu bilmiyorum arkadaşımın kalorifer borusu olabileceğini söyledi horumun diğer ucu genleşme kabının hortumuyla y borusu aracılığı buluşup radyatöre gidiyor borusu olduğunu bilen var tamiri kadara mal olur teşekkürler,02.09.2023
ford focus aracıma pil tüp taktırdım bagaj küçüldü yetmedi sonra simit tüp taktırdım bagajım yine küçüldü bagajı küçülmeyen bir lpg tankı tipi varmı yada bir proje uygulayabilirim,26.08.2023
