review,date
fordun avrupadan çekileceğini söyleyenler fazlasıyla yanılıyor ford zaten ticari araçlarıyla avrupada oldukça iyi bir konumda bunun yanı sıra dünya genelinde suva yöneliş olduğundan fiesta focus mondeo modellerinin fişini çekmeleri normal kuga puma hatta çıkarttıkları ecosportun bile satışları gayet iyi elektriklide yüksek fiyatı olmasına rağmen mach e modeli satışlarda başarılı bir performans sergiliyor yakın gelecekte avrupa vw ortak şaseye sahip tane yeni elektrikli araç piyasaya sunulacak vw ortak otomobil geliştirmeleri iyi ortaklık otomobillerin üretim maliyetini önemli ölçüde düşürecektir fordun avrupadaki konumunu güçlendirecektir kısacası elektrik teknolojisiyle birlikte otomobil sektörü yeni bir çağa giriyor gmnin elektrikli otomobillerle avrupaya geri dönmeyi planladığı dönemde fordun avrupadan çekilmesini beklemek abes olur,12.08.2023
merhaba kıymetli arkadaşlarım değer verip okuduğunuz yardımcı olduğunuz teşekkür ederim kendim mesleğimden dolayı günlük hayatın akışına etki edebilecek olan işlerle ilgilenemiyorum annem çalışan bir birey araba ona aityaklaşık yıldır severek kullandığı aracında ay önce yakıt enjektörleri arızalandı araç çekişten düştü motor uyarısı vs verdi sonuç olarak arızayı enjektörleri değiştirterek çözümledim ancak şuan araç km yakıyor problemi çözebilmek adına ankarada şaşmaz oto sanayine gittim katalitik konvertör içindeki filtrenin bittiğini söylediler kesip filtreyi içinden çıkardılar gerçektende yanmış bir filtre karşı karşıya kaldım onu söküp attılar içi boş bir şekilde tekrar kaynatıp arabaya bağladılar katalitik konvertörü devamında egryi iptal ettiler yazılımsal olarak dünyanın parasını ödedim sonuç halen aynı l yakmaya devam ediyor yakıt konusunun dışında aracın rölantisinde bir problem var arabayı titretecek derecede sarsıntı yapıyor motor bir miktar çalıştıktan sonra araca ilk hareketlenmeyi verirken stop ediyor çekmiyor sorunlar karşısında çaresiz çözümsüz kaldım gittiğim yerlerde cebimden para almaktan başka hiçbir yapmadıklarını fark ettim çözümü burada bulabileceğim umuduyla foruma konu açtım yardımlarınız önerileriniz teşekkür ederim,05.08.2023
resime gitmek tıklayın aracını bir buraya götür baktır derim i̇yi ustadır,12.08.2023
model t manuel dijital göstege değişirmi mevcut olan numara kullanmak i̇stedi̇ği̇m numara resime gitmek tıklayın resime gitmek tıklayın,05.08.2023
hp olanı milyon olmuş buna milyon isterler,05.08.2023
ecoboost başarılı bir motor epey abartmışsınız örneğin snde snde sıfırdan yüze çıkıyor i̇kisinin kağıt üstü verisi puma stden kötü gerçek dünyada puma fwd olması manuel şanzımanı yüzünden kalkışta ara hızlanmada araçları öyle abartılacak şekilde tokatlayamaz iyi kalışta bile bir boy öne geçersiniz kadar hatta çoğu kalkışta optimum tutunma olmayacağı xdrive bir gerisine düşer ara hızlanmadan falan bahsetmiyorum silindirin dezavantajı orada hissediliyor,05.08.2023
aracın fiyatı tl manuel geliyormuş bg,05.08.2023
fiesta st bıle ozel sıparısle pahalıdan geldı buda cok pahalıdan kakalayacak cok fazla kısı bulamazlar artık elektrıklı gecısı basladı bunun elektrıklısıde avrupada cıkmıstır muhtemelen elde kalan kadar arac varsa turkıyeye yolamaya basladılar tum fırmalar,05.08.2023
konuda evet fiesta st den hızlı pist şartlarında avrupada benzer fıyatlarla satıldılar n cok ucuza satıldı ulkemızde şartlarda katı fıyat vermektense almak mantıklı tabıkı ulkemızde illa pistte yarısılıyorsa arkadakı arac ruzgar korıdoruna girince aradakı fark onemsız duzluk sonu virajda atak yapıp gecebılır yanı sıkıntı olmaz,05.08.2023
yeni arabaların artık silindir düşük devirlerde fazla tork üretebildiği tercih ediliyor eski atmosferik silindir karıştırmayın tek eksisi gaza basınca motor sesi duyuluyor,05.08.2023
evet silindir olayı tartışılabilir silindir olmaması gerektiği bir durum var aksi halde sizin dediğiniz silindir olacaktı muhtemelen,05.08.2023
silindir olmaması gerektiği bir durum var sankievet var öyle bir durum maliyetotomotiv üreticileri maliyeti kısmak artık yapacaklarını şaşırdılar yakında silindir motorlar çıkaramaç belli maliyetle üretip satmak tüketim,05.08.2023
maaliyet mantıklı bir sebep öncelikli sebep olduğu konusunda şüpheliyim bana galiba motorun dayanıklılığı ilgili bir seçimmiş geldi,05.08.2023
dış tasarımını beğendiğim bir araç ford megabox bagajı gayet kullanışlı yıkanabiliyor olması hoş sevmediğim tarafı aracına kopyala yapıştır koktip koyma be kardeşim direksiyonu beğeniyorum orta ekranı falan ford çoğu modelde aynı bide araca elektronik park freni koy yıl artık olmuş,05.08.2023
tasarımı güzel ortadaki ekranın hali öyle estetikten yoksun model plazma tv çerçevesi,05.08.2023
motor iyi,05.08.2023
güzel yıl önce bi ihtimal alabilirdim,05.08.2023
senede durduğum yerde kadar fakirleştim lanalabileceğim araçların sksen almam seviyesine yükseldi,05.08.2023
ülke insanına st rs wrx sti şeyler lüks artık m amg quattro olaylarına girmiyorum bile,05.08.2023
arka profilden fotoğrafı yok çirkin,05.08.2023
yeni hükümet ötv leri indirirse güzel olur güzel araçlar çıkıyor garabet sistem yüzünden anca izliyoruz,05.08.2023
yeni hükümet ötv değil bayrağı bile indirir,05.08.2023
fordun ceosu açıklama yapmıştı artık suvlara öncelik vericeklermiş yakın zamanda farklı suv modelleride görürüz,05.08.2023
ampülcülerin ıslak rüyası,05.08.2023
iyilerini kullanıyorum kral sen beni merak etme,05.08.2023
eyvallah fakat ben silindir turbo beygir benzinli motorolmasını silindirli motorlar ucubedir dengesizdir,05.08.2023
ps moedli var bende güzel uzuyor araç sürüş keyfi mükemmel memnunuz bunun bir hali fena birşeydir kullanmadan yorum yapanlara aldanmayın güzel araç,05.08.2023
konu silinebilir,05.08.2023
merhaba arkadaşlar ay önce model fiesta aldım experde turboda yağlanma var demişlerdi turboyu revize ettirdim komple kartel içindeki turbonun yağ süzgecine varana kadar değiştirdim usta saçma sapan bı yağ koyması sebebiyle motrio bir marka ondan sonra aracımda bı şakırtı sesi gelmeye başladı öncesinde koyuyormus benden önceki sahibi araç rölantide bir sesi yok devir deviri geçince lifterlerden ses geliyor ısınınca ses devirlere kadar düşüyor ses şiddetleniyor özel servise gittim lifterler değişicek dedi orjinal malzeme hepsini yağ birlikte değiştirdik motul a geçtik seste hiçbir değişiklik olmadı ustanın sebebi deneme yanılma oldu dedi araçtan soğudum ses nedir neyden yapar usta şimdi yağ pompasından yapar yada silindir kapağı değişicek dedi aynı sorunu yaşayan varmı benim araştırmama göre lifter sesi sürekli gelen bir ses ısınınca geçen bir ses benimki geçmeyi bırak dahada artıyor,29.07.2023
ford son dönemde ikonik modelleri fiesta focusun üretimini sonlandırmak önemli kararlara imza attı kapsamda ford focus küçük kardeşi emekliye ayrılacak iki önemli ismi ileride yeniden görür müyüz bilinmez ancak onların yerini bir dizi yeni elektrikli aracın alacağı aşikârsözünü ettiğimiz araçlardan ilki yılın başında hakkındaki ilk ipuçlarını gördüğümüz elektrikli crossover olacak önce karanlık olsa silüetini gördüğümüz araçla ilgili bugün yeni bir ipucu paylaşıldı ford model e avrupa takımının genel müdürü martin sander tarafından paylaşılan fotoğrafta crosssoverın farlarını tampon tasarımını aerodinamik jantlarını kısmen olsa görebiliyoruzayrıca bkzelektrikli hyundai ioniq son çeyreğinde türkiyede satışa sunulacakbazı ufak detaylar dışında fordun yeni elektrikli crossover modeliyle ilgili birçok şimdilik gizemini koruyor söz konusu model fordun almanyanın köln şehrinde üretilen ilk elektrikli binek aracı olacak yılında satışa sunulması planlanan araç volkswagen grubunun geliştirdiği meb platformunu temel alacak dolayısıyla teknik detayların platform ikizi volkswagen aynı benzer olmasını bekleyebilirizkuga benzer boyutlarda olmasını beklediğimiz yeni elektrikli crossover ford otosan tarafından romanyada üretilecek olan tamamen elektrikli pumanın üzerinde konumlanacak teknik detaylar henüz belli değil ancak tek şarjla wltpye göre km menzil sunabileceği konuşuluyor konuyla ilgili detaylar geldikçe değerli okurlarımıza aktarmaya devam edeceğizford binek hafif ticari araç tarafında elektrik atağına kalkmış durumda mevcut mustang machenin yanı sıra pumanın elektrikli versiyonu haberimizde konu olan mediumsize crossover coupesuv stiline sahip olmasını beklediğimiz sport crossover karşımıza çıkacak olan marka yılında avrupada bin adedin üzerinde elektrikli araç satan bir marka haline gelmek istiyor,29.07.2023
fordvolkswagen işbirliği büyüdükçe büyüyor,29.07.2023
dizel otomatik up,29.07.2023
ecoboost tdci kullandım şuan tdci kullanıyorum tdci hantal düz vites olduğu yoruyor insanı tdci diğer ikisine göre kıyaslanırsa tam bir havyan ancak ecobootta son derece yeterli ayrıca şanzımanı sorunsuz ancak böyle uzamıyor hissiyatı veriyor insana sakin kullanım tarzına sahipseniz ülke şartları yakıtbakım aracın üzerindeki motor güncelliği dizelin piyasadan kalkacak olması vs ecoboost tercih edilebilir ford forumlarına bir bakın kronik arızaları var arıza yapıyor mondeolar trde fordun motor şanzıman kombinasyonun kötü olması tdci otomatik vites koymaması hemde passatın sevilmesi dsg şanzımanın seri olması bir grubu aracı zorlarsan bol arızalıdır nedeniyle tutulmasa harika araçlardır rampada araç devrindeyse ecoboost olan yada quattro denk gelmezse kimse size selektör yapmaz tecrübeyle sabit birde aracı titanium paket altı almayın,29.07.2023
ecobost motor başarılı duruyor ancak günümüz koşullarında motor hacimgüç oranı konusunda yeterli değil mustang hacimli motor gelenek haline gelmiş tamam litre başına beygir bence haliyle motorlu versiyon satmak pazalama stratejisine kurban edilmiş duruyor modifiyeciler koleksiyoncular ilgi duyar çoğu kimse kadar güç farkı litre motorlu mustang almaz,29.07.2023
sırada hp turbolu motora ekmek banmaya çalışan türkolar,29.07.2023
güzel,29.07.2023
senin arabayla alakası yok zaten yorumu tekrar okursan anlarsın,29.07.2023
amerika dan yazıyorum durum pek öyle değil evet eco motor satış olarak başarılı yine aynı şekilde gt motorunun litre başına beygir performansı düşük ayrıldığımız kısım gt versiyon amerika sadece koleksiyoncuların modifiye tutkunlarının tercih ettiği bir model değil hele eco modelini satmak pazarlama stratejisi değil amerika bir zaman litre başına beygir performansı birinci öncelik olmadı adamların büyük motor alışkanlıkları var sadece sedanlarda değil sınıflarda özellikle gençlerde fazla görülen araçlar mustang challenger charger camaro sokaklar araçların sesleriyle dolu sabahları alarm gt li komşuların araç çalıştırma sesleriyle uyandığımız oluyorbiraz abartayım dedim kusura bakma kısacası satılıyor modeli yine satılacak,29.07.2023
amerikan kası,29.07.2023
yazık öyle elektrikli arabaları sevsem modern teknoloji kuşatılmış oldukları karbon emisyon düzenlemesiyle zaten hepimizin hayallerini süsleyen yüzlerce efsane klasik model araçların kullanımı yasaklanmış oldu içten yanmalı araç göremeyeceğiz artık kovalamacayı hatırlıyorum araba ilanlarına bakınca aynı duyguları yaşıyorum,29.07.2023
anca wallpaper yapar geçeriz elin amerikalısının yüzüne bakmayacağı cliolar sümbüller bin lira olmuş yakında milyonu görürler asgari ücretli birinin hiçbir yemeden içmeden fiyatlar zamlanmamak koşuluyla sene birikim yapması lazım araba alabilsin güzel ülkem uyuyun,29.07.2023
pahalı aw gereksiz pahalı,29.07.2023
araçtaki amaç türkiye değil şekilde bakmayın tamamen avrupaya emisyonları gözeterek yapılmış ford türkiyede courier üretiyor satıyor itibaren ford otosan romanya fabrikasında üretilmeye başlanacak puma birlikte avrupadan gelmesine rağmen puma courier rekabetçi fiyattan gelir,29.07.2023
fıyata ticari aracmı olurmus kımsenın almadıgı bellı,29.07.2023
motor caddy alamıyoruz bunuda alalım türkiye vergi olayından dolayı motor aşırı pahalı birde bir vergisi düşüyor tarz araçların motor olarak çıkması lazımki satış ta hemde satış sonrası cazip olsun sözde hybrid motorla geleceklerdi keşke öyle olsaydı,29.07.2023
tl ye opel combo aldık dizel ford kafayı yemiş,29.07.2023
yine arka camlar açılmıyor yine arkadakı yolculara hayvan muamelesi hayvan dediysem lafın gelişi zira hayvanın cam açıp ferahlamaya ihtiyacı olabilir zama arkadaki yolcuya cansız bir mal muamelesi yapılıyor desek uygun kafayla devam et ford hatta kapılar açılmasın koltuk koyma yolcuları bagajdan yükleyip üst üste istifleyelim,29.07.2023
harika olmuş,29.07.2023
zaman aldınız hocam,29.07.2023
kasım ayının sonunda liste fiyatından tl bir indirimle aldık uşak ardenden tl sıfır faizli kredi verdiler,29.07.2023
iyi fiyata almışsınız hocam hayırlı olsun,29.07.2023
litre motorla ülkemiz vergi sistemini düşünürsek pek mantıklı olmamış,29.07.2023
hibrit seçeneği olsa iyi olurmuş,29.07.2023
ford caddy renault citan peugeot doblo derken hafif ticari araç sektörü maliyet endişesi nedeniye resmen brezilya dizisine döndü,29.07.2023
hususi olarak caddy halini kullanıyorum oldukça memnunum,29.07.2023
opelin yıllar önce cdti motoru beygir nm tork sunuyordu yıllar sonra motorla kötüsünü sunmayı başarmışlar,29.07.2023
ticari araçların vergilendirmesi otomobil değil motor hacmi oranı değiştirmiyor,29.07.2023
artık uymaları gereken sıkı emisyon kuralları var,29.07.2023
litre olması kötü olmuş ticarilerin vergilerinde dilim var zaten altı üstü litre olunca yüksek vergi dilimine girmiş kimse almaz,29.07.2023
şuan satılan kasa tutmadı zaten aynı şekilde buda tutmazekurisi cadyde aynıberlingopartnercombo seriye yeni eklenecek doblo kardeşler ticari pazarını süpürür,29.07.2023
yeni doblo büyük ihtimal psa motoru gelecektir olur fiat kendi mutijetini koyarsa tekrar sınıfında satanlar arasına girer düşünüyorum bekleyelim görelim bakalım,29.07.2023
aşırı pahalı bandında bekliyordum ford zaten sadece ticari satıyor onuda satamayacak belli oldu,29.07.2023
başlangıç fiyatı bin tl olmuşgerçekten ticari olmuş,29.07.2023
fiyatı olmamış i̇nsanlar arabanın orjinali olan caddyi alır,29.07.2023
tasarımı güzel binek bile alınır hız limiti sorun değil zaten,29.07.2023
önü reno arkası cadyy,29.07.2023
fordvw ortaklığı meyvelerini veriyor ticari araçta,29.07.2023
escort yılında üretimi sona ermeden önce kapsamlı olarak yılında makyajlanan lt karburatörlü hp lt enjeksiyonlu hp lt hp idi önce sonra hp oldu motorlarla sedan hatchback station wagon karoser ülkemizde satılan otomobil hplik lt hacimli motor ülkemizde zamanında pek rakibi arasından sıyrılmasına yardım etmekteydi kompakt sınıftaki ithal rakiplerinden güçlü motoru uygun fiyata sunan aracın kglık boş ağırlığı performanslı olmasında önemli bir etkendi kmsye snde çıkabilen hplik escort maksimum kms hıza ulaşmakta idi km karma mesafede ortalama lt tüketen motor zamanına göre tüketiyor bile denebilirdi,29.07.2023
motor çekmeyip avans vuruyordur,29.07.2023
ford fiesta yeni kasa aracımda tamirdeyken kontak arızasından dolayı kontak değişimi yapmıştı anahtarcı kontak arızası gıderıldı aracımı teslım aldıkdan sonra merkezi kilit çalışmadıgını gordum kumanda aktif çalışıyor araçta etki etmiyor neyden kaynaklanabılır burdakı kımse pek anlayamıyor guvende vermıyor,29.07.2023
